id,title,start_date,end_date,synopsis,mean,rank,popularity,num_list_users,num_scoring_users,nsfw,media_type,status,genres,num_episodes,source,average_episode_duration,rating,studios,all_ranking,Unnamed: 27,Unnamed: 28,Unnamed: 29,Unnamed: 30,Unnamed: 31,broadcast_day_of_the_week,broadcast_start_time,start_season_year,start_season_season,statistics_watching,statistics_completed,statistics_on_hold,statistics_dropped,statistics_plan_to_watch,statistics_num_list_users,positive_viewership_fraction,negative_viewership_fraction
39547,Yahari Ore no Seishun Love Comedy wa Machigatteiru. Kan,2020-07-10,2020-09-25,"Resolved to become a more independent person, Yukino Yukinoshita decides to smoothen things out with her parents, and the first step toward achieving that goal is to prove herself.

As graduation draws closer for the third-year students, Iroha Isshiki—the president of the student council—requests a graduation prom in collaboration with the Volunteer Service Club. Yukino accepts this request of her own volition, hoping to use it as a chance to demonstrate her self-reliance, but what lies ahead of her may prove to be a hard hurdle to cross.

Yahari Ore no Seishun Love Comedy wa Machigatteiru. Kan revolves around the graduation prom as emotions are poured into the preparations for the event. At the same time, a chance for the Volunteer Service Club members to better understand each other presents itself. And thus, Hachiman Hikigaya's hectic and bittersweet high school life begins to draw to a close.

[Written by MAL Rewrite]",8.35,226.0,272,761732,420182,white,tv,finished_airing,"[{'id': 4, 'name': 'Comedy'}, {'id': 64, 'name': 'Love Polygon'}, {'id': 22, 'name': 'Romance'}, {'id': 23, 'name': 'School'}]",12,light_novel,1461,pg_13,"[{'id': 91, 'name': 'feel.'}]",226,,,,,,friday,01:58,2020.0,summer,51342,516593,16055,10495,167196,761681.0,0.9651,0.0349
9617,K-On! Movie,2011-12-03,2011-12-03,"Graduation looms for the founding members of the Light Music Club. With only a few precious weeks of school left, the girls decide to make the most of it and plan a trip abroad. Hawaii, New York, Dubai—many destinations are suggested, but after a little help from the club's precious pet turtle, Ton-chan, London is chosen as the host of their next misadventure!

Yui Hirasawa, Mio Akiyama, Tsumugi Kotobuki, Ritsu Tainaka, and Azusa Nakano will visit famous landmarks, perform live music for Londoners, and eat all sorts of delicious food, all while stumbling clumsily from place to place. But the fun won't last forever, as heartfelt songs and goodbyes will be made as their high school days together come to a close. One thing is for certain though: the undeniable friendships these girls have formed is something that will carry on long after the final scene rolls.

[Written by MAL Rewrite]",8.35,227.0,738,339485,200321,white,movie,finished_airing,"[{'id': 46, 'name': 'Award Winning'}, {'id': 52, 'name': 'CGDCT'}, {'id': 4, 'name': 'Comedy'}, {'id': 19, 'name': 'Music'}]",1,4_koma_manga,6600,pg_13,"[{'id': 2, 'name': 'Kyoto Animation'}]",227,,,,,,NIL,NIL,2011.0,fall,5503,260069,2309,1226,70363,339470.0,0.9896,0.0104
572,Kaze no Tani no Nausicaä,1984-03-11,1984-03-11,"A millennium has passed since the catastrophic nuclear war named the ""Seven Days of Fire,"" which destroyed nearly all life on Earth. Humanity now lives in a constant struggle against the treacherous jungle that has evolved in response to the destruction caused by mankind. Filled with poisonous spores and enormous insects, the jungle spreads rapidly across the Earth and threatens to swallow the remnants of the human race.

Away from the jungle exists a peaceful farming kingdom known as the ""Valley of the Wind,"" whose placement by the sea frees it from the spread of the jungle's deadly toxins. The Valley's charismatic young princess, Nausicaä, finds her tranquil kingdom disturbed when an airship from the kingdom of Tolmekia crashes violently in the Valley. After Nausicaä and the citizens of the Valley find a sinister pulsating object in the wreckage, the Valley is suddenly invaded by the Tolmekian military, who intend to revive a dangerous weapon from the Seven Days of Fire. Now Nausicaä must fight to stop the Tolmekians from plunging the Earth into a cataclysm which humanity could never survive, while also protecting the Valley from the encroaching forces of the toxic jungle.

[Written by MAL Rewrite]",8.35,228.0,631,390572,244288,white,movie,finished_airing,"[{'id': 2, 'name': 'Adventure'}, {'id': 46, 'name': 'Award Winning'}, {'id': 10, 'name': 'Fantasy'}]",1,manga,7022,pg_13,"[{'id': 363, 'name': 'Topcraft'}]",228,,,,,,NIL,NIL,1984.0,winter,5182,312884,2206,1218,69057,390547.0,0.9912,0.0088
49926,Kimetsu no Yaiba: Mugen Ressha-hen,2021-10-10,2021-11-28,"A mysterious string of disappearances on a certain train has caught the attention of the Demon Slayer Corps, and they have sent one of their best to exterminate what can only be a demon responsible. However, the plan to board the Mugen Train is delayed by a lesser demon who is terrorizing the mechanics and targeting a kind, elderly woman and her granddaughter. Kyoujurou Rengoku, the Flame Hashira, must eliminate the threat before boarding the train.

Sent to assist the Hashira, Tanjirou Kamado, Inosuke Hashira, and Zenitsu Agatsuma enter the train prepared to fight. But their monstrous target already has a devious plan in store for them and the two hundred passengers: by delving deep into their consciousness, the demon intends to obliterate everyone in a stunning display of the power held by the Twelve Kizuki. 

[Written by MAL Rewrite]",8.35,229.0,236,834286,501102,white,tv,finished_airing,"[{'id': 1, 'name': 'Action'}, {'id': 13, 'name': 'Historical'}, {'id': 27, 'name': 'Shounen'}, {'id': 37, 'name': 'Supernatural'}]",7,manga,1455,r,"[{'id': 43, 'name': 'ufotable'}]",229,,,,,,sunday,23:15,2021.0,fall,41923,713871,6145,10676,61622,834237.0,0.9798,0.0202
53540,Meitantei Conan Movie 26: Kurogane no Submarine,2023-04-14,2023-04-14,"This time's location is set in the sea near the Hachijo-jima island, Tokyo. Engineers from around the world have gathered for the full-scale operation of ""Pacific Buoy,"" an offshore facility to connect security cameras owned by the worldwide police forces. A test of a certain ""new technology"" based on a face recognition system is underway there.

Meanwhile, Conan and the Detective Boys visit Hachijo-jima at Sonoko's invitation and receive a phone call from Subaru Okiya informing them that a Europol employee was murdered in Germany by the Black Organization's Jin.

Conan, who is disquieted, sneaks into the facility and finds that a female engineer has been kidnapped by the Black Organization...! Furthermore, a USB drive containing certain information in her possession ends up in the hands of the organization... A black shadow also creeps up on Ai Haibara ...

(Source: Crunchyroll, edited)",8.35,230.0,5751,14429,6818,white,movie,finished_airing,"[{'id': 1, 'name': 'Action'}, {'id': 39, 'name': 'Detective'}, {'id': 7, 'name': 'Mystery'}, {'id': 27, 'name': 'Shounen'}]",1,manga,6540,pg_13,"[{'id': 73, 'name': 'TMS Entertainment'}]",230,,,,,,NIL,NIL,2023.0,spring,468,8888,139,168,4762,14425.0,0.9787,0.0213
60108,One Piece: Gyojin Tou-hen,2024-11-03,airing,A special edited version of the Fish-Man Island arc from One Piece with an enhanced contemporary visual look.,8.35,231.0,4554,25757,3725,white,tv,currently_airing,"[{'id': 1, 'name': 'Action'}, {'id': 2, 'name': 'Adventure'}, {'id': 10, 'name': 'Fantasy'}, {'id': 27, 'name': 'Shounen'}]",21,manga,1430,pg_13,"[{'id': 18, 'name': 'Toei Animation'}]",231,,,,,,sunday,09:30,2024.0,fall,13664,4,381,323,11384,25756.0,0.9727,0.0273
57181,Ao no Hako,2024-10-03,airing,"Every morning, incoming first-year Taiki Inomata hurries to his high school gym in order to further refine his badminton skills. However, his true motivation stems from sharing the otherwise empty gym with second-year Chinatsu Kano, Taiki's crush and the star player of the girls' basketball team. Although Chinatsu seems unapproachable, Taiki gradually finds opportunities to get to know her little by little.

Unbeknownst to Taiki, his tireless work ethic and admiration motivate Chinatsu to work harder and strive to achieve her greatest ambitions. When her family must suddenly move overseas for work, Chinatsu decides to remain in Japan and shoot for victory at the national level. With nowhere to stay, she is taken in by Taiki's mother, who is longtime friends with Chinatsu's own. Overwhelmed with the new reality of living alongside the girl he loves, Taiki resolves to join Chinatsu at the national level in his own sport—and grow closer to her in the process.

Still, despite being good enough to catch his coach's eye, Taiki must fight an uphill battle to qualify for a spot on the starting team. Cheered on by both Chinatsu and gymnast Hina Chouno, his childhood friend, Taiki aims to make a name for himself among his powerful upperclassmen.

[Written by MAL Rewrite]",8.35,232.0,1496,165717,27873,white,tv,currently_airing,"[{'id': 22, 'name': 'Romance'}, {'id': 23, 'name': 'School'}, {'id': 27, 'name': 'Shounen'}, {'id': 30, 'name': 'Sports'}, {'id': 77, 'name': 'Team Sports'}]",25,manga,1433,pg_13,"[{'id': 94, 'name': 'Telecom Animation Film'}]",232,,,,,,thursday,23:56,2024.0,fall,96913,13,2188,2040,64555,165709.0,0.9745,0.0255
2251,Baccano!,2007-07-27,2007-11-02,"During the early 1930s in Chicago, the transcontinental train, Flying Pussyfoot, is starting its legendary journey that will leave a trail of blood all over the country. At the same time in New York, the ambitious scientist Szilard and his unwilling aide Ennis are looking for missing bottles of the immortality elixir. In addition, a war between the mafia groups is getting worse. On board the Advena Avis, in 1711, alchemists are about to learn the price of immortality.

Based on the award-winning light novels of the same name, Baccano! follows several events that initially seem unrelated, both in time and place, but are part of a much bigger story—one of alchemy, survival, and immortality. Merging these events together are the kindhearted would-be thieves, Isaac and Miria, connecting various people, all of them with their own hidden ambitions and agendas, and creating lifelong bonds and consequences for everyone involved.

[Written by MAL Rewrite] ",8.35,233.0,195,924576,388104,white,tv,finished_airing,"[{'id': 1, 'name': 'Action'}, {'id': 50, 'name': 'Adult Cast'}, {'id': 13, 'name': 'Historical'}, {'id': 7, 'name': 'Mystery'}, {'id': 68, 'name': 'Organized Crime'}, {'id': 37, 'name': 'Supernatural'}]",13,light_novel,1480,r,"[{'id': 112, 'name': ""Brain's Base""}]",233,,,,,,friday,00:30,2007.0,summer,45584,451171,37391,24323,366071,924540.0,0.9332,0.0668
6945,Gintama: Shiroyasha Koutan,2008-09-21,2008-09-21,"According to Aniplex, a 10min short anime of Gintama ""Shiroyasha Koutan"" will be released on September 30th. It was shown at Jump Super Anime Tour 2008 and had never been released as a DVD.

It's a trailer of an imaginary Gintama movie. Gintama OVA shown at Jump Anime Tour '05 is also included in the DVD.",8.35,234.0,2689,71910,35308,white,special,finished_airing,"[{'id': 1, 'name': 'Action'}, {'id': 4, 'name': 'Comedy'}, {'id': 13, 'name': 'Historical'}, {'id': 20, 'name': 'Parody'}, {'id': 24, 'name': 'Sci-Fi'}]",1,manga,600,pg_13,"[{'id': 14, 'name': 'Sunrise'}]",234,,,,,,NIL,NIL,2008.0,summer,1554,51720,671,593,17367,71905.0,0.9824,0.0176
39167,Girls & Panzer: Saishuushou Part 4,2023-10-06,2023-10-06,"The Winter Continuous Track Cup semifinals are underway and Ooarai Girls’ Academy find themselves in deep trouble early in their match against Continuation High School. The Anglerfish Team are knocked out by Continuation's sharpshooter, forcing the rest of the team to use a different game plan. Stepping up in the absence of her star teammates, Azusa Sawa shows her leadership potential by temporarily taking over as Ooarai's commander. However, the match proves that it will take more than a new strategy for Ooarai to survive this time around.

On the other side of the tournament, Kuromorimine Girls' Academy and St. Gloriana Girls' College are locked in a fiery desert battle. Having developed her own unorthodox tactical style, Erika Itsumi rallies Kuromorimine from the brink of defeat into a fierce showdown against their opponent's veteran commander, Darjeeling. But St. Gloriana have bolstered their ranks with a familiar face who recently transferred to their school, hampering Kuromorimine's quest for victory.

The championship round is within striking distance for these four schools, but only two will have what it takes to move on!

[Written by MAL Rewrite]",8.35,235.0,5097,19648,5429,white,movie,finished_airing,"[{'id': 52, 'name': 'CGDCT'}, {'id': 38, 'name': 'Military'}, {'id': 23, 'name': 'School'}]",1,original,3246,pg_13,"[{'id': 60, 'name': 'Actas'}]",235,,,,,,NIL,NIL,2023.0,fall,518,7011,191,112,11814,19646.0,0.9846,0.0154
777,Hellsing Ultimate,2006-02-10,2012-12-26,"There exist creatures of darkness and evil that plague the night, devouring any human unfortunate enough to be caught in their grasp. On the other side is Hellsing, an organization dedicated to destroying these supernatural forces that threaten the very existence of humanity. At its head is Integra Fairbrook Wingates Hellsing, who commands a powerful military and spends her life fighting the undead.

Integra's vast army, however, pales in comparison with her ultimate weapon: the vampire Alucard, who works against his own kind as an exterminator for Hellsing. With his new vampire servant, Seras Victoria, at his side, Alucard must battle not only monsters, but all those who stand to oppose Hellsing, be they in the guise of good or evil.

In a battle for mankind's survival, Hellsing Ultimate proves that appearances are not all they may seem, and sometimes the greatest weapon can come in the form of one's worst nightmare.

[Written by MAL Rewrite]",8.35,236.0,182,960650,497186,white,ova,finished_airing,"[{'id': 1, 'name': 'Action'}, {'id': 50, 'name': 'Adult Cast'}, {'id': 58, 'name': 'Gore'}, {'id': 14, 'name': 'Horror'}, {'id': 38, 'name': 'Military'}, {'id': 42, 'name': 'Seinen'}, {'id': 37, 'name': 'Supernatural'}, {'id': 32, 'name': 'Vampire'}]",10,manga,2962,r,"[{'id': 11, 'name': 'Madhouse'}, {'id': 41, 'name': 'Satelight'}, {'id': 894, 'name': 'Graphinica'}]",236,,,,,,NIL,NIL,2006.0,winter,81678,580223,44985,25296,228413,960595.0,0.9268,0.0732
185,Initial D First Stage,1998-04-19,1998-12-06,"Unlike his friends, Takumi Fujiwara is not particularly interested in cars, with little to no knowledge about the world of car enthusiasts and street racers. The son of a tofu shop owner, he is tasked to deliver tofu every morning without fail, driving along the mountain of Akina. Thus, conversations regarding cars or driving in general would only remind Takumi of the tiring daily routine forced upon him.

One night, the Akagi Red Suns, an infamous team of street racers, visit the town of Akina to challenge the local mountain pass. Led by their two aces, Ryousuke and Keisuke Takahashi, the Red Suns plan to conquer every racing course in Kanto, establishing themselves as the fastest crew in the region. However, much to their disbelief, one of their aces is overtaken by an old Toyota AE86 during a drive back home from Akina. After the incident, the Takahashi brothers are cautious of a mysterious driver geared with remarkable technique and experience in the local roads—the AE86 of Mount Akina.

[Written by MAL Rewrite]",8.35,237.0,607,403477,201523,white,tv,finished_airing,"[{'id': 1, 'name': 'Action'}, {'id': 8, 'name': 'Drama'}, {'id': 3, 'name': 'Racing'}, {'id': 42, 'name': 'Seinen'}]",26,manga,1500,pg_13,"[{'id': 36, 'name': 'Gallop'}, {'id': 126, 'name': 'Studio Comet'}]",237,,,,,,tuesday,00:00,1998.0,spring,28631,253430,14206,8180,99001,403448.0,0.9445,0.0555
10030,Bakuman. 2nd Season,2011-10-01,2012-03-24,"With the serialization of their new manga, ""Detective Trap,"" the writer-artist team, Akito Takagi and Moritaka Mashiro, better known by their pseudonym Muto Ashirogi, are one step closer to becoming world-renowned mangaka. For Mashiro, however, serialization is just the first step. Having promised to marry his childhood sweetheart and aspiring voice actress, Azuki Miho, once his manga gets an anime adaptation, Mashiro must continue his to popularize Ashirogi's work. A tremendously competitive cast of ambitious mangaka—including the wild genius, Eiji Niizuma; the elegant student, Yuriko Aoki, and her older admirer and partner, Takurou Nakai; the lazy prodigy, Kazuya Hiramaru; and the abrasive artist, Shinta Fukuda—both support and compete against Muto Ashirogi in creating the next big hit.

As they adjust to their young and seemingly untested new editor, the dynamic duo struggle to maintain their current serialization, secure the top spot in Shounen Jack, and ultimately, achieve an anime adaptation of their manga. With new rivals and friends, Bakuman. 2nd Season continues Takagi and Mashiro's inspiring story of hard work and young love.

[Written by MAL Rewrite] ",8.34,238.0,690,359969,216077,white,tv,finished_airing,"[{'id': 4, 'name': 'Comedy'}, {'id': 8, 'name': 'Drama'}, {'id': 69, 'name': 'Otaku Culture'}, {'id': 22, 'name': 'Romance'}, {'id': 27, 'name': 'Shounen'}]",25,manga,1470,pg_13,"[{'id': 7, 'name': 'J.C.Staff'}]",238,,,,,,saturday,17:30,2011.0,fall,11621,273952,7608,4878,61903,359962.0,0.9653,0.0347
41025,Fumetsu no Anata e,2021-04-12,2021-08-30,"An Orb, known only as It, is cast to Earth to be observed from afar. Capable of changing forms from beings whose reflections It captures, It first becomes a rock and then, due to the rising temperature, moss.

It does not move until one snowy day, a wolf at death's door barely crosses by. When It takes the animal's form, It attains awareness of its consciousness and starts to wander with an unclear destination in mind. Soon, It comes across the wolf's master—a young boy waiting for his tribe to return from a paradise abundant with fish and fruit in the south. Although the boy is lonely, he still hopes those whom he holds dear in his memories have not forgotten him and that he will reunite with them one day.

The boy wants to explore new surroundings and decides to abandon his home with It to find the paradise using the traces his tribe left behind. However, with a heavily injured body and no sight of his elder comrades, what will become of the boy?

Fumetsu no Anata e illustrates the story of an immortal being experiencing humanity, meeting all types of people in many places throughout time.

[Written by MAL Rewrite]",8.34,239.0,198,910633,385032,white,tv,finished_airing,"[{'id': 2, 'name': 'Adventure'}, {'id': 8, 'name': 'Drama'}, {'id': 27, 'name': 'Shounen'}, {'id': 37, 'name': 'Supernatural'}]",20,manga,1500,r,"[{'id': 112, 'name': ""Brain's Base""}]",239,,,,,,monday,22:50,2021.0,spring,158963,392011,51035,39923,268600,910532.0,0.9001,0.0999
46654,IDOLiSH7 Third Beat! Part 2,2022-10-02,2023-02-26,"IDOLiSH7 is more successful than ever, but no one is smiling because a new threat has taken the stage: the debuting idol group ŹOOĻ. Managed by the nefarious entertainment executive Ryou Tsukumo, they will stop at nothing to get their way, resorting to all kinds of underhanded tactics to bring down their rivals. TRIGGER's image has already been ruined by scandal, and IDOLiSH7 and Re:vale are headed for the same fate—or worse.

Meanwhile, Zero, the legendary idol who disappeared 15 years ago, continues to haunt the present through those he left behind. His manager seems to be in contact with Tsukumo for his own schemes, and Zero's songwriter reveals himself in a letter after having been missing for years. IDOLiSH7 finds an ally in Re:vale to thwart ŹOOĻ's plans while trying to make sense of Zero's colleagues' actions, but it may be impossible for everyone to emerge unscathed.

[Written by MAL Rewrite]",8.34,240.0,5587,15453,5051,white,tv,finished_airing,"[{'id': 8, 'name': 'Drama'}, {'id': 61, 'name': 'Idols (Male)'}, {'id': 19, 'name': 'Music'}]",17,game,1440,pg_13,"[{'id': 1103, 'name': 'TROYCA'}]",240,,,,,,sunday,22:30,2022.0,fall,1603,6373,362,450,6665,15453.0,0.9475,0.0525
338,Versailles no Bara,1979-10-10,1980-09-03,"In a time of class stratification and rising tensions amongst the impoverished population, the Austrian Empire sends Princess Marie Antoinette to France to be wed to Crown Prince Louis XVI. The political marriage is arranged to strengthen the alliance between both countries, but the future queen is deeply unsatisfied with her fate being decided for her. Upon arrival in the country, Marie Antoinette is acquainted with Oscar Fançois de Jarjayes—Commander of the Royal Guard.

Due to her father's desire for a son, Oscar is raised as a boy with an expectation to inherit his title as The Commander. Though she is revered by both men and women alike, Oscar cannot help but desire to live life as a woman instead of masquerading as a man. As Oscar reluctantly serves the young, spoiled queen, the growing resentment and suffering of the poor become harder for her to ignore—especially when Marie Antoinette frivolously spends her wealth.

[Written by MAL Rewrite]
",8.34,241.0,2131,103672,31289,white,tv,finished_airing,"[{'id': 81, 'name': 'Crossdressing'}, {'id': 8, 'name': 'Drama'}, {'id': 13, 'name': 'Historical'}, {'id': 38, 'name': 'Military'}, {'id': 22, 'name': 'Romance'}, {'id': 25, 'name': 'Shoujo'}]",40,manga,1465,pg_13,"[{'id': 65, 'name': 'Tokyo Movie Shinsha'}]",241,,,,,,wednesday,19:00,1979.0,fall,7006,35814,5151,3196,52500,103667.0,0.9195,0.0805
37095,"Violet Evergarden: Kitto ""Ai"" wo Shiru Hi ga Kuru no Darou",2018-07-04,2018-07-04,"The CH Postal Company has just received a request to transcribe a love letter from Irma Felice, a famous opera singer. Accepting the task, Violet Evergarden visits Irma to write her letter. However, not only does Irma provide little information, she asks Violet to write based on her own feelings. Despite Violet's numerous attempts, Irma finds every version of the letter inadequate.

Violet consults her colleagues, and they help her out by writing love letters of their own. Yet even those are rejected by the opera singer. As a last resort, Violet asks Irma for her true thoughts and feelings, hoping to find the missing puzzle piece. Will the Auto Memory Doll be able to translate Irma's emotions into words?

[Written by MAL Rewrite]",8.34,242.0,722,345751,206884,white,special,finished_airing,"[{'id': 8, 'name': 'Drama'}]",1,light_novel,2040,pg_13,"[{'id': 2, 'name': 'Kyoto Animation'}]",242,,,,,,NIL,NIL,2018.0,summer,4862,281445,1582,704,57140,345733.0,0.9934,0.0066
50407,Wu Shan Wu Xing: Xichuan Huan Zi Lin,2023-07-26,2023-08-16,Second season of Wu Shan Wu Xing.,8.34,243.0,5692,14745,4343,white,ona,finished_airing,"[{'id': 1, 'name': 'Action'}, {'id': 10, 'name': 'Fantasy'}, {'id': 13, 'name': 'Historical'}, {'id': 17, 'name': 'Martial Arts'}, {'id': 37, 'name': 'Supernatural'}]",4,original,2328,r,"[{'id': 1944, 'name': 'Samsara Animation Studio'}]",243,,,,,,NIL,NIL,2023.0,summer,880,5523,224,183,7929,14739.0,0.9724,0.0276
10162,Usagi Drop,2011-07-08,2011-09-16,"Daikichi Kawachi is a 30-year-old bachelor working a respectable job but otherwise wandering aimlessly through life. When his grandfather suddenly passes away, he returns to the family home to pay his respects. Upon arriving at the house, he meets a mysterious young girl named Rin who, to Daikichi’s astonishment, is his grandfather's illegitimate daughter!
 
The shy and unapproachable girl is deemed an embarrassment to the family, and finds herself ostracized by her father's relatives, all of them refusing to take care of her in the wake of his death. Daikichi, angered by their coldness toward Rin, announces that he will take her in—despite the fact that he is a young, single man with no prior childcare experience.

Usagi Drop is the story of Daikichi's journey through fatherhood as he raises Rin with his gentle and affectionate nature, as well as an exploration of the warmth and interdependence that are at the heart of a happy, close-knit family.

[Written by MAL Rewrite]",8.33,244.0,466,506106,248214,white,tv,finished_airing,"[{'id': 53, 'name': 'Childcare'}, {'id': 63, 'name': 'Iyashikei'}, {'id': 43, 'name': 'Josei'}, {'id': 36, 'name': 'Slice of Life'}]",11,manga,1375,pg_13,"[{'id': 10, 'name': 'Production I.G'}]",244,,,,,,friday,00:45,2011.0,summer,18959,304683,10915,7932,163594,506083.0,0.9628,0.0372
53672,Violet Evergarden: Recollections,2021-10-29,2021-10-29,"Recap of Violet Evergarden.
",8.33,245.0,3878,36175,11258,white,special,finished_airing,"[{'id': 8, 'name': 'Drama'}]",1,light_novel,5700,pg_13,"[{'id': 2, 'name': 'Kyoto Animation'}]",245,,,,,,NIL,NIL,2021.0,fall,1682,17992,400,371,15723,36168.0,0.9787,0.0213
37822,Douluo Dalu 2nd Season,2018-12-01,2023-06-10,Second season of Douluo Dalu.,8.33,246.0,4916,21562,9420,white,ona,finished_airing,"[{'id': 1, 'name': 'Action'}, {'id': 2, 'name': 'Adventure'}, {'id': 10, 'name': 'Fantasy'}, {'id': 13, 'name': 'Historical'}, {'id': 17, 'name': 'Martial Arts'}, {'id': 37, 'name': 'Supernatural'}]",237,novel,1230,pg_13,"[{'id': 1768, 'name': 'Sparkly Key Animation Studio'}]",246,,,,,,NIL,NIL,2018.0,fall,10334,5122,1002,996,4101,21555.0,0.9073,0.0927
