id,title,start_date,end_date,synopsis,mean,rank,popularity,num_list_users,num_scoring_users,nsfw,media_type,status,genres,num_episodes,source,average_episode_duration,rating,studios,all_ranking,Unnamed: 27,Unnamed: 28,Unnamed: 29,Unnamed: 30,Unnamed: 31,broadcast_day_of_the_week,broadcast_start_time,start_season_year,start_season_season,statistics_watching,statistics_completed,statistics_on_hold,statistics_dropped,statistics_plan_to_watch,statistics_num_list_users,positive_viewership_fraction,negative_viewership_fraction
32983,Natsume Yuujinchou Go,2016-10-05,2016-12-21,"Blessed with eyes that are able to perceive the otherwise invisible youkai, Takashi Natsume hides his ability from his newfound family and friends to protect everyone's peaceful daily life. Nonetheless, Natsume never fails to show the same kindness to the benevolent youkai and happily returns their names by using the infamous Book of Friends he inherited from his late grandmother, Reiko.

Meanwhile, the exorcist clan Matoba still wishes for Natsume to join their ranks due to his overwhelming gift. However, Natsume firmly rejects the clan's invitation since not all exorcists are as reasonable as his friend Shuuichi Natori, and many improperly and indiscriminately seal away every youkai in their way. Unsatisfied with Natsume's answer, Seiji Matoba blackmails Natsume into attending a grand gathering of powerful exorcist families. Natsume soon finds himself in the company of dangerous people and youkai alike. But even then, he continues to defy the exorcists' hard-handed methods and believes that peace between both worlds is possible.

[Written by MAL Rewrite]",8.56,112.0,1303,193378,78367,white,tv,finished_airing,"[{'id': 63, 'name': 'Iyashikei'}, {'id': 6, 'name': 'Mythology'}, {'id': 25, 'name': 'Shoujo'}, {'id': 36, 'name': 'Slice of Life'}, {'id': 37, 'name': 'Supernatural'}]",11,manga,1430,pg_13,"[{'id': 1119, 'name': 'Shuka'}]",112,,,,,,wednesday,01:35,2016.0,fall,11017,104464,3722,2148,72022,193373.0,0.9696,0.0304
12355,Ookami Kodomo no Ame to Yuki,2012-07-21,2012-07-21,"Hana, a hard-working college student, falls in love with a mysterious man who attends one of her classes though he is not an actual student. As it turns out, he is not truly human either. On a full moon night, he transforms, revealing that he is the last werewolf alive. Despite this, Hana's love remains strong, and the two ultimately decide to start a family.

Hana gives birth to two healthy children—Ame, born during rainfall, and Yuki, born during snowfall—both possessing the ability to turn into wolves, a trait inherited from their father. All too soon, however, the sudden death of her lover devastates Hana's life, leaving her to raise a peculiar family completely on her own. The stress of raising her wild-natured children in a densely populated city, all while keeping their identity a secret, culminates in a decision to move to the countryside, where she hopes Ame and Yuki can live a life free from the judgments of society. Wolf Children is the heartwarming story about the challenges of being a single mother in an unforgiving modern world.

[Written by MAL Rewrite]",8.56,113.0,238,831745,468707,white,movie,finished_airing,"[{'id': 46, 'name': 'Award Winning'}, {'id': 53, 'name': 'Childcare'}, {'id': 36, 'name': 'Slice of Life'}, {'id': 37, 'name': 'Supernatural'}]",1,original,7020,pg_13,"[{'id': 555, 'name': 'Studio Chizu'}]",113,,,,,,NIL,NIL,2012.0,summer,16515,601142,4806,1913,207336,831712.0,0.9919,0.0081
36098,Kimi no Suizou wo Tabetai,2018-09-01,2018-09-01,"The aloof protagonist: a bookworm who is deeply detached from the world he resides in. He has no interest in others and is firmly convinced that nobody has any interest in him either. His story begins when he stumbles across a handwritten book, titled Living with Dying. He soon identifies it as a secret diary belonging to his popular, bubbly classmate Sakura Yamauchi. She then confides in him about the pancreatic disease she is suffering from and that her time left is finite. Only her family knows about her terminal illness; not even her best friends are aware. Despite this revelation, he shows zero sympathy for her plight, but caught in the waves of Sakura's persistent buoyancy, he eventually concedes to accompanying her for her remaining days.

As the pair of polar opposites interact, their connection strengthens, interweaving through their choices made with each passing day. Her apparent nonchalance and unpredictability disrupts the protagonist's impassive flow of life, gradually opening his heart as he discovers and embraces the true meaning of living.

[Written by MAL Rewrite]",8.55,114.0,163,1015218,606146,white,movie,finished_airing,"[{'id': 8, 'name': 'Drama'}, {'id': 22, 'name': 'Romance'}, {'id': 23, 'name': 'School'}]",1,novel,6522,pg_13,"[{'id': 1244, 'name': 'Studio VOLN'}]",114,,,,,,NIL,NIL,2018.0,summer,25321,754737,5537,2393,227133,1015121.0,0.9922,0.0078
437,Perfect Blue,1998-02-28,1998-02-28,"J-pop idol group CHAM! has spent the last two years entertaining its fans. Sadly, all good things must come to an end, and CHAM! must see one of its members, Mima Kirigoe, leave the group to pursue her acting career. While Mima's choice is met with a mixed response, she hopes her fans will continue to support her.

However, Mima's life begins to change drastically after her departure from the group. Wanting to shed her pop-idol image, she takes on a role in a crime drama series, and her career as an actress gradually becomes more demanding and taxing for both Mima and her manager, Rumi Hidaka. To add to Mima's growing unease, an obsessed fan who is incapable of accepting that Mima has quit being an innocent idol, begins stalking her; a new anonymous website begins to impersonate her life with intricate detail; and CHAM! also appears to be doing better without her. One by one, each disturbing development drives Mima to become increasingly unhinged and unable to distinguish reality from fantasy.

[Written by MAL Rewrite]",8.55,115.0,284,745467,399956,white,movie,finished_airing,"[{'id': 50, 'name': 'Adult Cast'}, {'id': 5, 'name': 'Avant Garde'}, {'id': 46, 'name': 'Award Winning'}, {'id': 8, 'name': 'Drama'}, {'id': 14, 'name': 'Horror'}, {'id': 40, 'name': 'Psychological'}, {'id': 75, 'name': 'Showbiz'}, {'id': 41, 'name': 'Suspense'}]",1,novel,4903,r+,"[{'id': 11, 'name': 'Madhouse'}]",115,,,,,,NIL,NIL,1998.0,winter,16497,495013,4652,1910,227348,745420.0,0.9912,0.0088
40776,Haikyuu!! To the Top Part 2,2020-10-03,2020-12-19,"Once called a fallen powerhouse and known as ""Flightless Crows,"" Karasuno High School has finally taken flight at nationals. With a comprehensive performance against Tsubakihara Academy in their first match, the team is now facing its toughest opponent yet: the runners-up of the last Spring Tournament, Inarizaki High School. Furthermore, dealing with the formidable twin Miya brothers only makes things more difficult for Karasuno.

As soon as the match begins, Karasuno is overwhelmed by all the noise and jeers from the supporters of Inarizaki High but rekindles its strength thanks to its own loyal fans. Karasuno also gains some momentum by utilizing an attack centered on Shouyou Hinata, but the eccentric play of Atsumu and Osamu Miya delivers an unexpected blow that leaves their opponent astounded.

Things are bound to get intense as the match progresses between these two teams. Will Karasuno be able to defeat Inarizaki High and overcome the hurdles that threaten its pursuit to the top?

[Written by MAL Rewrite]",8.55,116.0,219,856852,509334,white,tv,finished_airing,"[{'id': 23, 'name': 'School'}, {'id': 27, 'name': 'Shounen'}, {'id': 30, 'name': 'Sports'}, {'id': 77, 'name': 'Team Sports'}]",12,manga,1436,pg_13,"[{'id': 10, 'name': 'Production I.G'}]",116,,,,,,saturday,02:25,2020.0,fall,56160,671898,10646,5195,112927,856826.0,0.9815,0.0185
16498,Shingeki no Kyojin,2013-04-07,2013-09-29,"Centuries ago, mankind was slaughtered to near extinction by monstrous humanoid creatures called Titans, forcing humans to hide in fear behind enormous concentric walls. What makes these giants truly terrifying is that their taste for human flesh is not born out of hunger but what appears to be out of pleasure. To ensure their survival, the remnants of humanity began living within defensive barriers, resulting in one hundred years without a single titan encounter. However, that fragile calm is soon shattered when a colossal Titan manages to breach the supposedly impregnable outer wall, reigniting the fight for survival against the man-eating abominations.

After witnessing a horrific personal loss at the hands of the invading creatures, Eren Yeager dedicates his life to their eradication by enlisting into the Survey Corps, an elite military unit that combats the merciless humanoids outside the protection of the walls. Eren, his adopted sister Mikasa Ackerman, and his childhood friend Armin Arlert join the brutal war against the Titans and race to discover a way of defeating them before the last walls are breached.

[Written by MAL Rewrite]",8.55,117.0,1,4074761,2877072,white,tv,finished_airing,"[{'id': 1, 'name': 'Action'}, {'id': 46, 'name': 'Award Winning'}, {'id': 8, 'name': 'Drama'}, {'id': 58, 'name': 'Gore'}, {'id': 38, 'name': 'Military'}, {'id': 27, 'name': 'Shounen'}, {'id': 76, 'name': 'Survival'}, {'id': 41, 'name': 'Suspense'}]",25,manga,1440,r,"[{'id': 858, 'name': 'Wit Studio'}]",117,,,,,,sunday,01:58,2013.0,spring,205687,3576568,52261,62620,177488,4074624.0,0.9718,0.0282
32,"Shinseiki Evangelion Movie: Air/Magokoro wo, Kimi ni",1997-07-19,1997-07-19,"Shinji Ikari is left emotionally comatose after the death of a dear friend. With his son mentally unable to pilot the humanoid robot Evangelion Unit-01, Gendou Ikari's NERV races against the shadow organization SEELE to see who can enact their ultimate plan first. SEELE desires to create a godlike being by fusing their own souls into an Evangelion unit, while Gendou wishes to revert all of humanity into one primordial being so that he can be reunited with Yui, his deceased wife.

SEELE unleashes its military forces in a lethal invasion of NERV headquarters. As SEELE's forces cut down NERV's scientists and security personnel, Asuka Langley Souryuu pilots Evangelion Unit-02 in a desperate last stand against SEELE's heaviest weaponry.

The battle rages on, and a depressed Shinji hides deep within NERV's headquarters. With the fate of the world resting in Shinji's hands, Captain Misato Katsuragi hunts for the teenage boy as society crumbles around them.

[Written by MAL Rewrite]",8.55,118.0,177,965946,644648,white,movie,finished_airing,"[{'id': 1, 'name': 'Action'}, {'id': 5, 'name': 'Avant Garde'}, {'id': 8, 'name': 'Drama'}, {'id': 18, 'name': 'Mecha'}, {'id': 40, 'name': 'Psychological'}, {'id': 24, 'name': 'Sci-Fi'}, {'id': 41, 'name': 'Suspense'}]",1,original,5211,r+,"[{'id': 6, 'name': 'Gainax'}, {'id': 10, 'name': 'Production I.G'}]",118,,,,,,NIL,NIL,1997.0,summer,16060,821927,4050,2502,121381,965920.0,0.9932,0.0068
28735,Shouwa Genroku Rakugo Shinjuu,2016-01-09,2016-04-02,"Yotarou is a former yakuza member fresh out of prison and fixated on just one thing: rather than return to a life of crime, the young man aspires to take to the stage of rakugo, a traditional Japanese form of comedic storytelling. Inspired during his incarceration by the performance of distinguished practitioner Yakumo Yuurakutei, he sets his mind on meeting the man who changed his life. After hearing Yotarou's desperate appeal for his mentorship, Yakumo is left with no choice but to accept his very first apprentice.

As he eagerly begins his training, Yotarou meets Konatsu, an abrasive young woman who has been under Yakumo's care ever since her beloved father Sukeroku Yuurakutei, another prolific rakugo performer, passed away. Through her hidden passion, Yotarou is drawn to Sukeroku's unique style of rakugo despite learning under contrasting techniques. Upon seeing this, old memories and feelings return to Yakumo who reminisces about a much earlier time when he made a promise with his greatest rival.

Shouwa Genroku Rakugo Shinjuu is a story set in both the past and present, depicting the art of rakugo, the relationships it creates, and the lives and hearts of those dedicated to keeping the unique form of storytelling alive.

[Written by MAL Rewrite]",8.55,119.0,869,298586,96203,white,tv,finished_airing,"[{'id': 8, 'name': 'Drama'}, {'id': 13, 'name': 'Historical'}, {'id': 43, 'name': 'Josei'}, {'id': 64, 'name': 'Love Polygon'}, {'id': 70, 'name': 'Performing Arts'}]",13,manga,1560,pg_13,"[{'id': 37, 'name': 'Studio Deen'}]",119,,,,,,saturday,02:25,2016.0,winter,19961,107428,12697,9047,149444,298577.0,0.9272,0.0728
170,Slam Dunk,1993-10-16,1996-03-23,"Hanamichi Sakuragi, infamous for his temper, massive height, and fire-red hair, enrolls in Shohoku High, hoping to finally get a girlfriend and break his record of being rejected 50 consecutive times in middle school. His notoriety precedes him, however, leading to him being avoided by most students. Soon, after certain events, Hanamichi is left with two unwavering thoughts: ""I hate basketball,"" and ""I desperately need a girlfriend.""

One day, a girl named Haruko Akagi approaches him without any knowledge of his troublemaking ways and asks him if he likes basketball. Hanamichi immediately falls head over heels in love with her, blurting out a fervent affirmative. She then leads him to the gymnasium, where she asks him if he can do a slam dunk. In an attempt to impress Haruko, he makes the leap, but overshoots, instead slamming his head straight into the blackboard. When Haruko informs the basketball team's captain of Hanamichi's near-inhuman physical capabilities, he slowly finds himself drawn into the camaraderie and competition of the sport he had previously held resentment for.

[Written by MAL Rewrite]",8.55,120.0,810,313506,141629,white,tv,finished_airing,"[{'id': 23, 'name': 'School'}, {'id': 27, 'name': 'Shounen'}, {'id': 30, 'name': 'Sports'}, {'id': 77, 'name': 'Team Sports'}]",101,manga,1380,pg_13,"[{'id': 18, 'name': 'Toei Animation'}]",120,,,,,,saturday,19:30,1993.0,fall,28037,159804,18223,11427,96007,313498.0,0.9054,0.0946
7785,Yojouhan Shinwa Taikei,2010-04-23,2010-07-02,"One autumn evening at a mysterious ramen stand behind the Shimogamo Shrine, a lonely third-year college student bumps into a man with an eggplant-shaped head who calls himself a god of matrimony. Meeting this man causes the student to reflect upon his past two years at college—two years bitterly spent trying to break up couples on campus with his only friend Ozu, a ghoulish-looking man seemingly set on making his life as miserable as possible. Resolving to make the most out of the rest of his college life, the student attempts to ask out the unsociable but kind-hearted underclassman Akashi, yet fails to follow through, prompting him to regret not living out his college life differently. As soon as this thought passes through his head, however, he is hurtled through time and space to the beginning of his years at college and given another chance to live his life.

Surreal, artistic, and mind-bending, Yojouhan Shinwa Taikei chronicles the misadventures of a young man on a journey to make friends, find love, and experience the rose-colored campus life he always dreamed of.

[Written by MAL Rewrite]",8.55,121.0,507,465278,149073,white,tv,finished_airing,"[{'id': 50, 'name': 'Adult Cast'}, {'id': 46, 'name': 'Award Winning'}, {'id': 4, 'name': 'Comedy'}, {'id': 7, 'name': 'Mystery'}, {'id': 40, 'name': 'Psychological'}, {'id': 22, 'name': 'Romance'}, {'id': 41, 'name': 'Suspense'}, {'id': 78, 'name': 'Time Travel'}]",11,novel,1373,r,"[{'id': 11, 'name': 'Madhouse'}]",121,,,,,,friday,00:45,2010.0,spring,28681,166056,16750,10832,242940,465259.0,0.9407,0.0593
30484,Steins,"{'medium': 'https://cdn.myanimelist.net/images/anime/1375/93521.webp', 'large': 'https://cdn.myanimelist.net/images/anime/1375/93521l.webp'}",2018-04-12,2018-09-27,"The eccentric, self-proclaimed mad scientist Rintarou Okabe has become a shell of his former self. Depressed and traumatized after failing to rescue his friend Makise Kurisu, he has decided to forsake his mad scientist alter ego and live as an ordinary college student. Surrounded by friends who know little of his time travel experiences, Okabe spends his days trying to forget the horrors of his adventures alone. 

While working as a receptionist at a college technology forum, Okabe meets the short, spunky Maho Hiyajo, who 
later turns out to be the interpreter at the forum's presentation, conducted by Professor Alexis Leskinen. In front of a stunned crowd, Alexis and Maho unveil Amadeus—a revolutionary AI capable of storing a person's memories and creating a perfect simulation of that person complete with their personality and quirks. Meeting with Maho and Alexis after the presentation, Okabe learns that the two were Kurisu's colleagues in university, and that they have simulated her in Amadeus. Hired by Alexis to research the simulation's behavior, Okabe is given the chance to interact with the shadow of a long-lost dear friend. Dangerously tangled in the past, Okabe must face the harsh reality and carefully maneuver around the disastrous consequences that come with disturbing the natural flow of time.

[Written by MAL Rewrite]
",8.54,122,201,898741,441903,2023-01-13T14:30:49+00:00,tv,finished_airing,"[{'id': 8, 'name': 'Drama'}, {'id': 24, 'name': 'Sci-Fi'}, {'id': 41, 'name': 'Suspense'}, {'id': 78, 'name': 'Time Travel'}]","{'day_of_the_week': 'thursday', 'start_time': '01:35'}",visual_novel,1420,,Gate 0 story.,"[{'id': 314, 'name': 'White Fox'}]","{'status': {'watching': '67266', 'completed': '515287', 'on_hold': '27241', 'dropped': '18653', 'plan_to_watch': '270263'}, 'num_list_users': 898710}",122,,,,NIL,,,,,,,,,,
56538,Kimi ni Todoke 3rd Season,2024-08-01,2024-08-01,"Summer is in full swing, and so is the love between Sawako Kuronuma and Shouta Kazehaya. From attending summer school together to meeting each other's parents, the two enjoy quality time together while tackling the feelings of self-doubt and emotional strain that come with their newfound love.

Meanwhile, Sawako's close friends, Chizuru Yoshida and Ayane Yano, struggle through their own romantic dilemmas as their past experiences with relationships clash with their present feelings. Full of inner turmoil, the youngsters' desire for intimacy persists through their second year of high school as they weave through the labyrinth of indecision and insecurity that is love. 

[Written by MAL Rewrite]",8.54,123.0,2563,77331,21339,white,ona,finished_airing,"[{'id': 8, 'name': 'Drama'}, {'id': 22, 'name': 'Romance'}, {'id': 23, 'name': 'School'}, {'id': 25, 'name': 'Shoujo'}]",5,manga,3983,pg_13,"[{'id': 10, 'name': 'Production I.G'}]",123,,,,,,NIL,NIL,2024.0,summer,6509,26660,963,340,42853,77325.0,0.9831,0.0169
11741,Fate/Zero 2nd Season,2012-04-08,2012-06-24,"As the Fourth Holy Grail War rages on with no clear victor in sight, the remaining Servants and their Masters are called upon by Church supervisor Risei Kotomine, in order to band together and confront an impending threat that could unravel the Grail War and bring about the destruction of Fuyuki City. The uneasy truce soon collapses as Masters demonstrate that they will do anything in their power, no matter how despicable, to win.

Seeds of doubt are sown between Kiritsugu Emiya and Saber, his Servant, as their conflicting ideologies on heroism and chivalry clash. Meanwhile, an ominous bond forms between Kirei Kotomine, who still seeks to find his purpose in life, and one of the remaining Servants. As the countdown to the end of the war reaches zero, the cost of winning begins to blur the line between victory and defeat.

[Written by MAL Rewrite]",8.54,124.0,135,1142799,726074,white,tv,finished_airing,"[{'id': 1, 'name': 'Action'}, {'id': 10, 'name': 'Fantasy'}, {'id': 82, 'name': 'Urban Fantasy'}]",12,light_novel,1440,r,"[{'id': 43, 'name': 'ufotable'}]",124,,,,,,sunday,00:00,2012.0,spring,31946,923770,11711,7043,168284,1142754.0,0.9836,0.0164
40417,Fruits Basket 2nd Season,2020-04-07,2020-09-22,"A year has passed since Tooru Honda began living in the Souma residence, and she has since created stronger relationships with its inhabitants Shigure, Kyou, and Yuki. She has also grown closer to the rest of the Souma family and has become familiar with their ancestral secret, having helped them with many of their personal issues. The closer Tooru gets, however, the more she begins to realize that their secret holds a darker truth than she first presumed.

Summer is approaching and Tooru is invited to spend her days with the Soumas, mainly Kyou and Yuki. Tooru wishes for an easy-going vacation, but her close relationships with the two boys and the rest of the Soumas may prove to cause trouble. As they grow more intimate, their carefree time together is hindered by older hardships and feelings from the past that begin to resurface. The Eternal Banquet also dawns on the members of the zodiac, and they must tend to their duties alongside the unnerving head of the family, Akito Souma.

With the banquet approaching and a plethora of feelings to be solved, will Tooru's life with the Soumas remain peaceful, or will she find herself in a situation from which she cannot escape?

[Written by MAL Rewrite]",8.54,125.0,430,536763,276197,white,tv,finished_airing,"[{'id': 8, 'name': 'Drama'}, {'id': 22, 'name': 'Romance'}, {'id': 23, 'name': 'School'}, {'id': 25, 'name': 'Shoujo'}, {'id': 37, 'name': 'Supernatural'}]",25,manga,1400,pg_13,"[{'id': 73, 'name': 'TMS Entertainment'}]",125,,,,,,tuesday,01:30,2020.0,spring,47008,339346,16606,8575,125208,536743.0,0.9531,0.0469
5300,Zoku Natsume Yuujinchou,2009-01-06,2009-03-31,"As with its prequel, Zoku Natsume Yuujinchou is about Takashi Natsume, a boy who has had the ability to see youkai since he was young, and his bodyguard youkai Madara, nicknamed Nyanko-sensei. Natsume attempts to return names written in his ""Book of Friends"" (which he inherited from his grandmother Reiko) to youkai in his village. Throughout these adventures, he meets some youkai that are friendly, some that want to steal the Book, and some that want to kill him, as Natsume learns about himself and his relationship with these mysterious beings along the way.

[Written by MAL Rewrite]",8.53,126.0,1007,254881,128674,white,tv,finished_airing,"[{'id': 63, 'name': 'Iyashikei'}, {'id': 6, 'name': 'Mythology'}, {'id': 25, 'name': 'Shoujo'}, {'id': 36, 'name': 'Slice of Life'}, {'id': 37, 'name': 'Supernatural'}]",13,manga,1449,pg_13,"[{'id': 112, 'name': ""Brain's Base""}]",126,,,,,,tuesday,01:00,2009.0,winter,9360,168067,4777,2261,70410,254875.0,0.9724,0.0276
53273,JoJo no Kimyou na Bouken Part 6: Stone Ocean Part 3,2022-12-01,2022-12-01,"After finally escaping the confines of Green Dolphin Street Jail, Jolyne Kuujou—alongside her companions Ermes Costello and Emporio Alniño—pursues the villainous priest Enrico Pucci across the state of Florida. Jolyne's allies, Weather Report and Narciso Anasui, struggle to catch up with her in order to help bring an end to Pucci's plot. As both parties pursue the priest, they must battle against Pucci's band of enemy Stand users.

While Jolyne's comrades fight for their lives, Pucci races to the Kennedy Space Center. There he hopes to enact his ultimate goal, one he believes God has entrusted to him. He aims to fulfill the will of the Joestars' blood enemy Dio Brando and—by robbing humanity of free will and making them slaves to fate—to create a world where all humans are blissfully happy.

Unable to rely on the aid of her comatose father Joutarou, Jolyne must weaponize all she has learned in prison to confront Pucci in a climactic battle while the world itself hangs in the balance.

[Written by MAL Rewrite]",8.53,127.0,1102,231900,152478,white,ona,finished_airing,"[{'id': 1, 'name': 'Action'}, {'id': 2, 'name': 'Adventure'}, {'id': 27, 'name': 'Shounen'}, {'id': 31, 'name': 'Super Power'}]",14,manga,1440,r,"[{'id': 287, 'name': 'David Production'}]",127,,,,,,NIL,NIL,2022.0,fall,9988,191209,2526,1112,27046,231881.0,0.9843,0.0157
21329,Mushishi: Hihamukage,2014-01-04,2014-01-04,"The entire countryside comes to a halt midday to witness a rare solar eclipse that is rumored to allow the average person to see Mushi. Unable to avert their gaze, the air is full of awe and wonder—but those who know the Mushi are preparing for the eclipse's aftermath.

Based on a prediction from Tanyuu Karibusa, the cursed recorder, Mushishi Ginko finds himself in a very unlucky farming village. Immediately following the solar eclipse, a strange black cloud begins to gather in the sky and blocks the sun once more. Suspecting it to be the work of a Mushi known as Hihami, Ginko seeks to liberate the village from perpetual darkness. However, it seems that not all of the villagers are eager to return to the light.

[Written by MAL Rewrite]",8.53,128.0,1675,143954,69358,white,tv_special,finished_airing,"[{'id': 50, 'name': 'Adult Cast'}, {'id': 2, 'name': 'Adventure'}, {'id': 13, 'name': 'Historical'}, {'id': 63, 'name': 'Iyashikei'}, {'id': 7, 'name': 'Mystery'}, {'id': 42, 'name': 'Seinen'}, {'id': 36, 'name': 'Slice of Life'}, {'id': 37, 'name': 'Supernatural'}]",1,manga,2700,pg_13,"[{'id': 8, 'name': 'Artland'}]",128,,,,,,NIL,NIL,2014.0,winter,3532,93128,1353,764,45171,143948.0,0.9853,0.0147
