id,title,main_picture,start_date,synopsis,mean,rank,popularity,num_list_users,num_scoring_users,nsfw,created_at,updated_at,media_type,status,genres,num_episodes,start_season,broadcast,source,average_episode_duration,rating,background,studios,statistics,airing_ranking,end_date
57945,Tasuuketsu,"{'medium': 'https://cdn.myanimelist.net/images/anime/1482/143629.jpg', 'large': 'https://cdn.myanimelist.net/images/anime/1482/143629l.jpg'}",2024-07-03," During his school computer class, Saneatsu Narita is presented with a strange screen posing a yes-or-no question that quickly disappears. The next day, Saneatsu wakes up to a world where everyone, save for himself and a few others, is dead.

An announcement from a mysterious figure known only as the Emperor begins to shed light on the situation. The question that Saneatsu saw on the screen is part of a game called Tasuuketsu. Every day, the survivors will see a question appear on a screen, and answering it will determine who lives to see the next day. Responding the same as the majority will guarantee death, and the last player standing will earn the right to meet the Emperor.

Saneatsu resolves to beat the Emperor at their own game, making use of the hidden envelopes containing powers that can aid the players. With the help of his small group of friends, Saneatsu must avoid falling into the machinations of the other players and win this wicked game.

[Written by MAL Rewrite]",4.69,13380.0,4947,21249,4698,white,2024-01-26T09:07:42+00:00,2024-11-12T12:09:32+00:00,tv,currently_airing,"[{'id': 1, 'name': 'Action'}, {'id': 8, 'name': 'Drama'}, {'id': 59, 'name': 'High Stakes Game'}, {'id': 40, 'name': 'Psychological'}, {'id': 41, 'name': 'Suspense'}]",24,"{'year': 2024, 'season': 'summer'}","{'day_of_the_week': 'wednesday', 'start_time': '01:59'}",web_manga,1320,pg_13,,"[{'id': 41, 'name': 'Satelight'}]","{'status': {'watching': '8506', 'completed': 0, 'on_hold': '775', 'dropped': '5222', 'plan_to_watch': '6717'}, 'num_list_users': 21220}",125,2024-12-25
60289,Shan Shantian Tianjian,"{'medium': 'https://cdn.myanimelist.net/images/anime/1840/146491.jpg', 'large': 'https://cdn.myanimelist.net/images/anime/1840/146491l.jpg'}",2024-10-17,,,13756.0,25286,82,1,white,2024-11-14T10:37:08+00:00,2024-11-15T18:39:59+00:00,ona,currently_airing,"[{'id': 51, 'name': 'Anthropomorphic'}, {'id': 4, 'name': 'Comedy'}, {'id': 10, 'name': 'Fantasy'}]",12,"{'year': 2024, 'season': 'fall'}",,original,680,pg_13,,[],"{'status': {'watching': '16', 'completed': 0, 'on_hold': '1', 'dropped': '16', 'plan_to_watch': '49'}, 'num_list_users': 82}",126,
60248,Shanhai Fu Mo Lu,"{'medium': 'https://cdn.myanimelist.net/images/anime/1198/146382.jpg', 'large': 'https://cdn.myanimelist.net/images/anime/1198/146382l.jpg'}",2024-11-11,"A civilization that disappeared in the dust, the ancient bosses sought their own way to become emperors. Jiang Hao, a modern young man who was originally a chess piece, stepped into the prehistoric wilderness in order to find the whereabouts of his father. With his incomplete ""power bank"" totem, he fought with people, from primitive tribes to the mysterious ancient city, he fought his way out; he fought with the earth, crossed the wilderness, hunted ancient beasts, and learned the ancient and mysterious totem witchcraft from the beasts; he fought with the sky, and the magic light from the sky suddenly appeared, wanting to devour this magnificent six wastelands. He went upstream, ignited himself, turned into the sun, and fought with the devil! He was shaking the world, but he didn't know that the shackles of fate had already trapped him, and his father's smile was still lingering.

(Source: Youku, Google translated)",,13768.0,20325,249,37,white,2024-11-04T21:13:44+00:00,2024-11-12T19:28:46+00:00,ona,currently_airing,"[{'id': 1, 'name': 'Action'}, {'id': 2, 'name': 'Adventure'}, {'id': 10, 'name': 'Fantasy'}, {'id': 13, 'name': 'Historical'}, {'id': 17, 'name': 'Martial Arts'}]",26,"{'year': 2024, 'season': 'fall'}",,,0,pg_13,,[],"{'status': {'watching': '127', 'completed': 0, 'on_hold': '10', 'dropped': '25', 'plan_to_watch': '86'}, 'num_list_users': 248}",127,
59246,Shaonian Bai Ma Zui Chun Feng 2nd Season,"{'medium': 'https://cdn.myanimelist.net/images/anime/1610/144106.jpg', 'large': 'https://cdn.myanimelist.net/images/anime/1610/144106l.jpg'}",2024-07-17,The second season of Shaonian Bai Ma Zui Chun Feng.,,13789.0,16998,479,48,white,2024-07-07T19:22:23+00:00,2024-12-05T11:15:10+00:00,ona,currently_airing,"[{'id': 1, 'name': 'Action'}, {'id': 2, 'name': 'Adventure'}, {'id': 10, 'name': 'Fantasy'}, {'id': 13, 'name': 'Historical'}, {'id': 17, 'name': 'Martial Arts'}]",26,"{'year': 2024, 'season': 'summer'}",,web_novel,0,pg_13,,"[{'id': 1808, 'name': 'CG Year'}]","{'status': {'watching': '162', 'completed': 0, 'on_hold': '24', 'dropped': '55', 'plan_to_watch': '236'}, 'num_list_users': 477}",128,
60207,Shaonian Jia Guo Meng,"{'medium': 'https://cdn.myanimelist.net/images/anime/1475/146285.jpg', 'large': 'https://cdn.myanimelist.net/images/anime/1475/146285l.jpg'}",2024-10-01,,,13797.0,26018,73,4,white,2024-10-28T12:33:48+00:00,2024-10-28T12:33:48+00:00,tv,currently_airing,"[{'id': 13, 'name': 'Historical'}, {'id': 15, 'name': 'Kids'}, {'id': 38, 'name': 'Military'}]",0,"{'year': 2024, 'season': 'fall'}",,original,800,pg,,[],"{'status': {'watching': '17', 'completed': 0, 'on_hold': '2', 'dropped': '30', 'plan_to_watch': '24'}, 'num_list_users': 73}",129,
59434,Shen Mu 2nd Season,"{'medium': 'https://cdn.myanimelist.net/images/anime/1527/144555.jpg', 'large': 'https://cdn.myanimelist.net/images/anime/1527/144555l.jpg'}",2024-08-10,The second season of Shen Mu.,,13846.0,15945,599,73,white,2024-07-31T13:03:22+00:00,2024-08-22T06:43:52+00:00,ona,currently_airing,"[{'id': 1, 'name': 'Action'}, {'id': 2, 'name': 'Adventure'}, {'id': 10, 'name': 'Fantasy'}, {'id': 13, 'name': 'Historical'}, {'id': 17, 'name': 'Martial Arts'}]",27,"{'year': 2024, 'season': 'summer'}",,web_novel,0,pg_13,,"[{'id': 2471, 'name': 'Wonder Cat Animation'}]","{'status': {'watching': '257', 'completed': 0, 'on_hold': '21', 'dropped': '50', 'plan_to_watch': '271'}, 'num_list_users': 599}",130,
59327,Shen Wu Tianzun (2024),"{'medium': 'https://cdn.myanimelist.net/images/anime/1354/144307.jpg', 'large': 'https://cdn.myanimelist.net/images/anime/1354/144307l.jpg'}",2024-07-27,"The only body cultivator in the nine realms was betrayed by his close friend Li Yunfei, and his body and soul disappeared. By chance, his soul remained immortal, and unexpectedly happened to Xiao Chen, a dying disciple of Qingyun Sect. After rebirth, Xiao Chen not only resurrected, but also awakened his supreme magical power. He also vowed to take back everything that belonged to him, and walked out on his own magical path as the ""Venerable God"".

(Source: Iqiyi, Google translated)",,13856.0,16373,546,72,white,2024-07-17T22:31:51+00:00,2024-10-12T12:33:11+00:00,ona,currently_airing,"[{'id': 1, 'name': 'Action'}, {'id': 10, 'name': 'Fantasy'}, {'id': 13, 'name': 'Historical'}, {'id': 17, 'name': 'Martial Arts'}]",24,"{'year': 2024, 'season': 'summer'}",,,0,pg_13,,"[{'id': 2528, 'name': 'Passion Paint Animation'}]","{'status': {'watching': '257', 'completed': 0, 'on_hold': '23', 'dropped': '51', 'plan_to_watch': '215'}, 'num_list_users': 546}",131,
59915,Shendao Dizun,"{'medium': 'https://cdn.myanimelist.net/images/anime/1877/145695.jpg', 'large': 'https://cdn.myanimelist.net/images/anime/1877/145695l.jpg'}",2024-10-22,"The young man Qin Yang was very talented and possessed the enviable cultivation artifact ""Star Gate"". However, this luck was taken away overnight. When he was about to die, Qin Yang opened the dust-covered treasure ""God Bead"" in his body. Since then, he has restored the memory of his previous nine lives and gained a new life. At the same time, the family fell into an unprecedented crisis. Faced with many tests, Qin Yang took charge of his own affairs and relied on the experience accumulated in his nine previous lives to break through the difficulties again and again. Unexpectedly, the conspirators are still pressing forward step by step. In order to protect the people he cherishes, Qin Yang chooses to fight to the end.

(Source: Bilibili, Google translated)",,13859.0,19337,304,34,white,2024-09-22T15:20:57+00:00,2024-10-01T07:58:06+00:00,ona,currently_airing,"[{'id': 1, 'name': 'Action'}, {'id': 2, 'name': 'Adventure'}, {'id': 10, 'name': 'Fantasy'}, {'id': 13, 'name': 'Historical'}, {'id': 17, 'name': 'Martial Arts'}]",48,"{'year': 2024, 'season': 'fall'}",,novel,420,pg_13,,"[{'id': 2042, 'name': 'Ruo Hong Culture'}]","{'status': {'watching': '131', 'completed': 0, 'on_hold': '7', 'dropped': '34', 'plan_to_watch': '132'}, 'num_list_users': 304}",132,
10506,Shiawase Haitatsu Taneko,"{'medium': 'https://cdn.myanimelist.net/images/anime/2/28900.jpg', 'large': 'https://cdn.myanimelist.net/images/anime/2/28900l.jpg'}",2011-03-26,"The story centers around a cat who answers people's wishes and delivers happiness. (""Tane"" and ""neko"" are the Japanese words for ""seed"" and ""cat,"" respectively.)

(Source: ANN)",,13942.0,14181,971,66,white,2011-03-30T12:06:38+00:00,2022-02-25T01:01:21+00:00,tv,currently_airing,"[{'id': 4, 'name': 'Comedy'}]",0,"{'year': 2011, 'season': 'spring'}",{'day_of_the_week': 'other'},original,0,,,"[{'id': 432, 'name': 'Kachidoki Studio'}]","{'status': {'watching': '172', 'completed': 0, 'on_hold': '36', 'dropped': '376', 'plan_to_watch': '386'}, 'num_list_users': 970}",133,
59485,Shibuya♡Hachi Part 2,"{'medium': 'https://cdn.myanimelist.net/images/anime/1515/144659.jpg', 'large': 'https://cdn.myanimelist.net/images/anime/1515/144659l.jpg'}",2024-10-05,Part two of Shibuya♡Hachi.,,13949.0,19238,310,18,white,2024-08-05T10:24:47+00:00,2024-08-05T10:24:47+00:00,tv,currently_airing,"[{'id': 4, 'name': 'Comedy'}]",0,"{'year': 2024, 'season': 'fall'}","{'day_of_the_week': 'saturday', 'start_time': '07:00'}",other,120,g,,"[{'id': 22, 'name': 'Nippon Animation'}]","{'status': {'watching': '52', 'completed': 0, 'on_hold': '5', 'dropped': '99', 'plan_to_watch': '154'}, 'num_list_users': 310}",134,
48442,Shikaru Neko,"{'medium': 'https://cdn.myanimelist.net/images/anime/1008/113384.jpg', 'large': 'https://cdn.myanimelist.net/images/anime/1008/113384l.jpg'}",2021-03-22,,,13955.0,11194,2373,63,white,2021-03-10T23:10:18+00:00,2023-01-13T10:13:42+00:00,tv,currently_airing,"[{'id': 36, 'name': 'Slice of Life'}]",0,"{'year': 2021, 'season': 'spring'}",,manga,30,g,,[],"{'status': {'watching': '151', 'completed': 0, 'on_hold': '57', 'dropped': '182', 'plan_to_watch': '1982'}, 'num_list_users': 2372}",135,
18941,Shimajirou no Wow!,"{'medium': 'https://cdn.myanimelist.net/images/anime/9/50737.jpg', 'large': 'https://cdn.myanimelist.net/images/anime/9/50737l.jpg'}",2012-04-02,Fourth season of the Shimajirou children's television series.,,13974.0,15444,677,93,white,2013-06-01T18:46:07+00:00,2023-01-18T08:24:01+00:00,tv,currently_airing,"[{'id': 2, 'name': 'Adventure'}, {'id': 4, 'name': 'Comedy'}, {'id': 10, 'name': 'Fantasy'}, {'id': 15, 'name': 'Kids'}]",0,"{'year': 2012, 'season': 'spring'}","{'day_of_the_week': 'monday', 'start_time': '07:30'}",other,480,g,,"[{'id': 229, 'name': 'The Answer Studio'}]","{'status': {'watching': '153', 'completed': 0, 'on_hold': '34', 'dropped': '242', 'plan_to_watch': '247'}, 'num_list_users': 676}",136,
54871,Shin Nippon History,"{'medium': 'https://cdn.myanimelist.net/images/anime/1433/134811.jpg', 'large': 'https://cdn.myanimelist.net/images/anime/1433/134811l.jpg'}",2020-01-06,,,13996.0,18493,360,40,white,2023-03-26T05:52:32+00:00,2023-03-26T07:19:15+00:00,tv,currently_airing,"[{'id': 4, 'name': 'Comedy'}, {'id': 13, 'name': 'Historical'}]",0,"{'year': 2020, 'season': 'winter'}","{'day_of_the_week': 'monday', 'start_time': '01:00'}",original,1380,g,,[],"{'status': {'watching': '59', 'completed': 0, 'on_hold': '24', 'dropped': '154', 'plan_to_watch': '122'}, 'num_list_users': 359}",137,
59894,Shooting Star Catch! Tiniping,"{'medium': 'https://cdn.myanimelist.net/images/anime/1583/145688.jpg', 'large': 'https://cdn.myanimelist.net/images/anime/1583/145688l.jpg'}",2024-10-10,,,14039.0,20431,243,15,white,2024-09-20T20:20:12+00:00,2024-09-22T11:22:50+00:00,tv,currently_airing,"[{'id': 10, 'name': 'Fantasy'}, {'id': 66, 'name': 'Mahou Shoujo'}]",26,"{'year': 2024, 'season': 'fall'}","{'day_of_the_week': 'thursday', 'start_time': '18:00'}",original,660,pg,,"[{'id': 2541, 'name': 'SAMG Entertainment '}]","{'status': {'watching': '26', 'completed': 0, 'on_hold': '5', 'dropped': '96', 'plan_to_watch': '116'}, 'num_list_users': 243}",138,
57357,Shuwawan!,"{'medium': 'https://cdn.myanimelist.net/images/anime/1129/140004.jpg', 'large': 'https://cdn.myanimelist.net/images/anime/1129/140004l.jpg'}",2023-03-22,"Shuwawan! chronicles the family life of real-life photographer and essayist Harumichi Saitou. Saitou and his wife are both deaf, his children are both hearing, and the family communicates in sign language. The anime draws on Saitou's own Ikuji Manga Nikki (Child-rearing Manga Diary) work.

(Source: ANN)",,14132.0,19693,283,31,white,2023-11-28T06:01:49+00:00,2023-11-28T06:01:49+00:00,tv,currently_airing,"[{'id': 53, 'name': 'Childcare'}, {'id': 36, 'name': 'Slice of Life'}]",0,"{'year': 2023, 'season': 'spring'}",{'day_of_the_week': 'other'},original,300,g,,"[{'id': 1291, 'name': 'KOO-KI'}]","{'status': {'watching': '53', 'completed': 0, 'on_hold': '15', 'dropped': '125', 'plan_to_watch': '89'}, 'num_list_users': 282}",139,
58799,Sorotani no Animetchi,"{'medium': 'https://cdn.myanimelist.net/images/anime/1581/142869.jpg', 'large': 'https://cdn.myanimelist.net/images/anime/1581/142869l.jpg'}",2021-07-04,,,14291.0,25634,77,20,white,2024-05-05T04:10:16+00:00,2024-05-05T04:10:16+00:00,ona,currently_airing,"[{'id': 4, 'name': 'Comedy'}]",0,"{'year': 2021, 'season': 'summer'}",,original,120,pg_13,,[],"{'status': {'watching': '24', 'completed': 0, 'on_hold': '6', 'dropped': '14', 'plan_to_watch': '33'}, 'num_list_users': 77}",140,
54558,Spicy Candy,"{'medium': 'https://cdn.myanimelist.net/images/anime/1289/133505.jpg', 'large': 'https://cdn.myanimelist.net/images/anime/1289/133505l.jpg'}",2022-12-03,"Spicy is a young, sharp-tongued girl who sings about everyday trivial things, and lives with her black cat named Candy.

(Source: ANN)",,14311.0,21001,210,40,white,2023-02-18T07:09:11+00:00,2023-02-19T08:05:45+00:00,ona,currently_airing,"[{'id': 19, 'name': 'Music'}]",0,"{'year': 2022, 'season': 'fall'}",,original,60,g,,"[{'id': 2540, 'name': 'Fever Creations'}]","{'status': {'watching': '56', 'completed': 0, 'on_hold': '16', 'dropped': '51', 'plan_to_watch': '86'}, 'num_list_users': 209}",141,
54071,Spookiz Specials,"{'medium': 'https://cdn.myanimelist.net/images/anime/1773/132267.jpg', 'large': 'https://cdn.myanimelist.net/images/anime/1773/132267l.jpg'}",2014-10-20,Special episodes of Spookiz.,,14320.0,22726,132,22,white,2023-01-03T01:40:54+00:00,2023-01-03T12:32:37+00:00,ona,currently_airing,"[{'id': 4, 'name': 'Comedy'}, {'id': 15, 'name': 'Kids'}, {'id': 37, 'name': 'Supernatural'}]",0,"{'year': 2014, 'season': 'fall'}",,original,120,pg,,"[{'id': 2667, 'name': 'Keyring'}]","{'status': {'watching': '39', 'completed': 0, 'on_hold': '12', 'dropped': '43', 'plan_to_watch': '37'}, 'num_list_users': 131}",142,
60052,Sylvanian Families: Freya no Piece of Secret,"{'medium': 'https://cdn.myanimelist.net/images/anime/1856/145941.jpg', 'large': 'https://cdn.myanimelist.net/images/anime/1856/145941l.jpg'}",2024-11-21,,,14382.0,22058,157,3,white,2024-10-06T03:59:32+00:00,2024-10-06T11:53:26+00:00,tv,currently_airing,"[{'id': 51, 'name': 'Anthropomorphic'}, {'id': 15, 'name': 'Kids'}, {'id': 36, 'name': 'Slice of Life'}]",6,"{'year': 2024, 'season': 'fall'}","{'day_of_the_week': 'thursday', 'start_time': '19:22'}",other,660,g,,"[{'id': 563, 'name': 'LandQ studios'}]","{'status': {'watching': '13', 'completed': 0, 'on_hold': '2', 'dropped': '21', 'plan_to_watch': '121'}, 'num_list_users': 157}",143,
49743,Tabi wa ni,"{'medium': 'https://cdn.myanimelist.net/images/anime/1909/117482.jpg', 'large': 'https://cdn.myanimelist.net/images/anime/1909/117482l.jpg'}",2023-04-08,"The anime's story centers on Akari (a quiet high schooler who has inherited a love of travel from her older sister, who took care of her in place of often absent parents) and Nagi (Akari's cheerful classmate who willingly jumps into any activity, and becomes interested in Akari due to her mysterious air), who travel throughout Japan.

(Source: ANN)",,14395.0,11102,2439,68,white,2021-09-03T16:17:48+00:00,2024-01-07T22:56:42+00:00,ova,currently_airing,"[{'id': 36, 'name': 'Slice of Life'}]",3,"{'year': 2023, 'season': 'spring'}",,original,761,g,,"[{'id': 2313, 'name': 'studio hb'}]","{'status': {'watching': '132', 'completed': 0, 'on_hold': '63', 'dropped': '28', 'plan_to_watch': '2215'}, 'num_list_users': 2438}",144,
50388,Taiko no Tatsujin Anime Ba-Jon!,"{'medium': 'https://cdn.myanimelist.net/images/anime/1147/119494.jpg', 'large': 'https://cdn.myanimelist.net/images/anime/1147/119494l.jpg'}",2021-11-16,,,14420.0,18796,337,41,white,2021-11-18T20:40:31+00:00,2022-05-03T21:42:35+00:00,ona,currently_airing,"[{'id': 4, 'name': 'Comedy'}, {'id': 15, 'name': 'Kids'}, {'id': 19, 'name': 'Music'}]",0,"{'year': 2021, 'season': 'fall'}",,game,660,g,,[],"{'status': {'watching': '67', 'completed': 0, 'on_hold': '35', 'dropped': '67', 'plan_to_watch': '167'}, 'num_list_users': 336}",145,
40393,Taka no Tsumedan no Ike! ODAman,"{'medium': 'https://cdn.myanimelist.net/images/anime/1318/103016.jpg', 'large': 'https://cdn.myanimelist.net/images/anime/1318/103016l.jpg'}",2018-09-20,"A collaboration between the Eagle Talon franchise and the Ministry of Foreign Affairs Japan Official Development Assistance program. Yoshida has become a superhero called ODAman and explains everything about the ODA program. Essentially the program gathers aid from developed countries to assist developing countries to help close the gap in education, agriculture, financial power, etc.

Episodes are first posted to MOFA's official YouTube channel and then later on DLE's official YouTube channel.",,14447.0,18511,358,43,white,2019-09-10T05:56:02+00:00,2023-07-14T14:45:17+00:00,ona,currently_airing,"[{'id': 4, 'name': 'Comedy'}, {'id': 20, 'name': 'Parody'}, {'id': 31, 'name': 'Super Power'}]",0,"{'year': 2018, 'season': 'summer'}",,original,185,g,,[],"{'status': {'watching': '76', 'completed': 0, 'on_hold': '29', 'dropped': '98', 'plan_to_watch': '154'}, 'num_list_users': 357}",146,
54873,Takoru TV,"{'medium': 'https://cdn.myanimelist.net/images/anime/1603/134813.jpg', 'large': 'https://cdn.myanimelist.net/images/anime/1603/134813l.jpg'}",2002,A series of shorts featuring TV Osaka's mascot character Takoru-kun which are broadcast at various times throughout the week.,,14453.0,23117,119,23,white,2023-03-26T06:47:59+00:00,2023-03-26T07:20:14+00:00,tv,currently_airing,"[{'id': 36, 'name': 'Slice of Life'}]",0,,,original,150,g,,[],"{'status': {'watching': '29', 'completed': 0, 'on_hold': '11', 'dropped': '39', 'plan_to_watch': '39'}, 'num_list_users': 118}",147,
51682,Tomica Heroes Jobraver: Tokusou Gattai Robo,"{'medium': 'https://cdn.myanimelist.net/images/anime/1653/123635.jpg', 'large': 'https://cdn.myanimelist.net/images/anime/1653/123635l.jpg'}",2022-04-22,,,14681.0,20250,253,27,white,2022-04-22T13:44:02+00:00,2024-05-31T18:55:36+00:00,ona,currently_airing,"[{'id': 1, 'name': 'Action'}, {'id': 15, 'name': 'Kids'}, {'id': 18, 'name': 'Mecha'}]",0,"{'year': 2022, 'season': 'spring'}",,other,330,pg,,"[{'id': 2437, 'name': 'Infinity Vision'}]","{'status': {'watching': '57', 'completed': 0, 'on_hold': '27', 'dropped': '84', 'plan_to_watch': '84'}, 'num_list_users': 252}",151,
60137,Tudi Ge Ge Shi Da Lao,"{'medium': 'https://cdn.myanimelist.net/images/anime/1882/146120.jpg', 'large': 'https://cdn.myanimelist.net/images/anime/1882/146120l.jpg'}",2024-10-28,,,14786.0,19558,290,42,white,2024-10-18T03:39:05+00:00,2024-10-30T09:20:54+00:00,ona,currently_airing,"[{'id': 1, 'name': 'Action'}, {'id': 2, 'name': 'Adventure'}, {'id': 10, 'name': 'Fantasy'}, {'id': 13, 'name': 'Historical'}, {'id': 17, 'name': 'Martial Arts'}]",40,"{'year': 2024, 'season': 'fall'}",,,0,pg_13,,[],"{'status': {'watching': '161', 'completed': 0, 'on_hold': '10', 'dropped': '30', 'plan_to_watch': '89'}, 'num_list_users': 290}",152,
54361,Umi no Mukashibanashi,"{'medium': 'https://cdn.myanimelist.net/images/anime/1389/133111.jpg', 'large': 'https://cdn.myanimelist.net/images/anime/1389/133111l.jpg'}",2019-02-02,A series of folktales about the ocean.,,14875.0,23114,120,8,white,2023-02-01T06:44:28+00:00,2023-02-05T09:49:35+00:00,movie,currently_airing,"[{'id': 10, 'name': 'Fantasy'}, {'id': 15, 'name': 'Kids'}]",0,"{'year': 2019, 'season': 'winter'}",,original,300,g,,[],"{'status': {'watching': '23', 'completed': 0, 'on_hold': '10', 'dropped': '36', 'plan_to_watch': '50'}, 'num_list_users': 119}",153,
34990,Unicorn no Kyupi,"{'medium': 'https://cdn.myanimelist.net/images/anime/1165/91319.jpg', 'large': 'https://cdn.myanimelist.net/images/anime/1165/91319l.jpg'}",2017-03-20,"Unicorn no Kyupi is a helpful sprite that lives in the kitchen and polishes dirty pots and pans clean with its fluffy white body. Harigorou, a rival sprite shaped like a hedgehog, tries to interfere. 

(Source: Crunchyroll)",,14882.0,18187,383,39,white,2017-03-02T01:14:50+00:00,2024-02-06T16:20:50+00:00,tv_special,currently_airing,"[{'id': 10, 'name': 'Fantasy'}, {'id': 15, 'name': 'Kids'}]",0,"{'year': 2017, 'season': 'winter'}",,original,300,g,,"[{'id': 2818, 'name': 'qmotri'}]","{'status': {'watching': '77', 'completed': 0, 'on_hold': '31', 'dropped': '150', 'plan_to_watch': '124'}, 'num_list_users': 382}",154,
60418,Wan Jie Du Zun 3rd Season,"{'medium': 'https://cdn.myanimelist.net/images/anime/1472/146749.jpg', 'large': 'https://cdn.myanimelist.net/images/anime/1472/146749l.jpg'}",2024-11-30,,,14948.0,19400,300,31,white,2024-11-30T09:38:21+00:00,2024-11-30T14:28:58+00:00,ona,currently_airing,"[{'id': 1, 'name': 'Action'}, {'id': 2, 'name': 'Adventure'}, {'id': 10, 'name': 'Fantasy'}]",56,"{'year': 2024, 'season': 'fall'}",,novel,540,pg_13,,"[{'id': 2042, 'name': 'Ruo Hong Culture'}]","{'status': {'watching': '162', 'completed': 0, 'on_hold': '13', 'dropped': '19', 'plan_to_watch': '106'}, 'num_list_users': 300}",155,
56773,Wan Jie Zhizun 2nd Season,"{'medium': 'https://cdn.myanimelist.net/images/anime/1967/138810.jpg', 'large': 'https://cdn.myanimelist.net/images/anime/1967/138810l.jpg'}",2023-09-28,The second season of Wan Jie Zhizun.,,14949.0,17609,425,55,white,2023-09-28T10:40:59+00:00,2023-09-28T14:57:37+00:00,ona,currently_airing,"[{'id': 1, 'name': 'Action'}, {'id': 2, 'name': 'Adventure'}, {'id': 10, 'name': 'Fantasy'}, {'id': 17, 'name': 'Martial Arts'}]",0,"{'year': 2023, 'season': 'summer'}",,,600,pg_13,,"[{'id': 2042, 'name': 'Ruo Hong Culture'}]","{'status': {'watching': '172', 'completed': 0, 'on_hold': '33', 'dropped': '67', 'plan_to_watch': '151'}, 'num_list_users': 423}",156,
60249,Wangu Zui Qiang Zong,"{'medium': 'https://cdn.myanimelist.net/images/anime/1800/146383.jpg', 'large': 'https://cdn.myanimelist.net/images/anime/1800/146383l.jpg'}",2024-11-06,"A special scientific experiment, a wonderful adventure in different time and space. Jun Changxiao came to Xingyun Continent with the system and inherited an unknown small sect. He must build the sect into the No. 1 in Xingyun Continent within a hundred years, and recruit 100,000 disciples. If he fails to complete it, the system will explode and he will be finished. In order to survive and return to the original time and space safely. He actively ""established a sect"" and taught disciples. The gang grew from a ""lone commander"" to a hundred people. Under the leadership of Jun Changxiao, everyone built houses and planted crops, caught chickens and found dogs, and maintained peace and helped the weak anytime and anywhere. The disciples in the sect have different personalities. The funny Jun Changxiao gets along well with everyone, and there is unlimited joy in the warm big family. In a lively and positive atmosphere, everyone supports each other and grows rapidly. The cultivation of the sect is a long and arduous task, and Jun Changxiao leads the disciples to explore up and down...

(Source: Tencent, Google translated)",,14964.0,22100,156,14,white,2024-11-04T21:34:56+00:00,2024-11-17T11:04:32+00:00,ona,currently_airing,"[{'id': 2, 'name': 'Adventure'}, {'id': 4, 'name': 'Comedy'}, {'id': 10, 'name': 'Fantasy'}, {'id': 13, 'name': 'Historical'}]",36,"{'year': 2024, 'season': 'fall'}",,web_novel,0,pg_13,,"[{'id': 2042, 'name': 'Ruo Hong Culture'}]","{'status': {'watching': '73', 'completed': 0, 'on_hold': '8', 'dropped': '26', 'plan_to_watch': '49'}, 'num_list_users': 156}",157,
60233,Wanjie Zhuzai,"{'medium': 'https://cdn.myanimelist.net/images/anime/1457/146357.jpg', 'large': 'https://cdn.myanimelist.net/images/anime/1457/146357l.jpg'}",2024-10-28,,,14971.0,21803,167,14,gray,2024-11-02T02:09:31+00:00,2024-11-02T12:03:47+00:00,ona,currently_airing,"[{'id': 1, 'name': 'Action'}, {'id': 10, 'name': 'Fantasy'}]",32,"{'year': 2024, 'season': 'fall'}",,,900,pg_13,,[],"{'status': {'watching': '82', 'completed': 0, 'on_hold': '6', 'dropped': '26', 'plan_to_watch': '53'}, 'num_list_users': 167}",158,
