id,title,start_date,end_date,synopsis,mean,rank,popularity,num_list_users,num_scoring_users,nsfw,media_type,status,genres,num_episodes,source,average_episode_duration,rating,studios,movie_ranking,broadcast_day_of_the_week,broadcast_start_time,start_season_year,start_season_season,statistics_watching,statistics_completed,statistics_on_hold,statistics_dropped,statistics_plan_to_watch,statistics_num_list_users,positive_viewership_fraction,negative_viewership_fraction
6467,Meitantei Conan Movie 14: Tenkuu no Lost Ship,2010-04-17,2010-04-17,"One night, the Tokyo National Institute of Microorganisms is attacked by a mysterious organization calling themselves the ""Red Siamese Cats."" The group causes the explosion of a high-security lab storing a virus—said to have a mortality rate of 80% with no known cure. This act of terror dominates the headlines, overshadowing the unveiling of the world's biggest airship developed under Jirokichi Suzuki. Peculiarly, the unveiling has a note attached for Kaito ""Kaitou Kid"" Kuroba, challenging him to steal the jewel on display—the illustrious Lady Sky.

Conan Edogawa is permitted to board the airship along with Kogorou Mouri, Ran Mouri, Sonoko Suzuki, Professor Agasa, and the Detective Boys. However, their fun comes to a halt when an unknown caller contacts Jirokichi and declares that they have released a certain virus in the smoking room. Soon after, symptoms begin to appear among the passengers and chaos ensues. Seizing the opportunity, the Red Siamese Cats suddenly appear and hijack the airship! 

To stop the assailants, Conan and Kaitou Kid, along with their allies, must work together to decipher the clues and discover the Red Siamese Cats' real objective before time runs out.

[Written by MAL Rewrite]",8.11,498,2991,59131,34122,white,movie,finished_airing,"[{'id': 1, 'name': 'Action'}, {'id': 39, 'name': 'Detective'}, {'id': 7, 'name': 'Mystery'}, {'id': 27, 'name': 'Shounen'}]",1,manga,6120,g,"[{'id': 65, 'name': 'Tokyo Movie Shinsha'}, {'id': 73, 'name': 'TMS Entertainment'}]",117,,NIL,2010.0,spring,912,51681,350,404,5778,59125.0,0.9872,0.0128
12859,One Piece Film: Z,2012-12-15,2012-12-15,"The Straw Hat Pirates enter the rough seas of the New World in search of the hidden treasures of the Pirate King, Gol D. Roger－One Piece. On their voyage, the pirates come across a terrifying, powerful man, former Marine Admiral Z.

Z is accused of having stolen the ""Dyna Stones"", weapons believed to have the power to shake up the New World. The Marine Headquarters believes Z is about to use it to end the pirate era, and with it, the lives of many innocent people. In fear of such a phenomenal event, marines start to take action against the former admiral.

Even if it means stumbling upon marines and the navy, the Straw Hat Pirates decided to chase after Z and stop him from causing havoc. As they continue to embark on their ventures, the pirates bump into new and familiar acquaintances.",8.11,499,882,294932,186544,white,movie,finished_airing,"[{'id': 1, 'name': 'Action'}, {'id': 2, 'name': 'Adventure'}, {'id': 10, 'name': 'Fantasy'}, {'id': 27, 'name': 'Shounen'}]",1,manga,6420,pg_13,"[{'id': 18, 'name': 'Toei Animation'}]",118,,NIL,2012.0,fall,5271,262118,1117,771,25630,294907.0,0.9936,0.0064
54650,Precure All Stars Movie F,2023-09-15,2023-09-15,"A great Pretty Cure gathering! Or so we thought. They've actually been separated~!?

""Where am I...?"" --When Sora wakes up, she finds herself in a mysterious world... It seems that she has lost Mashiro and the others.... But there she meets Yui, Manatsu, and Prim! What's more, Prim transforms into Cure Supreme! Mashiro meets Laura, Amane, and Nodoka on a small island in the sea, and rescues Puka from a monster attack! Tsubasa meets Saaya, Ha-chan, and Haruka, where they take a walk in the hanging garden! Ageha meets Asumi, Lala and Yukari, but Lala and Yukari are having trouble getting along! They meet a lot of friends, but for some reason, their memories are all a little hazy... And it seems that the only people in this world are Precure...? We want to go back to our own world! The clue is a castle in the distance-- Onward! Our journey begins here! Let's go on a great adventure to the castle!

(Source: Official Site, translated)",8.11,501,10023,3373,1144,white,movie,finished_airing,"[{'id': 1, 'name': 'Action'}, {'id': 66, 'name': 'Mahou Shoujo'}]",1,original,4360,g,"[{'id': 18, 'name': 'Toei Animation'}]",119,,NIL,2023.0,summer,131,1478,63,88,1611,3371.0,0.9552,0.0448
21469,Stand By Me Doraemon,2014-08-08,2014-08-08,"Nobita Nobi is an elementary student who hates studying, is bad at sports, and does everything half-heartedly. He is a pushover, unlucky, and fearful of many things. His personality makes him a failure in life, even affecting his progeny. This causes his great-great-grandchild, Sewashi, to take control of the situation.

Sewashi travels back in time from the 22nd century to the 20th century to meet Nobita, who is shocked to see him appear out of his drawer alongside a blue robotic cat. The robotic cat calls himself Doraemon, who claims to have been pressured by Sewashi to assist Nobita, with their ultimate goal being to provide Nobita happiness. Frustrated after seeing Nobita's hopeless state, Doraemon decides to go back to the future. However, Sewashi activates a program within Doraemon that prevents him from doing so. 

Forced to stay, Doraemon helps Nobita using futuristic gadgets through his four-dimensional pocket—a bag containing anything inside it. Can Doraemon bring Nobita happiness and return to the future?

[Written by MAL Rewrite]",8.11,504,3034,57721,40405,white,movie,finished_airing,"[{'id': 4, 'name': 'Comedy'}, {'id': 15, 'name': 'Kids'}, {'id': 24, 'name': 'Sci-Fi'}, {'id': 27, 'name': 'Shounen'}]",1,manga,5663,pg,"[{'id': 235, 'name': 'Shirogumi'}, {'id': 247, 'name': 'Shin-Ei Animation'}]",120,,NIL,2014.0,summer,1045,50336,256,391,5689,57717.0,0.9888,0.0112
35608,Chuunibyou demo Koi ga Shitai! Movie: Take On Me,2018-01-06,2018-01-06,"Although already a third-year high school student, Rikka Takanashi remains a chuunibyou—a ""disease"" that causes people to fantasize about themselves and their surroundings. Her relationship with Yuuta Togashi has also gone unchanged for the past six months, and with entrance exams right around the corner, both of them strive to enroll at the same college. However, Tooka—Rikka's elder sister—decides to take Rikka to Italy as she has found a stable job there. This unforeseen turn of events causes a commotion between the couple as neither of them want to be separated from each other. Desperate for ideas, they seek assistance from their friends, and after a brief conversation, they come up with a plan—to elope.

Chuunibyou demo Koi ga Shitai! Movie: Take On Me is a sensational drama featuring the couple—Yuuta and Rikka—as they journey across Japan. The two attempt to prevent Rikka from being taken to Italy, but will they be able to succeed in doing so?

[Written by MAL Rewrite]",8.1,510,905,282565,151982,white,movie,finished_airing,"[{'id': 4, 'name': 'Comedy'}, {'id': 8, 'name': 'Drama'}, {'id': 22, 'name': 'Romance'}, {'id': 23, 'name': 'School'}]",1,light_novel,5613,pg_13,"[{'id': 2, 'name': 'Kyoto Animation'}]",121,,NIL,2018.0,winter,6627,199021,2404,1356,73147,282555.0,0.9867,0.0133
29831,Tamayura: Sotsugyou Shashin Part 4 - Ashita,2016-04-02,2016-04-02,The final movie of a four-part finale of Tamayura.,8.1,519,6166,12104,4004,white,movie,finished_airing,"[{'id': 52, 'name': 'CGDCT'}, {'id': 63, 'name': 'Iyashikei'}, {'id': 36, 'name': 'Slice of Life'}]",1,original,3420,g,"[{'id': 333, 'name': 'TYO Animations'}]",122,,NIL,2016.0,spring,502,5147,277,248,5929,12103.0,0.9566,0.0434
2236,Toki wo Kakeru Shoujo,2006-07-15,2006-07-15,"Makoto Konno is in her last year of high school, but is having a hard time deciding what to do with her future. In between enduring the pressure of her teachers and killing time with her best friends, Makoto's life suddenly changes when she accidentally discovers that she is capable of literally leaping through time.

Toki wo Kakeru Shoujo follows Makoto as she plays around with her newfound power. However, she soon learns the hard way that every choice has a consequence, and time is a lot more complicated than it may seem.

[Written by MAL Rewrite]",8.1,520,251,807554,462802,white,movie,finished_airing,"[{'id': 46, 'name': 'Award Winning'}, {'id': 8, 'name': 'Drama'}, {'id': 22, 'name': 'Romance'}, {'id': 23, 'name': 'School'}, {'id': 24, 'name': 'Sci-Fi'}, {'id': 78, 'name': 'Time Travel'}]",1,novel,5884,g,"[{'id': 11, 'name': 'Madhouse'}]",123,,NIL,2006.0,summer,14010,597061,4782,2324,189342,807519.0,0.9912,0.0088
3016,Ginga Eiyuu Densetsu: Arata naru Tatakai no Overture,1993-12-18,1993-12-18,"Led by Reinhard von Müsel, the Galactic Empire crushes the Free Planets Alliance in the Fourth Battle of Tiamat. Arriving in the Imperial capital of Odin to a hero's welcome, Reinhard's victory earns him a promotion to High Admiral and the distinguished title of Count von Lohengramm. On the other side, Yang Wen-li safely returns to the Alliance capital of Heinessen without fanfare and reunites with his dear friends.

Reinhard and Yang look forward to a long-awaited reprieve. However, at the request of the scheming Duke Otho von Braunschweig, the Imperial High Command orders the new High Admiral to invade the Alliance with a fleet of twenty thousand ships. After the Duke leaks the plan to the Alliance government, three fleets totalling forty thousand ships are sent to counter the incoming attack and recreate the famous Battle of Dagon. But even though Reinhard is outnumbered two to one, he has an ingenious plan—and Yang sees right through it. Will Yang's superiors heed his warning before it is too late?

[Written by MAL Rewrite]",8.08,541,3871,36264,18467,white,movie,finished_airing,"[{'id': 1, 'name': 'Action'}, {'id': 50, 'name': 'Adult Cast'}, {'id': 8, 'name': 'Drama'}, {'id': 38, 'name': 'Military'}, {'id': 24, 'name': 'Sci-Fi'}, {'id': 29, 'name': 'Space'}]",1,novel,5380,pg_13,"[{'id': 2256, 'name': 'Kitty Film Mitaka Studio'}]",124,,NIL,1993.0,fall,766,23466,420,331,11279,36262.0,0.9793,0.0207
50587,Gridman Universe,2023-03-24,2023-03-24,"A year has passed since the events of SSSS.Gridman. The world is at peace and no one except for Rikka and Utsumi remembers the kaiju, Gridman, or Akane Shinjou. This includes Yuuta, who despite serving as Gridman's host, has no memory of the most important moments of his life. So when a new Kaiju appears, he leaps at the chance to prove to himself that he too can be the hero by merging with Gridman once more.

(Source: ANN)",8.08,543,4042,33408,8910,white,movie,finished_airing,"[{'id': 1, 'name': 'Action'}, {'id': 18, 'name': 'Mecha'}, {'id': 24, 'name': 'Sci-Fi'}]",1,original,7069,pg_13,"[{'id': 803, 'name': 'Trigger'}]",125,,NIL,2023.0,winter,1263,11003,460,195,20475,33396.0,0.9804,0.0196
30364,Haikyuu!! Movie 2: Shousha to Haisha,2015-09-18,2015-09-18,"The Inter-High has finally arrived for Karasuno High School's volleyball team. Their opponent at the tournament is Date Tech High School—the team that crushed Karasuno the year prior. The loss brings back anxiety and fear for the team's second- and third-years as they were unable to overcome Date's ""read block."" With the dynamic freshmen duo Shouyou Hinata and Tobio Kageyama on their side, will Karasuno be able to overcome their past and break through the iron wall?

Awaiting Karasuno in the next round is the elite Aoba Jousai High School, led by the cunning captain Tooru Oikawa. Coming from the same middle school as Kageyama, Oikawa is a talented and unpredictable setter with a grudge against his former teammate. It is a battle between genius setters to decide who will continue on in the Inter-High.

[Written by MAL Rewrite]",8.08,544,2177,100856,38718,white,movie,finished_airing,"[{'id': 23, 'name': 'School'}, {'id': 27, 'name': 'Shounen'}, {'id': 30, 'name': 'Sports'}, {'id': 77, 'name': 'Team Sports'}]",1,manga,5280,pg_13,"[{'id': 10, 'name': 'Production I.G'}]",126,,NIL,2015.0,summer,2314,69247,950,829,27512,100852.0,0.9824,0.0176
38081,Girls & Panzer: Saishuushou Part 2,2019-06-15,2019-06-15,"Despite having the upper hand, BC Freedom High School suffers a thorough defeat at the hands of Ooarai Girls Academy. Following their victory, the Ooarai girls decide to take a break before the next round. After discovering that Momo Kawashima is taking care of her family while studying for the university entrance exams, the rest of the Ooarai team become more determined to win the Winter Continuous Track Cup for the sake of Momo and her family.

Meanwhile, the second round of the tournament has started, and Ooarai now has to face Chi-Ha-Tan Academy. Having learned from the first round to not underestimate their enemies, Ooarai slowly approaches their opponent on the thick jungle battlefield.

Despite their best attempts to be cautious, Ooarai is immediately put in a difficult situation as Chi-Ha-Tan employs several new strategies devised by Haru Fukuda. Finding themselves between a rock and a hard place, Ooarai must claw their way out to claim another comeback victory and keep their championship hopes alive.

[Written by MAL Rewrite]",8.07,549,3708,39770,19492,white,movie,finished_airing,"[{'id': 52, 'name': 'CGDCT'}, {'id': 38, 'name': 'Military'}, {'id': 23, 'name': 'School'}]",1,original,3291,pg_13,"[{'id': 60, 'name': 'Actas'}]",127,,NIL,2019.0,spring,1035,26406,322,253,11750,39766.0,0.9855,0.0145
31658,Kuroko no Basket Movie 4: Last Game,2017-03-18,2017-03-18,"Hailing from America, Jabberwock—a street basketball team with skills comparable to those of the NBA—has come to Japan to play an exhibition match against Strky, a team of former third-year students who once played in the Interhigh and Winter Cup. However, due to the vast difference in skill, Jabberwock easily wins. Their captain, Nash Gold Jr., mocks the basketball style of all players in Japan by comparing them to monkeys.
 
Infuriated by the nasty comment, Kagetora Aida challenges them to a revenge match. Because of pride and the belief that the results will be no different, Nash accepts the challenge. Kagetora then assembles Vorpal Swords, a team composed of the Generation of Miracles, including Kuroko Tetsuya and Kagami Taiga, for they are the only ones who stand a chance against a foe that seems unbeatable from every angle.

[Written by MAL Rewrite]",8.07,556,791,320548,192733,white,movie,finished_airing,"[{'id': 23, 'name': 'School'}, {'id': 27, 'name': 'Shounen'}, {'id': 30, 'name': 'Sports'}, {'id': 77, 'name': 'Team Sports'}]",1,manga,5400,pg_13,"[{'id': 10, 'name': 'Production I.G'}]",128,,NIL,2017.0,winter,5424,267939,1285,774,45118,320540.0,0.9936,0.0064
40080,Quanzhi Gaoshou: Dianfeng Rongyao,2019-08-16,2019-08-16,"Two years ago, Glory started out as just another MMORPG, but its real-world influence has grown as more countries begin to recognize esports as an official sport. Now, in China, arrangements are being made to hold the first professional league of Glory, culminating in the Glory Championship.

Friends Ye Qiu and Su Muqiu both aspire to make a career out of esports. However, due to personal reasons, Ye Qiu has been hesitant until now to chase his dream onto the national stage. When the two boys finally agree to form their own team, they are supported by Tao Xuan, their boss and the owner of Excellent Era internet cafe, after which they name their team. And so, Team Excellent Era sets their sights on defeating all opponents who stand in their way of reaching the ultimate summit of Glory.

[Written by MAL Rewrite]",8.07,558,3169,53000,24481,white,movie,finished_airing,"[{'id': 1, 'name': 'Action'}, {'id': 79, 'name': 'Video Game'}]",1,web_novel,5912,pg_13,"[{'id': 2509, 'name': 'Colored Pencil Animation'}]",129,,NIL,2019.0,summer,2269,35471,526,456,14265,52987.0,0.9815,0.0185
36369,Ginga Eiyuu Densetsu: Die Neue These - Seiran 1,2019-09-27,2019-09-27,"The Free Planets Alliance's invasion of the Galactic Empire has failed after supply mismanagement led to heavy losses. Unwilling to abort the expedition despite being greatly outnumbered, Fleet Admiral Lazar Lobos orders the remaining Alliance fleets to gather in the Amritsar Starzone for a final stand against the incoming counterattack.

Strategic genius Fleet Admiral Reinhard von Lohengramm leads the Imperial forces into this decisive battle with an overwhelming advantage. However, his rival, tactical magician Vice Admiral Yang Wen-li of the Alliance, once again makes up for the incompetence of his superiors and stages a narrow escape for himself and his fellow soldiers. Though both Reinhard and Yang are displeased with the outcome—the former for his imperfect victory and the latter for the tremendous casualties—their attention must turn to the bubbling political unrest on both sides of the galaxy.

[Written by MAL Rewrite]",8.06,570,4156,31154,14893,white,movie,finished_airing,"[{'id': 50, 'name': 'Adult Cast'}, {'id': 8, 'name': 'Drama'}, {'id': 38, 'name': 'Military'}, {'id': 24, 'name': 'Sci-Fi'}, {'id': 29, 'name': 'Space'}]",4,novel,1500,r,"[{'id': 10, 'name': 'Production I.G'}]",130,,NIL,2019.0,summer,1193,19005,415,286,10254,31153.0,0.9775,0.0225
1367,Meitantei Conan Movie 08: Ginyoku no Magician,2004-04-17,2004-04-17,"Once again, Kaitou Kid crosses swords with Conan Edogawa in this annual installment of the Detective Conan movie franchise. After receiving a letter from the thief, famous actress Juri Maki seeks the help of private detective Kogorou Mouri to protect the Star Sapphire—the ""Jewel of Destiny,"" said to represent faith, fate, and hope. Thinking he has deciphered Kid's riddle, Kogorou personally shows up to the newly constructed space theater where Juri is acting in the play ""Josephine"" in order to catch Kid in the act.
 
The next day, Conan and the gang are invited by Juri to her holiday home, to celebrate the thwarting of Kid's plan and the success of the play. However, their triumph crumbles when a murder occurs during the flight there. Although unintentional, this sets off a series of events that escalate to catastrophic results. Conan and Kid, unlikely allies that they are, must work together to save both their friends and every other passenger aboard the plane.
 
[Written by MAL Rewrite]",8.06,579,3001,58748,34429,white,movie,finished_airing,"[{'id': 2, 'name': 'Adventure'}, {'id': 4, 'name': 'Comedy'}, {'id': 39, 'name': 'Detective'}, {'id': 7, 'name': 'Mystery'}, {'id': 27, 'name': 'Shounen'}]",1,manga,6480,pg_13,"[{'id': 73, 'name': 'TMS Entertainment'}]",131,,NIL,2004.0,spring,726,52553,318,356,4790,58743.0,0.9885,0.0115
21419,Meitantei Conan Movie 18: Ijigen no Sniper,2014-04-19,2014-04-19,"One morning, at the observation deck of the Bell Tree Tower, a man is suddenly shot dead by an unknown sniper. Conan Edogawa, who happened to be visiting as the murder occurred, rushes to apprehend the sniper but fails to do so. He later learns that the suspect for the incident, Timothy Hunter, is a former member of the Navy Special Ops squad and was already being investigated for a previous murder case. The FBI believes that there are at least three people Timothy wants dead. However, after the deaths of two of them, Timothy himself is killed, throwing the investigation into disarray.

As they lose their only lead, news about the assassinations spreads across Tokyo, leaving the city in a state of panic. It is up to Conan to find and catch the culprit in the hope of putting an end to this sniping spree terror.

[Written by MAL Rewrite]",8.06,580,3460,45224,25632,white,movie,finished_airing,"[{'id': 1, 'name': 'Action'}, {'id': 39, 'name': 'Detective'}, {'id': 7, 'name': 'Mystery'}, {'id': 27, 'name': 'Shounen'}]",1,manga,6600,pg_13,"[{'id': 73, 'name': 'TMS Entertainment'}]",132,,NIL,2014.0,spring,736,38620,313,365,5185,45219.0,0.985,0.015
49320,Meitantei Conan Movie 25: Halloween no Hanayome,2022-04-15,2022-04-15,"Shibuya, Tokyo, is bustling with the Halloween season. A wedding is being held at Shibuya Hikarie, where Sato is dressed in a wedding dress. While Conan and the other invited guests are watching, an assailant suddenly bursts in, and Takagi, who was trying to protect Sato, is injured. Takagi survived and the situation was settled, but in Sato's eyes, the image of the grim reaper that she had seen when Jinpei Matsuda, the man she had been in love with, had been killed in a series of bombings three years ago, overlapped with Takagi's.

At the same time, the perpetrator of the bombings escapes from prison. Rei Furuya/Toru Amuro, a member of the public safety police, is hunting down the man who killed his classmate, but a mysterious person in disguise suddenly appears and puts a collar bomb on him.

Conan visits the underground shelter where Amuro is hiding out to disarm the collar bomb, and hears about an incident three years ago when he and his now deceased classmates from the police academy encountered an unidentified virtual bomber named ""Plamya"" in Shibuya. As Conan and his team investigate, a disturbing shadow begins to loom over them.

(Source: Detective Conan World)",8.05,586,5370,17191,8380,white,movie,finished_airing,"[{'id': 1, 'name': 'Action'}, {'id': 39, 'name': 'Detective'}, {'id': 7, 'name': 'Mystery'}, {'id': 27, 'name': 'Shounen'}]",1,manga,6600,pg_13,"[{'id': 73, 'name': 'TMS Entertainment'}]",133,,NIL,2022.0,spring,404,11429,156,146,5052,17187.0,0.9824,0.0176
52107,Mononoke Movie: Karakasa,2024-07-26,2024-07-26,"Asa and Kame strike up an immediate friendship when they arrive at the same time for their first day of duty at the Ooku, the splendid pleasure palace housing the harem of Lord Tenshi. The two young women are there to join the many hundreds of other maidservants—men are barred from entering, with immediate beheading the price of trespassing. It soon becomes clear that behind the luxurious lifestyle and ritualized routines of the Ooku lie sinister schemes and cynical rivalries. Meanwhile, a mysterious wandering potion-peddler known only as the Medicine Seller subtly insinuates himself into the Ooku, just as an uncanny, otherworldly menace begins to reveal itself.

(Source: Fantasia Festival)",8.05,587,4114,32236,3309,white,movie,finished_airing,"[{'id': 50, 'name': 'Adult Cast'}, {'id': 13, 'name': 'Historical'}, {'id': 14, 'name': 'Horror'}, {'id': 7, 'name': 'Mystery'}, {'id': 6, 'name': 'Mythology'}, {'id': 40, 'name': 'Psychological'}, {'id': 37, 'name': 'Supernatural'}, {'id': 41, 'name': 'Suspense'}]",1,original,5380,r,"[{'id': 2829, 'name': 'EOTA'}]",134,,NIL,2024.0,summer,787,4136,280,74,26959,32236.0,0.989,0.011
4155,One Piece Film: Strong World,2009-12-12,2009-12-12,"Upon hearing news that islands in East Blue are being destroyed, Monkey D. Luffy and his crew go to investigate. On their way, however, an outlandish pirate ship appears out of the sky, helmed by the infamous pirate Shiki ""the Golden Lion""—a man who ate the Float-Float Fruit and the first ever prisoner to escape from Impel Down. In his quest to defeat the World Government, Shiki kidnaps Nami to be his own navigator and sends the rest of the Straw Hat Pirates to his floating islands as hostages, leaving her in a dilemma. Separated in a land under Shiki's absolute control, Luffy and his crew must survive the mystifying terrain in order to bring back their navigator and friend.

[Written by MAL Rewrite]",8.05,589,969,263738,164273,white,movie,finished_airing,"[{'id': 1, 'name': 'Action'}, {'id': 2, 'name': 'Adventure'}, {'id': 10, 'name': 'Fantasy'}, {'id': 27, 'name': 'Shounen'}]",1,manga,6938,pg_13,"[{'id': 18, 'name': 'Toei Animation'}]",135,,NIL,2009.0,fall,4263,232596,1165,821,24870,263715.0,0.9925,0.0075
29755,Haikyuu!! Movie 1: Owari to Hajimari,2015-07-03,2015-07-03,"After watching a volleyball match on TV where the ""Little Giant"" of Karasuno High School helps his team secure a hard-fought victory, young and impressionable Shouyou Hinata begins to play the sport in hopes that he too can soar high one day. Now enrolled at the same school as his idol, he attempts to join the volleyball team despite his short stature. Unfortunately, upon his arrival, Hinata locks eyes with ""King of the Court"" Tobio Kageyama—a genius setter whom he had once suffered a bitter defeat to in middle school.

Their unfriendly introduction and subsequent rivalry forces the rest of the Karasuno team to bar both of them from joining the club until they can learn to work together as teammates. Though reluctant to cooperate, their desire to play volleyball causes them to return with a proposal that will show the other members that they are capable of teamwork. As the two freshmen form an odd setter-and-ace relationship, an old rival school invites Karasuno for practice matches, reigniting competition between the two schools once more.

[Written by MAL Rewrite]
",8.05,599,2052,110270,43038,white,movie,finished_airing,"[{'id': 23, 'name': 'School'}, {'id': 27, 'name': 'Shounen'}, {'id': 30, 'name': 'Sports'}, {'id': 77, 'name': 'Team Sports'}]",1,manga,5340,pg_13,"[{'id': 10, 'name': 'Production I.G'}]",136,,NIL,2015.0,summer,2589,75790,1057,868,29960,110264.0,0.9825,0.0175
