id,title,start_date,end_date,synopsis,mean,rank,popularity,num_list_users,num_scoring_users,nsfw,media_type,status,genres,num_episodes,source,average_episode_duration,rating,studios,bypopularity_ranking,broadcast_day_of_the_week,broadcast_start_time,start_season_year,start_season_season,statistics_watching,statistics_completed,statistics_on_hold,statistics_dropped,statistics_plan_to_watch,statistics_num_list_users,positive_viewership_fraction,negative_viewership_fraction
16498,Shingeki no Kyojin,2013-04-07,2013-09-29,"Centuries ago, mankind was slaughtered to near extinction by monstrous humanoid creatures called Titans, forcing humans to hide in fear behind enormous concentric walls. What makes these giants truly terrifying is that their taste for human flesh is not born out of hunger but what appears to be out of pleasure. To ensure their survival, the remnants of humanity began living within defensive barriers, resulting in one hundred years without a single titan encounter. However, that fragile calm is soon shattered when a colossal Titan manages to breach the supposedly impregnable outer wall, reigniting the fight for survival against the man-eating abominations.

After witnessing a horrific personal loss at the hands of the invading creatures, Eren Yeager dedicates his life to their eradication by enlisting into the Survey Corps, an elite military unit that combats the merciless humanoids outside the protection of the walls. Eren, his adopted sister Mikasa Ackerman, and his childhood friend Armin Arlert join the brutal war against the Titans and race to discover a way of defeating them before the last walls are breached.

[Written by MAL Rewrite]",8.55,117.0,1,4074761,2877072,white,tv,finished_airing,"[{'id': 1, 'name': 'Action'}, {'id': 46, 'name': 'Award Winning'}, {'id': 8, 'name': 'Drama'}, {'id': 58, 'name': 'Gore'}, {'id': 38, 'name': 'Military'}, {'id': 27, 'name': 'Shounen'}, {'id': 76, 'name': 'Survival'}, {'id': 41, 'name': 'Suspense'}]",25,manga,1440,r,"[{'id': 858, 'name': 'Wit Studio'}]",1,sunday,01:58,2013.0,spring,205687,3576568,52261,62620,177488,4074624.0,0.9718,0.0282
1535,Death Note,2006-10-04,2007-06-27,"Brutal murders, petty thefts, and senseless violence pollute the human world. In contrast, the realm of death gods is a humdrum, unchanging gambling den. The ingenious 17-year-old Japanese student Light Yagami and sadistic god of death Ryuk share one belief: their worlds are rotten.

For his own amusement, Ryuk drops his Death Note into the human world. Light stumbles upon it, deeming the first of its rules ridiculous: the human whose name is written in this note shall die. However, the temptation is too great, and Light experiments by writing a felon's name, which disturbingly enacts his first murder.

Aware of the terrifying godlike power that has fallen into his hands, Light—under the alias Kira—follows his wicked sense of justice with the ultimate goal of cleansing the world of all evil-doers. The meticulous mastermind detective L is already on his trail, but as Light's brilliance rivals L's, the grand chase for Kira turns into an intense battle of wits that can only end when one of them is dead.

[Written by MAL Rewrite]
",8.62,88.0,2,4023422,2821896,white,tv,finished_airing,"[{'id': 40, 'name': 'Psychological'}, {'id': 27, 'name': 'Shounen'}, {'id': 37, 'name': 'Supernatural'}, {'id': 41, 'name': 'Suspense'}]",37,manga,1380,r,"[{'id': 11, 'name': 'Madhouse'}]",2,wednesday,00:56,2006.0,fall,198848,3348716,111727,122544,241467,4023302.0,0.9418,0.0582
5114,Fullmetal Alchemist: Brotherhood,2009-04-05,2010-07-04,"After a horrific alchemy experiment goes wrong in the Elric household, brothers Edward and Alphonse are left in a catastrophic new reality. Ignoring the alchemical principle banning human transmutation, the boys attempted to bring their recently deceased mother back to life. Instead, they suffered brutal personal loss: Alphonse's body disintegrated while Edward lost a leg and then sacrificed an arm to keep Alphonse's soul in the physical realm by binding it to a hulking suit of armor.

The brothers are rescued by their neighbor Pinako Rockbell and her granddaughter Winry. Known as a bio-mechanical engineering prodigy, Winry creates prosthetic limbs for Edward by utilizing ""automail,"" a tough, versatile metal used in robots and combat armor. After years of training, the Elric brothers set off on a quest to restore their bodies by locating the Philosopher's Stone—a powerful gem that allows an alchemist to defy the traditional laws of Equivalent Exchange.

As Edward becomes an infamous alchemist and gains the nickname ""Fullmetal,"" the boys' journey embroils them in a growing conspiracy that threatens the fate of the world.

[Written by MAL Rewrite]",9.1,2.0,3,3449576,2176872,white,tv,finished_airing,"[{'id': 1, 'name': 'Action'}, {'id': 2, 'name': 'Adventure'}, {'id': 8, 'name': 'Drama'}, {'id': 10, 'name': 'Fantasy'}, {'id': 38, 'name': 'Military'}, {'id': 27, 'name': 'Shounen'}]",64,manga,1460,r,"[{'id': 4, 'name': 'Bones'}]",3,sunday,17:00,2009.0,spring,266740,2493287,115523,61447,512493,3449490.0,0.9487,0.0513
30276,One Punch Man,2015-10-05,2015-12-21,"The seemingly unimpressive Saitama has a rather unique hobby: being a hero. In order to pursue his childhood dream, Saitama relentlessly trained for three years, losing all of his hair in the process. Now, Saitama is so powerful, he can defeat any enemy with just one punch. However, having no one capable of matching his strength has led Saitama to an unexpected problem—he is no longer able to enjoy the thrill of battling and has become quite bored.

One day, Saitama catches the attention of 19-year-old cyborg Genos, who witnesses his power and wishes to become Saitama's disciple. Genos proposes that the two join the Hero Association in order to become certified heroes that will be recognized for their positive contributions to society. Saitama, who is shocked that no one knows who he is, quickly agrees. Meeting new allies and taking on new foes, Saitama embarks on a new journey as a member of the Hero Association to experience the excitement of battle he once felt.

[Written by MAL Rewrite]",8.49,147.0,4,3318935,2295169,white,tv,finished_airing,"[{'id': 1, 'name': 'Action'}, {'id': 50, 'name': 'Adult Cast'}, {'id': 4, 'name': 'Comedy'}, {'id': 20, 'name': 'Parody'}, {'id': 42, 'name': 'Seinen'}, {'id': 31, 'name': 'Super Power'}]",12,web_manga,1460,r,"[{'id': 11, 'name': 'Madhouse'}]",4,monday,01:05,2015.0,fall,141172,2898976,45564,42005,191097,3318814.0,0.9736,0.0264
38000,Kimetsu no Yaiba,2019-04-06,2019-09-28,"Ever since the death of his father, the burden of supporting the family has fallen upon Tanjirou Kamado's shoulders. Though living impoverished on a remote mountain, the Kamado family are able to enjoy a relatively peaceful and happy life. One day, Tanjirou decides to go down to the local village to make a little money selling charcoal. On his way back, night falls, forcing Tanjirou to take shelter in the house of a strange man, who warns him of the existence of flesh-eating demons that lurk in the woods at night.

When he finally arrives back home the next day, he is met with a horrifying sight—his whole family has been slaughtered. Worse still, the sole survivor is his sister Nezuko, who has been turned into a bloodthirsty demon. Consumed by rage and hatred, Tanjirou swears to avenge his family and stay by his only remaining sibling. Alongside the mysterious group calling themselves the Demon Slayer Corps, Tanjirou will do whatever it takes to slay the demons and protect the remnants of his beloved sister's humanity.

[Written by MAL Rewrite]",8.45,163.0,5,3168484,2179203,white,tv,finished_airing,"[{'id': 1, 'name': 'Action'}, {'id': 46, 'name': 'Award Winning'}, {'id': 13, 'name': 'Historical'}, {'id': 27, 'name': 'Shounen'}, {'id': 37, 'name': 'Supernatural'}]",26,manga,1420,r,"[{'id': 43, 'name': 'ufotable'}]",5,saturday,23:30,2019.0,spring,222275,2668381,44852,44654,188195,3168357.0,0.9718,0.0282
11757,Sword Art Online,2012-07-08,2012-12-23,"Ever since the release of the innovative NerveGear, gamers from all around the globe have been given the opportunity to experience a completely immersive virtual reality. Sword Art Online (SAO), one of the most recent games on the console, offers a gateway into the wondrous world of Aincrad, a vivid, medieval landscape where users can do anything within the limits of imagination. With the release of this worldwide sensation, gaming has never felt more lifelike.

However, the idyllic fantasy rapidly becomes a brutal nightmare when SAO's creator traps thousands of players inside the game. The ""log-out"" function has been removed, with the only method of escape involving beating all of Aincrad's one hundred increasingly difficult levels. Adding to the struggle, any in-game death becomes permanent, ending the player's life in the real world.

While Kazuto ""Kirito"" Kirigaya was fortunate enough to be a beta-tester for the game, he quickly finds that despite his advantages, he cannot overcome SAO's challenges alone. Teaming up with Asuna Yuuki and other talented players, Kirito makes an effort to face the seemingly insurmountable trials head-on. But with difficult bosses and threatening dark cults impeding his progress, Kirito finds that such tasks are much easier said than done.

[Written by MAL Rewrite]",7.21,3271.0,6,3151402,2191791,white,tv,finished_airing,"[{'id': 1, 'name': 'Action'}, {'id': 2, 'name': 'Adventure'}, {'id': 10, 'name': 'Fantasy'}, {'id': 64, 'name': 'Love Polygon'}, {'id': 22, 'name': 'Romance'}, {'id': 79, 'name': 'Video Game'}]",25,light_novel,1420,pg_13,"[{'id': 56, 'name': 'A-1 Pictures'}]",6,sunday,00:00,2012.0,summer,115445,2698336,37111,130063,170294,3151249.0,0.9469,0.0531
31964,Boku no Hero Academia,2016-04-03,2016-06-26,"The appearance of ""quirks,"" newly discovered super powers, has been steadily increasing over the years, with 80 percent of humanity possessing various abilities from manipulation of elements to shapeshifting. This leaves the remainder of the world completely powerless, and Izuku Midoriya is one such individual.

Since he was a child, the ambitious middle schooler has wanted nothing more than to be a hero. Izuku's unfair fate leaves him admiring heroes and taking notes on them whenever he can. But it seems that his persistence has borne some fruit: Izuku meets the number one hero and his personal idol, All Might. All Might's quirk is a unique ability that can be inherited, and he has chosen Izuku to be his successor!

Enduring many months of grueling training, Izuku enrolls in UA High, a prestigious high school famous for its excellent hero training program, and this year's freshmen look especially promising. With his bizarre but talented classmates and the looming threat of a villainous organization, Izuku will soon learn what it really means to be a hero.

[Written by MAL Rewrite]",7.85,918.0,7,3114880,2120861,white,tv,finished_airing,"[{'id': 1, 'name': 'Action'}, {'id': 23, 'name': 'School'}, {'id': 27, 'name': 'Shounen'}, {'id': 31, 'name': 'Super Power'}]",13,manga,1470,pg_13,"[{'id': 4, 'name': 'Bones'}]",7,sunday,17:00,2016.0,spring,136945,2727874,30983,44505,174483,3114790.0,0.9758,0.0242
11061,Hunter x Hunter (2011),2011-10-02,2014-09-24,"Hunters devote themselves to accomplishing hazardous tasks, all from traversing the world's uncharted territories to locating rare items and monsters. Before becoming a Hunter, one must pass the Hunter Examination—a high-risk selection process in which most applicants end up handicapped or worse, deceased.

Ambitious participants who challenge the notorious exam carry their own reason. What drives 12-year-old Gon Freecss is finding Ging, his father and a Hunter himself. Believing that he will meet his father by becoming a Hunter, Gon takes the first step to walk the same path.

During the Hunter Examination, Gon befriends the medical student Leorio Paladiknight, the vindictive Kurapika, and ex-assassin Killua Zoldyck. While their motives vastly differ from each other, they band together for a common goal and begin to venture into a perilous world.

[Written by MAL Rewrite]",9.03,9.0,8,2945832,1829281,white,tv,finished_airing,"[{'id': 1, 'name': 'Action'}, {'id': 2, 'name': 'Adventure'}, {'id': 10, 'name': 'Fantasy'}, {'id': 27, 'name': 'Shounen'}]",148,manga,1417,pg_13,"[{'id': 11, 'name': 'Madhouse'}]",8,sunday,10:55,2011.0,fall,363676,2005920,143175,63154,369796,2945721.0,0.93,0.07
20,Naruto,2002-10-03,2007-02-08,"Moments before Naruto Uzumaki's birth, a huge demon known as the Nine-Tailed Fox attacked Konohagakure, the Hidden Leaf Village, and wreaked havoc. In order to put an end to the demon's rampage, the leader of the village, the Fourth Hokage, sacrificed his life and sealed the monstrous beast inside the newborn Naruto.

In the present, Naruto is a hyperactive and knuckle-headed ninja growing up within Konohagakure. Shunned because of the demon inside him, Naruto struggles to find his place in the village. His one burning desire to become the Hokage and be acknowledged by the villagers who despite him. However, while his goal leads him to unbreakable bonds with lifelong friends, it also lands him in the crosshairs of many deadly foes.

[Written by MAL Rewrite]",8.0,668.0,9,2936642,2024775,white,tv,finished_airing,"[{'id': 1, 'name': 'Action'}, {'id': 2, 'name': 'Adventure'}, {'id': 10, 'name': 'Fantasy'}, {'id': 17, 'name': 'Martial Arts'}, {'id': 27, 'name': 'Shounen'}]",220,manga,1404,pg_13,"[{'id': 1, 'name': 'Pierrot'}]",9,thursday,19:30,2002.0,fall,211928,2388547,94359,134187,107536,2936557.0,0.9222,0.0778
22319,Tokyo Ghoul,2014-07-04,2014-09-19,"A sinister threat is invading Tokyo: flesh-eating ""ghouls"" who appear identical to humans and blend into their population. Reserved college student Ken Kaneki buries his nose in books and avoids the news of the growing crisis. However, the appearance of an attractive woman named Rize Kamishiro shatters his solitude when she forwardly asks him on a date.

While walking Rize home, Kaneki discovers she isn't as kind as she first appeared, and she has led him on with sinister intent. After a tragic struggle, he later awakens in a hospital to learn his life was saved by transplanting the now deceased Rize's organs into his own body.

Kaneki's body begins to change in horrifying ways, and he transforms into a human-ghoul hybrid. As he embarks on his new dreadful journey, Kaneki clings to his humanity in the evolving bloody conflict between society's new monsters and the government agents who hunt them.

[Written by MAL Rewrite]",7.79,1046.0,10,2896600,1907756,white,tv,finished_airing,"[{'id': 1, 'name': 'Action'}, {'id': 10, 'name': 'Fantasy'}, {'id': 58, 'name': 'Gore'}, {'id': 14, 'name': 'Horror'}, {'id': 40, 'name': 'Psychological'}, {'id': 42, 'name': 'Seinen'}, {'id': 41, 'name': 'Suspense'}, {'id': 82, 'name': 'Urban Fantasy'}]",12,manga,1440,r,"[{'id': 1, 'name': 'Pierrot'}]",10,friday,00:00,2014.0,summer,110516,2450759,37007,60728,237485,2896495.0,0.9663,0.0337
32281,Kimi no Na wa.,2016-08-26,2016-08-26,"Mitsuha Miyamizu, a high school girl, yearns to live the life of a boy in the bustling city of Tokyo—a dream that stands in stark contrast to her present life in the countryside. Meanwhile in the city, Taki Tachibana lives a busy life as a high school student while juggling his part-time job and hopes for a future in architecture.

One day, Mitsuha awakens in a room that is not her own and suddenly finds herself living the dream life in Tokyo—but in Taki's body! Elsewhere, Taki finds himself living Mitsuha's life in the humble countryside. In pursuit of an answer to this strange phenomenon, they begin to search for one another.

Kimi no Na wa. revolves around Mitsuha and Taki's actions, which begin to have a dramatic impact on each other's lives, weaving them into a fabric held together by fate and circumstance.

[Written by MAL Rewrite]",8.83,29.0,11,2834958,1959014,white,movie,finished_airing,"[{'id': 46, 'name': 'Award Winning'}, {'id': 8, 'name': 'Drama'}]",1,original,6391,pg_13,"[{'id': 291, 'name': 'CoMix Wave Films'}]",11,NIL,NIL,2016.0,summer,64225,2455019,7441,4062,304078,2834825.0,0.9959,0.0041
25777,Shingeki no Kyojin Season 2,2017-04-01,2017-06-17,"For centuries, humanity has been hunted by giant, mysterious predators known as the Titans. Three mighty walls—Wall Maria, Rose, and Sheena—provided peace and protection for humanity for over a hundred years. That peace, however, was shattered when the Colossal Titan and Armored Titan appeared and destroyed the outermost wall, Wall Maria. Forced to retreat behind Wall Rose, humanity waited with bated breath for the Titans to reappear and destroy their safe haven once more.

In Shingeki no Kyojin Season 2, Eren Yeager and others of the 104th Training Corps have just begun to become full members of the Survey Corps. As they ready themselves to face the Titans once again, their preparations are interrupted by the invasion of Wall Rose—but all is not as it seems as more mysteries are unraveled. As the Survey Corps races to save the wall, they uncover more about the invading Titans and the dark secrets of their own members.

[Written by MAL Rewrite]",8.52,133.0,12,2815437,1927271,white,tv,finished_airing,"[{'id': 1, 'name': 'Action'}, {'id': 8, 'name': 'Drama'}, {'id': 58, 'name': 'Gore'}, {'id': 38, 'name': 'Military'}, {'id': 27, 'name': 'Shounen'}, {'id': 76, 'name': 'Survival'}, {'id': 41, 'name': 'Suspense'}]",12,manga,1450,r,"[{'id': 858, 'name': 'Wit Studio'}]",12,saturday,22:00,2017.0,spring,89613,2525323,17934,16759,165742,2815371.0,0.9877,0.0123
40748,Jujutsu Kaisen,2020-10-03,2021-03-27,"Idly indulging in baseless paranormal activities with the Occult Club, high schooler Yuuji Itadori spends his days at either the clubroom or the hospital, where he visits his bedridden grandfather. However, this leisurely lifestyle soon takes a turn for the strange when he unknowingly encounters a cursed item. Triggering a chain of supernatural occurrences, Yuuji finds himself suddenly thrust into the world of Curses—dreadful beings formed from human malice and negativity—after swallowing the said item, revealed to be a finger belonging to the demon Sukuna Ryoumen, the King of Curses.

Yuuji experiences first-hand the threat these Curses pose to society as he discovers his own newfound powers. Introduced to the Tokyo Prefectural Jujutsu High School, he begins to walk down a path from which he cannot return—the path of a Jujutsu sorcerer.

[Written by MAL Rewrite]",8.57,106.0,13,2710856,1778122,white,tv,finished_airing,"[{'id': 1, 'name': 'Action'}, {'id': 46, 'name': 'Award Winning'}, {'id': 23, 'name': 'School'}, {'id': 27, 'name': 'Shounen'}, {'id': 37, 'name': 'Supernatural'}]",24,manga,1435,r,"[{'id': 569, 'name': 'MAPPA'}]",13,saturday,01:25,2020.0,fall,354573,2079083,46062,30329,200659,2710706.0,0.9718,0.0282
9253,Steins;Gate,2011-04-06,2011-09-14,"Eccentric scientist Rintarou Okabe has a never-ending thirst for scientific exploration. Together with his ditzy but well-meaning friend Mayuri Shiina and his roommate Itaru Hashida, Okabe founds the Future Gadget Laboratory in the hopes of creating technological innovations that baffle the human psyche. Despite claims of grandeur, the only notable ""gadget"" the trio have created is a microwave that has the mystifying power to turn bananas into green goo.

However, when Okabe attends a conference on time travel, he experiences a series of strange events that lead him to believe that there is more to the ""Phone Microwave"" gadget than meets the eye. Apparently able to send text messages into the past using the microwave, Okabe dabbles further with the ""time machine,"" attracting the ire and attention of the mysterious organization SERN.

Due to the novel discovery, Okabe and his friends find themselves in an ever-present danger. As he works to mitigate the damage his invention has caused to the timeline, Okabe fights a battle to not only save his loved ones but also to preserve his degrading sanity.

[Written by MAL Rewrite]",9.07,4.0,14,2642994,1437085,white,tv,finished_airing,"[{'id': 8, 'name': 'Drama'}, {'id': 40, 'name': 'Psychological'}, {'id': 24, 'name': 'Sci-Fi'}, {'id': 41, 'name': 'Suspense'}, {'id': 78, 'name': 'Time Travel'}]",24,visual_novel,1460,pg_13,"[{'id': 314, 'name': 'White Fox'}]",14,wednesday,02:05,2011.0,spring,172734,1657140,91384,57953,663671,2642882.0,0.9435,0.0565
33486,Boku no Hero Academia 2nd Season,2017-04-01,2017-09-30,"At UA Academy, not even a violent attack can disrupt their most prestigious event: the school sports festival. Renowned across Japan, this festival is an opportunity for aspiring heroes to showcase their abilities, both to the public and potential recruiters.

However, the path to glory is never easy, especially for Izuku Midoriya—whose quirk possesses great raw power but is also cripplingly inefficient. Pitted against his talented classmates, such as the fire and ice wielding Shouto Todoroki, Izuku must utilize his sharp wits and master his surroundings to achieve victory and prove to the world his worth.

[Written by MAL Rewrite]",8.07,546.0,15,2591636,1765739,white,tv,finished_airing,"[{'id': 1, 'name': 'Action'}, {'id': 23, 'name': 'School'}, {'id': 27, 'name': 'Shounen'}, {'id': 31, 'name': 'Super Power'}]",25,manga,1430,pg_13,"[{'id': 4, 'name': 'Bones'}]",15,saturday,17:30,2017.0,spring,126224,2319272,21414,21900,102775,2591585.0,0.9833,0.0167
1735,Naruto: Shippuuden,2007-02-15,2017-03-23,"It has been two and a half years since Naruto Uzumaki left Konohagakure, the Hidden Leaf Village, for intense training following events which fueled his desire to be stronger. Now Akatsuki, the mysterious organization of elite rogue ninja, is closing in on their grand plan which may threaten the safety of the entire shinobi world.
 
Although Naruto is older and sinister events loom on the horizon, he has changed little in personality—still rambunctious and childish—though he is now far more confident and possesses an even greater determination to protect his friends and home. Come whatever may, Naruto will carry on with the fight for what is important to him, even at the expense of his own body, in the continuation of the saga about the boy who wishes to become Hokage.

[Written by MAL Rewrite]",8.27,312.0,16,2568750,1709493,white,tv,finished_airing,"[{'id': 1, 'name': 'Action'}, {'id': 2, 'name': 'Adventure'}, {'id': 10, 'name': 'Fantasy'}, {'id': 17, 'name': 'Martial Arts'}, {'id': 27, 'name': 'Shounen'}]",500,manga,1389,pg_13,"[{'id': 1, 'name': 'Pierrot'}]",16,thursday,19:30,2007.0,winter,442141,1693732,142088,158127,132575,2568663.0,0.8831,0.1169
21,One Piece,1999-10-20,airing,"Barely surviving in a barrel after passing through a terrible whirlpool at sea, carefree Monkey D. Luffy ends up aboard a ship under attack by fearsome pirates. Despite being a naive-looking teenager, he is not to be underestimated. Unmatched in battle, Luffy is a pirate himself who resolutely pursues the coveted One Piece treasure and the King of the Pirates title that comes with it.

The late King of the Pirates, Gol D. Roger, stirred up the world before his death by disclosing the whereabouts of his hoard of riches and daring everyone to obtain it. Ever since then, countless powerful pirates have sailed dangerous seas for the prized One Piece only to never return. Although Luffy lacks a crew and a proper ship, he is endowed with a superhuman ability and an unbreakable spirit that make him not only a formidable adversary but also an inspiration to many.

As he faces numerous challenges with a big smile on his face, Luffy gathers one-of-a-kind companions to join him in his ambitious endeavor, together embracing perils and wonders on their once-in-a-lifetime adventure.

[Written by MAL Rewrite]",8.73,54.0,17,2463183,1398712,white,tv,currently_airing,"[{'id': 1, 'name': 'Action'}, {'id': 2, 'name': 'Adventure'}, {'id': 10, 'name': 'Fantasy'}, {'id': 27, 'name': 'Shounen'}]",0,manga,1440,pg_13,"[{'id': 18, 'name': 'Toei Animation'}]",17,sunday,09:30,1999.0,fall,1746533,16,297039,195959,223517,2463064.0,0.7998,0.2002
35760,Shingeki no Kyojin Season 3,2018-07-23,2018-10-15,"Still threatened by the ""Titans"" that rob them of their freedom, mankind remains caged inside the two remaining walls. Efforts to eradicate these monsters continue; however, threats arise not only from the Titans beyond the walls, but from the humans within them as well.

After being rescued from the Colossal and Armored Titans, Eren Yaeger devotes himself to improving his Titan form. Krista Lenz struggles to accept the loss of her friend, Captain Levi chooses Eren and his friends to form his new personal squad, and Commander Erwin Smith recovers from his injuries. All seems well for the soldiers, until the government suddenly demands custody of Eren and Krista. The Survey Corps' recent successes have drawn attention, and a familiar face from Levi's past is sent to collect the wanted soldiers. Sought after by the government, Levi and his new squad must evade their adversaries in hopes of keeping Eren and Krista safe.

Eren and his fellow soldiers are not only fighting for their survival against the terrifying Titans, but also against the terror of a far more conniving foe: their fellow humans.

[Written by MAL Rewrite]",8.63,83.0,18,2461680,1672823,white,tv,finished_airing,"[{'id': 1, 'name': 'Action'}, {'id': 8, 'name': 'Drama'}, {'id': 58, 'name': 'Gore'}, {'id': 38, 'name': 'Military'}, {'id': 27, 'name': 'Shounen'}, {'id': 76, 'name': 'Survival'}, {'id': 41, 'name': 'Suspense'}]",12,manga,1434,r,"[{'id': 858, 'name': 'Wit Studio'}]",18,monday,00:35,2018.0,summer,79016,2201696,13961,10499,156446,2461618.0,0.9901,0.0099
