id,title,start_date,end_date,synopsis,mean,rank,popularity,num_list_users,num_scoring_users,nsfw,media_type,status,genres,num_episodes,source,average_episode_duration,rating,studios,all_ranking,Unnamed: 27,Unnamed: 28,Unnamed: 29,Unnamed: 30,Unnamed: 31,broadcast_day_of_the_week,broadcast_start_time,start_season_year,start_season_season,statistics_watching,statistics_completed,statistics_on_hold,statistics_dropped,statistics_plan_to_watch,statistics_num_list_users,positive_viewership_fraction,negative_viewership_fraction
52991,Sousou no Frieren,2023-09-29,2024-03-22,"During their decade-long quest to defeat the Demon King, the members of the hero's party—Himmel himself, the priest Heiter, the dwarf warrior Eisen, and the elven mage Frieren—forge bonds through adventures and battles, creating unforgettable precious memories for most of them.

However, the time that Frieren spends with her comrades is equivalent to merely a fraction of her life, which has lasted over a thousand years. When the party disbands after their victory, Frieren casually returns to her ""usual"" routine of collecting spells across the continent. Due to her different sense of time, she seemingly holds no strong feelings toward the experiences she went through.

As the years pass, Frieren gradually realizes how her days in the hero's party truly impacted her. Witnessing the deaths of two of her former companions, Frieren begins to regret having taken their presence for granted; she vows to better understand humans and create real personal connections. Although the story of that once memorable journey has long ended, a new tale is about to begin.

[Written by MAL Rewrite]",9.32,1.0,176,967439,555887,white,tv,finished_airing,"[{'id': 2, 'name': 'Adventure'}, {'id': 8, 'name': 'Drama'}, {'id': 10, 'name': 'Fantasy'}, {'id': 27, 'name': 'Shounen'}]",28,manga,1470,pg_13,"[{'id': 11, 'name': 'Madhouse'}]",1,,,,,,friday,23:00,2023.0,fall,210046,548454,18386,12235,178118,967239.0,0.9683,0.0317
5114,Fullmetal Alchemist: Brotherhood,2009-04-05,2010-07-04,"After a horrific alchemy experiment goes wrong in the Elric household, brothers Edward and Alphonse are left in a catastrophic new reality. Ignoring the alchemical principle banning human transmutation, the boys attempted to bring their recently deceased mother back to life. Instead, they suffered brutal personal loss: Alphonse's body disintegrated while Edward lost a leg and then sacrificed an arm to keep Alphonse's soul in the physical realm by binding it to a hulking suit of armor.

The brothers are rescued by their neighbor Pinako Rockbell and her granddaughter Winry. Known as a bio-mechanical engineering prodigy, Winry creates prosthetic limbs for Edward by utilizing ""automail,"" a tough, versatile metal used in robots and combat armor. After years of training, the Elric brothers set off on a quest to restore their bodies by locating the Philosopher's Stone—a powerful gem that allows an alchemist to defy the traditional laws of Equivalent Exchange.

As Edward becomes an infamous alchemist and gains the nickname ""Fullmetal,"" the boys' journey embroils them in a growing conspiracy that threatens the fate of the world.

[Written by MAL Rewrite]",9.1,2.0,3,3449576,2176872,white,tv,finished_airing,"[{'id': 1, 'name': 'Action'}, {'id': 2, 'name': 'Adventure'}, {'id': 8, 'name': 'Drama'}, {'id': 10, 'name': 'Fantasy'}, {'id': 38, 'name': 'Military'}, {'id': 27, 'name': 'Shounen'}]",64,manga,1460,r,"[{'id': 4, 'name': 'Bones'}]",2,,,,,,sunday,17:00,2009.0,spring,266740,2493287,115523,61447,512493,3449490.0,0.9487,0.0513
60022,One Piece Fan Letter,2024-10-20,2024-10-20,"Two years after the Summit War in which Straw Hat pirate Luffy lost his brother Ace, the story takes place on the Sabaody Archipelago. The protagonist, a young girl who has a strong admiration for Nami, sets off on a small adventure. This is an ensemble drama that focuses on people who do not ""pursue"" ONE PIECE, depicting the reunion of the Straw Hat Pirates from their perspective.

(Source: Official site, translated)",9.1,3.0,2712,70837,54609,white,tv_special,finished_airing,"[{'id': 1, 'name': 'Action'}, {'id': 2, 'name': 'Adventure'}, {'id': 10, 'name': 'Fantasy'}, {'id': 27, 'name': 'Shounen'}]",1,light_novel,1495,pg_13,"[{'id': 18, 'name': 'Toei Animation'}]",3,,,,,,NIL,NIL,2024.0,fall,3257,60573,209,387,6409,70835.0,0.9916,0.0084
9253,Steins,"{'medium': 'https://cdn.myanimelist.net/images/anime/1935/127974.jpg', 'large': 'https://cdn.myanimelist.net/images/anime/1935/127974l.jpg'}",2011-04-06,"Eccentric scientist Rintarou Okabe has a never-ending thirst for scientific exploration. Together with his ditzy but well-meaning friend Mayuri Shiina and his roommate Itaru Hashida, Okabe founds the Future Gadget Laboratory in the hopes of creating technological innovations that baffle the human psyche. Despite claims of grandeur, the only notable ""gadget"" the trio have created is a microwave that has the mystifying power to turn bananas into green goo.

However, when Okabe attends a conference on time travel, he experiences a series of strange events that lead him to believe that there is more to the ""Phone Microwave"" gadget than meets the eye. Apparently able to send text messages into the past using the microwave, Okabe dabbles further with the ""time machine,"" attracting the ire and attention of the mysterious organization SERN.

Due to the novel discovery, Okabe and his friends find themselves in an ever-present danger. As he works to mitigate the damage his invention has caused to the timeline, Okabe fights a battle to not only save his loved ones but also to preserve his degrading sanity.

[Written by MAL Rewrite]",9.07,4.0,4,14,2642889,1437029,2024-01-22T17:31:43+00:00,tv,finished_airing,"[{'id': 8, 'name': 'Drama'}, {'id': 40, 'name': 'Psychological'}, {'id': 24, 'name': 'Sci-Fi'}, {'id': 41, 'name': 'Suspense'}, {'id': 78, 'name': 'Time Travel'}]","{'day_of_the_week': 'wednesday', 'start_time': '02:05'}",visual_novel,1460,,"[{'id': 314, 'name': 'White Fox'}]","{'status': {'watching': '172724', 'completed': '1657072', 'on_hold': '91380', 'dropped': '57952', 'plan_to_watch': '663649'}, 'num_list_users': 2642777}",,,,,,NIL,,,,,,,,,,
38524,Shingeki no Kyojin Season 3 Part 2,2019-04-29,2019-07-01,"Seeking to restore humanity's diminishing hope, the Survey Corps embark on a mission to retake Wall Maria, where the battle against the merciless ""Titans"" takes the stage once again.

Returning to the tattered Shiganshina District that was once his home, Eren Yeager and the Corps find the town oddly unoccupied by Titans. Even after the outer gate is plugged, they strangely encounter no opposition. The mission progresses smoothly until Armin Arlert, highly suspicious of the enemy's absence, discovers distressing signs of a potential scheme against them. 

Shingeki no Kyojin Season 3 Part 2 follows Eren as he vows to take back everything that was once his. Alongside him, the Survey Corps strive—through countless sacrifices—to carve a path towards victory and uncover the secrets locked away in the Yeager family's basement.

[Written by MAL Rewrite]",9.05,5.0,21,2376571,1649971,white,tv,finished_airing,"[{'id': 1, 'name': 'Action'}, {'id': 8, 'name': 'Drama'}, {'id': 58, 'name': 'Gore'}, {'id': 38, 'name': 'Military'}, {'id': 27, 'name': 'Shounen'}, {'id': 76, 'name': 'Survival'}, {'id': 41, 'name': 'Suspense'}]",10,manga,1435,r,"[{'id': 858, 'name': 'Wit Studio'}]",5,,,,,,monday,00:10,2019.0,spring,81316,2145253,9637,7964,132342,2376512.0,0.9926,0.0074
28977,Gintama°,2015-04-08,2016-03-30,"Gintoki, Shinpachi, and Kagura return as the fun-loving but broke members of the Yorozuya team! Living in an alternate-reality Edo, where swords are prohibited and alien overlords have conquered Japan, they try to thrive on doing whatever work they can get their hands on. However, Shinpachi and Kagura still haven't been paid... Does Gin-chan really spend all that cash playing pachinko?

Meanwhile, when Gintoki drunkenly staggers home one night, an alien spaceship crashes nearby. A fatally injured crew member emerges from the ship and gives Gintoki a strange, clock-shaped device, warning him that it is incredibly powerful and must be safeguarded. Mistaking it for his alarm clock, Gintoki proceeds to smash the device the next morning and suddenly discovers that the world outside his apartment has come to a standstill. With Kagura and Shinpachi at his side, he sets off to get the device fixed; though, as usual, nothing is ever that simple for the Yorozuya team.

Filled with tongue-in-cheek humor and moments of heartfelt emotion, Gintama's fourth season finds Gintoki and his friends facing both their most hilarious misadventures and most dangerous crises yet.

[Written by MAL Rewrite]",9.05,6.0,340,651000,258355,white,tv,finished_airing,"[{'id': 1, 'name': 'Action'}, {'id': 4, 'name': 'Comedy'}, {'id': 57, 'name': 'Gag Humor'}, {'id': 13, 'name': 'Historical'}, {'id': 20, 'name': 'Parody'}, {'id': 21, 'name': 'Samurai'}, {'id': 24, 'name': 'Sci-Fi'}, {'id': 27, 'name': 'Shounen'}]",51,manga,1440,pg_13,"[{'id': 1258, 'name': 'Bandai Namco Pictures'}]",6,,,,,,wednesday,18:00,2015.0,spring,70582,273269,25329,19516,262288,650984.0,0.9311,0.0689
39486,Gintama: The Final,2021-01-08,2021-01-08,"Two years have passed following the Tendoshuu's invasion of the O-Edo Central Terminal. Since then, the Yorozuya have gone their separate ways. Foreseeing Utsuro's return, Gintoki Sakata begins surveying Earth's ley lines for traces of the other man's Altana. After an encounter with the remnants of the Tendoshuu—who continue to press on in search of immortality—Gintoki returns to Edo.

Later, the regrouped Shinsengumi and Yorozuya begin an attack on the occupied Central Terminal. With the Altana harvested by the wreckage of the Tendoshuu's ship in danger of detonating, the Yorozuya and their allies fight their enemies while the safety of Edo—and the rest of the world—hangs in the balance. Fulfilling the wishes of their teacher, Shouyou Yoshida's former students unite and relive their pasts one final time in an attempt to save their futures.

[Written by MAL Rewrite]
",9.04,7.0,1537,160484,76758,white,movie,finished_airing,"[{'id': 1, 'name': 'Action'}, {'id': 4, 'name': 'Comedy'}, {'id': 8, 'name': 'Drama'}, {'id': 57, 'name': 'Gag Humor'}, {'id': 13, 'name': 'Historical'}, {'id': 20, 'name': 'Parody'}, {'id': 21, 'name': 'Samurai'}, {'id': 24, 'name': 'Sci-Fi'}, {'id': 27, 'name': 'Shounen'}]",1,manga,6240,pg_13,"[{'id': 1258, 'name': 'Bandai Namco Pictures'}]",7,,,,,,NIL,NIL,2021.0,winter,7246,88689,1707,1574,61259,160475.0,0.9796,0.0204
9969,Gintama',2011-04-04,2012-03-26,"After a one-year hiatus, Shinpachi Shimura returns to Edo, only to stumble upon a shocking surprise: Gintoki and Kagura, his fellow Yorozuya members, have become completely different characters! Fleeing from the Yorozuya headquarters in confusion, Shinpachi finds that all the denizens of Edo have undergone impossibly extreme changes, in both appearance and personality. Most unbelievably, his sister Otae has married the Shinsengumi chief and shameless stalker Isao Kondou and is pregnant with their first child.

Bewildered, Shinpachi agrees to join the Shinsengumi at Otae and Kondou's request and finds even more startling transformations afoot both in and out of the ranks of the the organization. However, discovering that Vice Chief Toushirou Hijikata has remained unchanged, Shinpachi and his unlikely Shinsengumi ally set out to return the city of Edo to how they remember it.

With even more dirty jokes, tongue-in-cheek parodies, and shameless references, Gintama' follows the Yorozuya team through more of their misadventures in the vibrant, alien-filled world of Edo.

[Written by MAL Rewrite]",9.03,8.0,399,574734,243871,white,tv,finished_airing,"[{'id': 1, 'name': 'Action'}, {'id': 4, 'name': 'Comedy'}, {'id': 57, 'name': 'Gag Humor'}, {'id': 13, 'name': 'Historical'}, {'id': 20, 'name': 'Parody'}, {'id': 21, 'name': 'Samurai'}, {'id': 24, 'name': 'Sci-Fi'}, {'id': 27, 'name': 'Shounen'}]",51,manga,1460,pg_13,"[{'id': 14, 'name': 'Sunrise'}]",8,,,,,,monday,18:00,2011.0,spring,42758,287597,17061,11492,215808,574716.0,0.9503,0.0497
11061,Hunter x Hunter (2011),2011-10-02,2014-09-24,"Hunters devote themselves to accomplishing hazardous tasks, all from traversing the world's uncharted territories to locating rare items and monsters. Before becoming a Hunter, one must pass the Hunter Examination—a high-risk selection process in which most applicants end up handicapped or worse, deceased.

Ambitious participants who challenge the notorious exam carry their own reason. What drives 12-year-old Gon Freecss is finding Ging, his father and a Hunter himself. Believing that he will meet his father by becoming a Hunter, Gon takes the first step to walk the same path.

During the Hunter Examination, Gon befriends the medical student Leorio Paladiknight, the vindictive Kurapika, and ex-assassin Killua Zoldyck. While their motives vastly differ from each other, they band together for a common goal and begin to venture into a perilous world.

[Written by MAL Rewrite]",9.03,9.0,8,2945675,1829176,white,tv,finished_airing,"[{'id': 1, 'name': 'Action'}, {'id': 2, 'name': 'Adventure'}, {'id': 10, 'name': 'Fantasy'}, {'id': 27, 'name': 'Shounen'}]",148,manga,1417,pg_13,"[{'id': 11, 'name': 'Madhouse'}]",9,,,,,,sunday,10:55,2011.0,fall,363656,2005806,143162,63155,369785,2945564.0,0.93,0.07
15417,Gintama': Enchousen,2012-10-04,2013-03-28,"While Gintoki Sakata was away, the Yorozuya found themselves a new leader: Kintoki, Gintoki's golden-haired doppelganger. In order to regain his former position, Gintoki will need the help of those around him, a troubling feat when no one can remember him! Between Kintoki and Gintoki, who will claim the throne as the main character?

In addition, Yorozuya make a trip back down to red-light district of Yoshiwara to aid an elderly courtesan in her search for her long-lost lover. Although the district is no longer in chains beneath the earth's surface, the trio soon learn of the tragic backstories of Yoshiwara's inhabitants that still haunt them. With flashback after flashback, this quest has Yorozuya witnessing everlasting love and protecting it as best they can with their hearts and souls.

[Written by MAL Rewrite]",9.02,10.0,753,335158,169871,white,tv,finished_airing,"[{'id': 1, 'name': 'Action'}, {'id': 4, 'name': 'Comedy'}, {'id': 57, 'name': 'Gag Humor'}, {'id': 13, 'name': 'Historical'}, {'id': 20, 'name': 'Parody'}, {'id': 21, 'name': 'Samurai'}, {'id': 24, 'name': 'Sci-Fi'}, {'id': 27, 'name': 'Shounen'}]",13,manga,1460,pg_13,"[{'id': 14, 'name': 'Sunrise'}]",10,,,,,,thursday,18:00,2012.0,fall,11413,215835,3867,3100,100932,335147.0,0.9792,0.0208
41467,Bleach: Sennen Kessen-hen,2022-10-11,2022-12-27,"Substitute Soul Reaper Ichigo Kurosaki spends his days fighting against Hollows, dangerous evil spirits that threaten Karakura Town. Ichigo carries out his quest with his closest allies: Orihime Inoue, his childhood friend with a talent for healing; Yasutora Sado, his high school classmate with superhuman strength; and Uryuu Ishida, Ichigo's Quincy rival.

Ichigo's vigilante routine is disrupted by the sudden appearance of Asguiaro Ebern, a dangerous Arrancar who heralds the return of Yhwach, an ancient Quincy king. Yhwach seeks to reignite the historic blood feud between Soul Reaper and Quincy, and he sets his sights on erasing both the human world and the Soul Society for good.

Yhwach launches a two-pronged invasion into both the Soul Society and Hueco Mundo, the home of Hollows and Arrancar. In retaliation, Ichigo and his friends must fight alongside old allies and enemies alike to end Yhwach's campaign of carnage before the world itself comes to an end.

[Written by MAL Rewrite]",9.01,11.0,382,597990,314163,white,tv,finished_airing,"[{'id': 1, 'name': 'Action'}, {'id': 2, 'name': 'Adventure'}, {'id': 27, 'name': 'Shounen'}, {'id': 37, 'name': 'Supernatural'}]",13,manga,1471,r,"[{'id': 1, 'name': 'Pierrot'}]",11,,,,,,tuesday,00:00,2022.0,fall,87046,350814,7714,5181,147180,597935.0,0.9784,0.0216
820,Ginga Eiyuu Densetsu,1988-01-08,1997-03-17,"The 150-year-long stalemate between the two interstellar superpowers, the Galactic Empire and the Free Planets Alliance, comes to an end when a new generation of leaders arises: the idealistic military genius Reinhard von Lohengramm, and the FPA's reserved historian, Yang Wenli.

While Reinhard climbs the ranks of the Empire with the aid of his childhood friend, Siegfried Kircheis, he must fight not only the war, but also the remnants of the crumbling Goldenbaum Dynasty in order to free his sister from the Kaiser and unify humanity under one genuine ruler. Meanwhile, on the other side of the galaxy, Yang—a strong supporter of democratic ideals—has to stand firm in his beliefs, despite the struggles of the FPA, and show his pupil, Julian Mintz, that autocracy is not the solution.

As ideologies clash amidst the war's many casualties, the two strategic masterminds must ask themselves what the real reason behind their battle is.

[Written by MAL Rewrite]",9.01,12.0,758,333996,81737,white,ova,finished_airing,"[{'id': 50, 'name': 'Adult Cast'}, {'id': 8, 'name': 'Drama'}, {'id': 38, 'name': 'Military'}, {'id': 24, 'name': 'Sci-Fi'}, {'id': 29, 'name': 'Space'}]",110,novel,1560,r,"[{'id': 1269, 'name': 'K-Factory'}, {'id': 2256, 'name': 'Kitty Film Mitaka Studio'}]",12,,,,,,NIL,NIL,1988.0,winter,35292,74880,20469,8978,194368,333987.0,0.9118,0.0882
43608,Kaguya-sama wa Kokurasetai: Ultra Romantic,2022-04-09,2022-06-25,"The elite members of Shuchiin Academy's student council continue their competitive day-to-day antics. Council president Miyuki Shirogane clashes daily against vice-president Kaguya Shinomiya, each fighting tooth and nail to trick the other into confessing their romantic love. Kaguya struggles within the strict confines of her wealthy, uptight family, rebelling against her cold default demeanor as she warms to Shirogane and the rest of her friends.

Meanwhile, council treasurer Yuu Ishigami suffers under the weight of his hopeless crush on Tsubame Koyasu, a popular upperclassman who helps to instill a new confidence in him. Miko Iino, the newest student council member, grows closer to the rule-breaking Ishigami while striving to overcome her own authoritarian moral code.

As love further blooms at Shuchiin Academy, the student council officers drag their outsider friends into increasingly comedic conflicts.

[Written by MAL Rewrite]
",8.99,13.0,170,990645,560378,white,tv,finished_airing,"[{'id': 4, 'name': 'Comedy'}, {'id': 22, 'name': 'Romance'}, {'id': 23, 'name': 'School'}, {'id': 42, 'name': 'Seinen'}]",13,manga,1439,pg_13,"[{'id': 56, 'name': 'A-1 Pictures'}]",13,,,,,,saturday,00:00,2022.0,spring,90736,658228,14554,10558,216523,990599.0,0.9746,0.0254
56784,Bleach: Sennen Kessen-hen - Soukoku-tan,2024-10-05,airing,"After an awe-inspiring battle with Ichibei Hyousube—leader of the Soul Society's Royal Guard—the powerful Yhwach moves into the final stage of his master plan. He aims to slay the Soul King, the being whose very existence maintains the status quo of three worlds: Hueco Mundo, the Soul Society, and the realm of humans that Ichigo Kurosaki and his closest friends hail from. Conquering his own bout with the remainder of the Royal Guard, Uryuu Ishida joins Yhwach in his efforts to create a new world in his image.

With a flood of resolution and newfound power, Ichigo rushes to stop Yhwach from accomplishing his ultimate goal and save the countless lives within the three existing realms. But Ichigo has a complicated lineage, one that leaves him susceptible to Yhwach's sinister influence.

Meanwhile, in a final desperate gambit, Jirou Souzousuke Shunsui Kyouraku, the newly promoted head captain of the Soul Society's combat corps, enlists the help of an old enemy whose immense power may turn the tide of battle.

[Written by MAL Rewrite]",8.98,14.0,1437,172690,36378,white,tv,currently_airing,"[{'id': 1, 'name': 'Action'}, {'id': 2, 'name': 'Adventure'}, {'id': 27, 'name': 'Shounen'}, {'id': 37, 'name': 'Supernatural'}]",0,manga,1478,r,"[{'id': 2951, 'name': 'Pierrot Films'}]",14,,,,,,saturday,23:00,2024.0,fall,104502,3,1401,801,65978,172685.0,0.9872,0.0128
34096,Gintama.,2017-01-09,2017-03-27,"After joining the resistance against the bakufu, Gintoki and the gang are in hiding, along with Katsura and his Joui rebels. The Yorozuya is soon approached by Nobume Imai and two members of the Kiheitai, who explain that the Harusame pirates have turned against 7th Division Captain Kamui and their former ally Takasugi. The Kiheitai present Gintoki with a job: find Takasugi, who has been missing since his ship was ambushed in a Harusame raid. Nobume also makes a stunning revelation regarding the Tendoushuu, a secret organization pulling the strings of numerous factions, and their leader Utsuro, the shadowy figure with an uncanny resemblance to Gintoki's former teacher.

Hitching a ride on Sakamoto's space ship, the Yorozuya and Katsura set out for Rakuyou, Kagura's home planet, where the various factions have gathered and tensions are brewing. Long-held grudges, political infighting, and the Tendoushuu's sinister overarching plan finally culminate into a massive, decisive battle on Rakuyou.

[Written by MAL Rewrite]",8.98,15.0,780,324922,150521,white,tv,finished_airing,"[{'id': 1, 'name': 'Action'}, {'id': 4, 'name': 'Comedy'}, {'id': 57, 'name': 'Gag Humor'}, {'id': 13, 'name': 'Historical'}, {'id': 20, 'name': 'Parody'}, {'id': 21, 'name': 'Samurai'}, {'id': 24, 'name': 'Sci-Fi'}, {'id': 27, 'name': 'Shounen'}]",12,manga,1440,pg_13,"[{'id': 1258, 'name': 'Bandai Namco Pictures'}]",15,,,,,,monday,01:35,2017.0,winter,16243,189304,5000,3647,110719,324913.0,0.9734,0.0266
42938,Fruits Basket: The Final,2021-04-06,2021-06-29,"Hundreds of years ago, the Chinese zodiac spirits and their god swore to stay together eternally. United by this promise, the possessed members of the Souma family shall always return to each other under any circumstances. Yet, when these bonds shackle them from freedom, it becomes an undesirable burden—a curse. As head of the clan, Akito is convinced that he shares a special connection with the other Soumas. While he desperately clings to this fantasy, the rest of the family remains isolated and suppressed by the fear of punishment.

Tooru Honda, who has grown attached to the Soumas, is determined to break the chains that bind them. Her companionship with the family and her friends encourages her to move forward with lifting the curse. However, due to confounding revelations, she struggles to find the tenacity to continue her endeavors. With time slowly withering away, Tooru contends with an uncertain future in hopes of reaching the tranquility that may lie beyond all this commotion.

[Written by MAL Rewrite]",8.96,16.0,464,506414,251298,white,tv,finished_airing,"[{'id': 8, 'name': 'Drama'}, {'id': 22, 'name': 'Romance'}, {'id': 25, 'name': 'Shoujo'}, {'id': 37, 'name': 'Supernatural'}]",13,manga,1380,pg_13,"[{'id': 73, 'name': 'TMS Entertainment'}]",16,,,,,,tuesday,01:30,2021.0,spring,35116,303518,7074,5272,155415,506395.0,0.9756,0.0244
4181,Clannad: After Story,2008-10-03,2009-03-27,"Tomoya Okazaki and Nagisa Furukawa have graduated from high school, and together, they experience the emotional rollercoaster of growing up. Unable to decide on a course for his future, Tomoya learns the value of a strong work ethic and discovers the strength of Nagisa's support. Through the couple's dedication and unity of purpose, they push forward to confront their personal problems, deepen their old relationships, and create new bonds.

Time also moves on in the Illusionary World. As the plains grow cold with the approach of winter, the Illusionary Girl and the Garbage Doll are presented with a difficult situation that reveals the World's true purpose.

[Written by MAL Rewrite]",8.93,17.0,120,1222073,672343,white,tv,finished_airing,"[{'id': 8, 'name': 'Drama'}, {'id': 22, 'name': 'Romance'}]",24,visual_novel,1460,pg_13,"[{'id': 2, 'name': 'Kyoto Animation'}]",17,,,,,,friday,01:59,2008.0,fall,40769,825972,21430,17676,316194,1222041.0,0.968,0.032
918,Gintama,2006-04-04,2010-03-25,"Edo is a city that was home to the vigor and ambition of samurai across the country. However, following feudal Japan's surrender to powerful aliens known as the ""Amanto,"" those aspirations now seem unachievable. With the once-influential shogunate rebuilt as a puppet government, a new law is passed that promptly prohibits all swords in public. 

Enter Gintoki Sakata, an eccentric silver-haired man who always carries around a wooden sword and maintains his stature as a samurai despite the ban. As the founder of Yorozuya, a small business for odd jobs, Gintoki often embarks on endeavors to help other people—though usually in rather strange and unforeseen ways. 

Assisted by Shinpachi Shimura, a boy with glasses supposedly learning the way of the samurai; Kagura, a tomboyish girl with superhuman strength and an endless appetite; and Sadaharu, their giant pet dog who loves biting on people's heads, the Yorozuya encounter anything from alien royalty to scuffles with local gangs in the ever-changing world of Edo.

[Written by MAL Rewrite]",8.93,18.0,144,1094870,405108,white,tv,finished_airing,"[{'id': 1, 'name': 'Action'}, {'id': 4, 'name': 'Comedy'}, {'id': 57, 'name': 'Gag Humor'}, {'id': 13, 'name': 'Historical'}, {'id': 20, 'name': 'Parody'}, {'id': 21, 'name': 'Samurai'}, {'id': 24, 'name': 'Sci-Fi'}, {'id': 27, 'name': 'Shounen'}]",201,manga,1494,pg_13,"[{'id': 14, 'name': 'Sunrise'}]",18,,,,,,thursday,18:00,2006.0,spring,207845,338212,125211,56375,367155,1094798.0,0.8341,0.1659
