id,title,start_date,end_date,synopsis,mean,rank,popularity,num_list_users,num_scoring_users,nsfw,media_type,status,genres,num_episodes,source,average_episode_duration,rating,studios,all_ranking,Unnamed: 27,Unnamed: 28,Unnamed: 29,Unnamed: 30,Unnamed: 31,broadcast_day_of_the_week,broadcast_start_time,start_season_year,start_season_season,statistics_watching,statistics_completed,statistics_on_hold,statistics_dropped,statistics_plan_to_watch,statistics_num_list_users,positive_viewership_fraction,negative_viewership_fraction
40784,Wu Liuqi: Zui Qiang Fa Xing Shi,2019-10-23,2020-01-01,"Seeking to recover his memories, a scissor-wielding hairdresser, bungling quasi-assassin stumbles into a struggle for power among two feuding factions.

(Source: IMDb)",8.22,365.0,2464,82617,48108,white,ona,finished_airing,"[{'id': 1, 'name': 'Action'}, {'id': 4, 'name': 'Comedy'}, {'id': 8, 'name': 'Drama'}, {'id': 17, 'name': 'Martial Arts'}, {'id': 7, 'name': 'Mystery'}, {'id': 31, 'name': 'Super Power'}]",10,original,977,pg_13,"[{'id': 2258, 'name': 'Sharefun Studio'}]",365,,,,,,NIL,NIL,2019.0,fall,3504,63143,963,800,14187,82597.0,0.9787,0.0213
55866,Yubisaki to Renren,2024-01-06,2024-03-23,"For hearing-impaired university student Yuki Itose, silence has been a natural part of life since birth. Her world is small and isolated; she commutes to campus, interacts with her best friend Rin Fujishiro, and communicates through writing and text messages—a lifestyle that offers little to no change. One day, during her commute, Yuki meets fellow student Itsuomi Nagi, a multilingual travel enthusiast and friend of Rin. When Itsuomi learns of Yuki's condition, he takes it in stride, moving Yuki's heart. From this one simple gesture, Yuki and Itsuomi's lives start changing day by day as they let each other into their own worlds.

[Written by MAL Rewrite]",8.22,366.0,970,263626,115588,white,tv,finished_airing,"[{'id': 50, 'name': 'Adult Cast'}, {'id': 22, 'name': 'Romance'}, {'id': 25, 'name': 'Shoujo'}]",12,manga,1420,pg_13,"[{'id': 30, 'name': 'Ajia-do'}]",366,,,,,,saturday,22:30,2024.0,winter,41046,132092,6747,8952,74725,263562.0,0.9404,0.0596
52684,Shen Yin Wangzuo 2nd Season,2022-11-10,airing,"Revealing himself to be a Dual Knight, Long Hao Chen triumphs in his match within his temple and advances to the finals. But before the grand finals can begin, ranking matches are conducted in each temple to determine the strongest within. During the rankings, Hao Chen is injured, enraging Sheng Cai'er and driving her to seek vengeance for what happened to him. Her actions cause a fight between the Knight Temple and Assassin Temple, only to be subdued after a shocking revelation—that Sheng Cai'er is a Reincarnated Saint.

The finals for the Demon Hunting Team Competition begin with the division of the sixty remaining participants into six groups. The top sixteen participants are then further pitted against each other to determine the top three. Each of the top three will be rewarded with a spiritual stove and the right to pick their teammates.

In order to become a knight that is capable of defeating the Demon Lord, Long Hao Chen must strive to be first in this competition so he can select the best teammates to give him a fighting chance.

[Written by MAL Rewrite]",8.21,367.0,8627,5337,2018,white,ona,currently_airing,"[{'id': 1, 'name': 'Action'}, {'id': 2, 'name': 'Adventure'}, {'id': 10, 'name': 'Fantasy'}]",130,web_novel,1200,pg_13,"[{'id': 2526, 'name': 'Shenman Entertainment'}]",367,,,,,,NIL,NIL,2022.0,fall,3717,1,255,254,1096,5323.0,0.9044,0.0956
9863,SKET Dance,2011-04-07,2012-09-27,"At Kaimei High School there is a special club dedicated to helping others known as the SKET Brigade. The brains of the group is Kazuyoshi ""Switch"" Usui, a tech-savvy otaku who speaks through speech synthesis software, while the brawn is provided by Hime ""Himeko"" Onizuka, the hockey stick-wielding girl once known as ""Onihime.""  And last but not least, their leader is Yuusuke ""Bossun"" Fujisaki, whose latent ability is evoked by his goggles, allowing him to summon the awesome power of extraordinary concentration.  

However, most of the school only know them as the club that handles odd jobs. Many of their days are spent in the clubroom slacking off, but when there is something to be done, they give their all to help others—usually in sincere, but unintentionally hilarious, ways. The SKET Brigade do all they can to provide support, kindness, encouragement, and troubleshooting to any students crazy enough to ask for their services.  

[Written by MAL Rewrite]",8.21,368.0,1118,229308,86049,white,tv,finished_airing,"[{'id': 4, 'name': 'Comedy'}, {'id': 23, 'name': 'School'}, {'id': 27, 'name': 'Shounen'}]",77,manga,1459,pg_13,"[{'id': 103, 'name': 'Tatsunoko Production'}]",368,,,,,,thursday,18:00,2011.0,spring,19918,88316,18118,17182,85766,229300.0,0.8461,0.1539
53393,Tengoku Daimakyou,2023-04-01,2023-06-24,"Fifteen years ago, disaster struck human civilization, and now dangerous man-eating monsters roam the ravaged lands, posing an existential threat to the remaining survivors. Amid this turmoil, an isolated facility shelters children and nurtures them in peace. However, as a few among them find out about the world beyond the narrow periphery of their nursery's walls, their curiosity about it slowly grows.

Meanwhile, in the outside world, young survivors Maru and Kiruko band together to search for a special place called Heaven, each for their own reasons. Carrying past burdens and tragic secrets, the two hope to find answers to the cruelty they have experienced in their lives and in the world, which still remains in tatters.

[Written by MAL Rewrite]",8.21,369.0,431,536689,246112,white,tv,finished_airing,"[{'id': 2, 'name': 'Adventure'}, {'id': 7, 'name': 'Mystery'}, {'id': 24, 'name': 'Sci-Fi'}, {'id': 42, 'name': 'Seinen'}]",13,manga,1430,r,"[{'id': 10, 'name': 'Production I.G'}]",369,,,,,,saturday,22:00,2023.0,spring,65643,288988,13139,11997,156800,536567.0,0.9532,0.0468
54959,BanG Dream! It's MyGO!!!!!,2023-06-29,2023-09-14,"In their last year of middle school, the five band members of CRYCHIC went their separate ways after an unpleasant disbandment. Each wrestling with their own regrets, the girls enrolled in different high schools, hoping never to hear from one another again.

Meanwhile, Anon Chihaya transfers to Haneoka Girls' Academy in the middle of the school year. As most students play in a band as a hobby, Anon desires to fit in and spends her first days trying to recruit members for her own band, envisioning herself as the group's vocalist. She befriends Tomori Takamatsu, a shy girl who seems interested but hesitant about joining. As it turns out, Tomori used to be part of CRYCHIC, an experience that has scarred her deeply.

Through Tomori, Anon meets Taki Shiina and Soyo Nagasaki, both former members of the same band. Although Taki detests the idea of playing with Anon, Soyo is delighted to help her out. Now with Soyo by her side, Anon's dream of forming a band is within reach—if only she could find a few more members.

[Written by MAL Rewrite]",8.21,370.0,4679,24134,11103,white,tv,finished_airing,"[{'id': 8, 'name': 'Drama'}, {'id': 19, 'name': 'Music'}]",13,mixed_media,1420,pg_13,"[{'id': 537, 'name': 'SANZIGEN'}]",370,,,,,,thursday,23:00,2023.0,summer,2314,12191,528,755,8342,24130.0,0.9468,0.0532
12115,Berserk: Ougon Jidai-hen III - Kourin,2013-02-01,2013-02-01,"The Band of the Hawk has dwindled in the year since Guts left them on his journey to forge his own destiny. Unaware of their fate, Guts returns to the Hawks—now being led by his former ally Casca—after a rumor about them passes his way. Once the saviors of the kingdom of Midland, the Band of the Hawk are now hunted as they desperately fight for their lives while plotting to free their leader, Griffith, after he was imprisoned for committing treason. But the man they save is far from the Griffith they remember.

Griffith is a shell of his former charismatic self after a year of continuous, horrific torture. No longer able to walk, speak, or even hold a sword, he has nothing but the small, strange trinket, the Crimson Behelit, that will not leave him. The entire Band of the Hawk want to rise to greatness once more, but how much are they willing to sacrifice to return to their past glory? It doesn't seem possible, but when Griffith's heart darkens and a solar eclipse blackens the sky, the Behelit offers a choice that will leave the Band of the Hawk with a blood-soaked fate that will haunt them for the rest of their days.

[Written by MAL Rewrite]",8.21,371.0,1095,233439,146267,white,movie,finished_airing,"[{'id': 1, 'name': 'Action'}, {'id': 2, 'name': 'Adventure'}, {'id': 8, 'name': 'Drama'}, {'id': 10, 'name': 'Fantasy'}, {'id': 58, 'name': 'Gore'}, {'id': 14, 'name': 'Horror'}, {'id': 38, 'name': 'Military'}, {'id': 42, 'name': 'Seinen'}]",1,manga,6600,r+,"[{'id': 13, 'name': 'Studio 4°C'}]",371,,,,,,NIL,NIL,2013.0,winter,4287,194318,1142,971,32712,233430.0,0.9909,0.0091
372,Cardcaptor Sakura Movie 2: Fuuin Sareta Card,2000-07-15,2000-07-15,"For this year's Nadeshiko Festival, Sakura Kinomoto's elementary school class is presenting a play. She will portray a princess who struggles to respond to the love confession of the neighboring country's prince. Sakura empathizes with her character all too well, since she herself still owes an answer to the boy who confessed his love for her four months ago.

When cousins Shaoran and Meiling Li return from Hong Kong to pay a surprise visit to their friends in Japan, Sakura receives further encouragement to finally declare her feelings. However, she is repeatedly distracted by a presence reminiscent of a Clow Card as well as unexplained disappearances around town.

Eventually, Sakura learns of another of Clow Reed's creations—the ""Nothing""—which was formerly sealed away beneath the magician's old house. It has power equal to all 52 cards Sakura possesses, and furthermore, it wants to take those cards away from her! Objects, space, and people disappear from Tomoeda with each card that is stolen. Sakura sets out to capture the Nothing so everything will return to normal, but what must she sacrifice in the process?

[Written by MAL Rewrite]
",8.21,372.0,1941,118607,68425,white,movie,finished_airing,"[{'id': 46, 'name': 'Award Winning'}, {'id': 4, 'name': 'Comedy'}, {'id': 8, 'name': 'Drama'}, {'id': 66, 'name': 'Mahou Shoujo'}, {'id': 22, 'name': 'Romance'}, {'id': 25, 'name': 'Shoujo'}]",1,manga,4945,pg,"[{'id': 11, 'name': 'Madhouse'}]",372,,,,,,NIL,NIL,2000.0,summer,1675,99136,749,529,16514,118603.0,0.9892,0.0108
38680,Fruits Basket 1st Season,2019-04-06,2019-09-21,"Tooru Honda has always been fascinated by the story of the Chinese zodiac that her beloved mother told her as a child. However, a sudden family tragedy changes her life, and subsequent circumstances leave her all alone. Tooru is now forced to live in a tent, but little does she know that her temporary home resides on the private property of the esteemed Souma family. Stumbling upon their home one day, she encounters Shigure, an older Souma cousin, and Yuki, the ""prince"" of her school. Tooru explains that she lives nearby, but the Soumas eventually discover her well-kept secret of being homeless when they see her walking back to her tent one night.

Things start to look up for Tooru as they kindly offer to take her in after hearing about her situation. But soon after, she is caught up in a fight between Yuki and his hot-tempered cousin, Kyou. While trying to stop them, she learns that the Souma family has a well-kept secret of their own: whenever they are hugged by a member of the opposite sex, they transform into the animals of the Chinese zodiac.

With this new revelation, Tooru will find that living with the Soumas is an unexpected adventure filled with laughter and romance.

[Written by MAL Rewrite]",8.21,373.0,214,872276,414946,white,tv,finished_airing,"[{'id': 8, 'name': 'Drama'}, {'id': 64, 'name': 'Love Polygon'}, {'id': 22, 'name': 'Romance'}, {'id': 23, 'name': 'School'}, {'id': 25, 'name': 'Shoujo'}, {'id': 37, 'name': 'Supernatural'}]",25,manga,1434,pg_13,"[{'id': 73, 'name': 'TMS Entertainment'}]",373,,,,,,saturday,01:23,2019.0,spring,82517,494107,39185,34190,222234,872233.0,0.9159,0.0841
16664,Kaguya-hime no Monogatari,2013-11-23,2013-11-23,"Deep in the countryside, a man named Okina works as a bamboo cutter in a forest, chopping away at the hollow plants day after day. One day, he discovers a small baby inside a glowing shoot. He immediately takes her home, convinced that she is a princess sent to Earth as a divine blessing from heaven. Okina and his wife Ouna take it upon themselves to raise the infant as their own, watching over her as she quickly grows into an energetic young girl. Given the name Kaguya, she fits right in with the village she has come to call home, going on adventures with the other children and enjoying what youth has to offer.

But when Okina finds a large fortune of gold and treasure in the forest, Kaguya's life is completely changed. Believing this to be yet another gift from heaven, he takes it upon himself to turn his daughter into a real princess using the wealth he has just obtained, relocating the family to a mansion in the capital. As she leaves her friends behind to enter into an unwanted life of royalty, Kaguya's origins and purpose slowly come to light.

[Written by MAL Rewrite]",8.21,374.0,1050,242184,126771,white,movie,finished_airing,"[{'id': 46, 'name': 'Award Winning'}, {'id': 10, 'name': 'Fantasy'}, {'id': 13, 'name': 'Historical'}]",1,other,8220,r+,"[{'id': 21, 'name': 'Studio Ghibli'}]",374,,,,,,NIL,NIL,2013.0,fall,4278,162879,2025,1034,71959,242175.0,0.9874,0.0126
18115,Magi: The Kingdom of Magic,2013-10-06,2014-03-30,"After celebrating their victory against Al-Thamen, Aladdin and his friends depart the land of Sindria. With the end of the battle, however, comes the time for each of them to go their separate ways. Hakuryuu and Kougyoku are ordered to go back to their home country, the Kou Empire. Meanwhile Aladdin announces he needs to head for Magnostadt—a mysterious country ruled by magicians—to investigate the mysterious events occurring in this new kingdom and become more proficient in magic. For their part, encouraged by Aladdin's words, Alibaba and Morgiana also set off in pursuit of their own goals: training and going to her homeland, respectively.

Magi: The Kingdom of Magic follows these friends as they all go about their separate adventures, each facing their own challenges. However, a new threat begins to rise as a great war looms over the horizon...

[Written by MAL Rewrite]",8.21,375.0,216,862044,467093,white,tv,finished_airing,"[{'id': 1, 'name': 'Action'}, {'id': 2, 'name': 'Adventure'}, {'id': 10, 'name': 'Fantasy'}, {'id': 27, 'name': 'Shounen'}]",25,manga,1500,pg_13,"[{'id': 56, 'name': 'A-1 Pictures'}]",375,,,,,,sunday,17:00,2013.0,fall,38280,625078,19442,15627,163580,862007.0,0.9593,0.0407
627,Major S1,2004-11-13,2005-05-21,"Gorou Honda, a little boy obsessed with baseball, has always admired his father, Shigeharu. Wishing to follow in his father's footsteps, Gorou dreams of becoming a professional baseball player. In turn, his son's starry-eyed admiration encourages Shigeharu to keep persevering, despite his late wife's death and his unsatisfying position on the second-string team Blue Ocean.

Unfortunately, an elbow injury forces Shigeharu off the team, and he falls into despair. However, after an offhand joke from his childhood friend, Shigeharu reevaluates his choices and decides to keep playing, leaving behind his prime position as pitcher and taking up the bat. Now motivated more than ever, Gorou works hard to carve his way in the Japanese Little League.

[Written by MAL Rewrite]",8.21,376.0,2127,103908,52440,white,tv,finished_airing,"[{'id': 27, 'name': 'Shounen'}, {'id': 30, 'name': 'Sports'}, {'id': 77, 'name': 'Team Sports'}]",26,manga,1500,pg_13,"[{'id': 101, 'name': 'Studio Hibari'}]",376,,,,,,saturday,18:00,2004.0,fall,3852,68149,2231,1883,27783,103898.0,0.9604,0.0396
1842,Major S3,2007-01-06,2007-06-30,"Having bid farewell to his former teammates at Kaido High School's baseball club, Gorou Honda returns to his hometown eager to continue playing. Attending a new high school proves to be more difficult than he initially expected, as Tetsufumi Egashira's merciless slandering of his name prevents Gorou from being accepted into any school with an existing baseball team. 

Left with no other options, Gorou joins Seishuu High School, where his childhood friend Kaoru Shimizu also attends. However, Seishuu has always been an all-girls school until two years ago, so there is not yet a dedicated men’s baseball team.

But nothing will stop Gorou in his pursuit of Koshien. He must now create a baseball team from scratch with the seven male students at Seishuu, but all of them are complete amateurs! He decides to train the incompetent team up to nationally competitive levels, but such a feat is easier said than done. Will Gorou once again perform miracles? Or will he give up on achieving his goal of defeating Kaido with his own team? 

[Written by MAL Rewrite]",8.21,377.0,2710,70878,44371,white,tv,finished_airing,"[{'id': 27, 'name': 'Shounen'}, {'id': 30, 'name': 'Sports'}, {'id': 77, 'name': 'Team Sports'}]",26,manga,1500,pg_13,"[{'id': 101, 'name': 'Studio Hibari'}]",377,,,,,,saturday,18:00,2007.0,winter,1442,59790,635,692,8315,70874.0,0.9813,0.0187
2966,Ookami to Koushinryou,2008-01-09,2008-03-26,"Holo is a powerful wolf deity who is revered in the small town of Pasloe for blessing the annual harvest. Yet as years go by and the villagers become more self-sufficient, Holo has been reduced to a mere folktale. When a traveling merchant named Kraft Lawrence stops at the settlement, Holo offers to become his business partner if he takes her to her northern home of Yoitsu. The savvy trader recognizes Holo's unusual ability to evaluate a person's character and accepts her proposition. 

Now in the possession of both sharp bargaining skills and a charismatic negotiator, Lawrence inches closer to his goal of opening his own shop. However, as Lawrence travels the countryside with Holo in search of economic opportunities, he begins to realize that his aspirations are slowly morphing into something unexpected.

[Written by MAL Rewrite]
",8.21,378.0,230,840028,402685,white,tv,finished_airing,"[{'id': 50, 'name': 'Adult Cast'}, {'id': 2, 'name': 'Adventure'}, {'id': 8, 'name': 'Drama'}, {'id': 22, 'name': 'Romance'}, {'id': 37, 'name': 'Supernatural'}]",13,light_novel,1430,pg_13,"[{'id': 75, 'name': 'Imagin'}]",378,,,,,,wednesday,01:30,2008.0,winter,43026,492996,32275,23010,248642,839949.0,0.9342,0.0658
51019,Kimetsu no Yaiba: Katanakaji no Sato-hen,2023-04-09,2023-06-18,"For centuries, the Demon Slayer Corps has sacredly kept the location of Swordsmith Village a secret. As the village of the greatest forgers, it provides Demon Slayers with the finest weapons, which allow them to fight night-crawling fiends and ensure the safety of humans. After his sword was chipped and deemed useless, Tanjirou Kamado, along with his precious little sister Nezuko, is escorted to the village to receive a new one.

Meanwhile, the death of an Upper Rank Demon disturbs the idle order in the demon world. As Tanjirou becomes acquainted with Mist Hashira Muichirou Tokitou and Love Hashira Mitsuri Kanroji, ferocious powers creep from the shadows and threaten to shatter the Demon Slayers' greatest line of defense.

[Written by MAL Rewrite]",8.2,380.0,193,931116,547468,white,tv,finished_airing,"[{'id': 1, 'name': 'Action'}, {'id': 13, 'name': 'Historical'}, {'id': 27, 'name': 'Shounen'}, {'id': 37, 'name': 'Supernatural'}]",11,manga,1680,r,"[{'id': 43, 'name': 'ufotable'}]",379,,,,,,sunday,23:15,2023.0,spring,80480,702919,7788,5296,134539,931022.0,0.9859,0.0141
16894,Kuroko no Basket 2nd Season,2013-10-06,2014-03-30,"With the Interhigh Championship finally over, Seirin's basketball team refocuses their efforts, training harder than ever to get the chance to participate in the Winter Cup. Both Tetsuya Kuroko and Taiga Kagami see old friends walk back into their lives, providing a challenge both on and off the court.

As new skills are developed and new alliances created, enemies from various teams—giants of high school basketball such as Yousen, Shuutoku, and Touou—stand in the way of Seirin's steadfast attempts to get to the top. All of these schools prove to be formidable foes whose abilities progress exponentially, while Kuroko struggles to find a balance between his resolve to play as part of a team and his desire to win. 

With old wounds reopening, new challenges to face on the court, and a new set of foes—the ""Uncrowned Kings""—vowing to defeat the new hopefuls, will Seirin ever be able to achieve their dream of beating the Generation of Miracles?

[Written by MAL Rewrite]",8.2,381.0,211,879506,558969,white,tv,finished_airing,"[{'id': 23, 'name': 'School'}, {'id': 27, 'name': 'Shounen'}, {'id': 30, 'name': 'Sports'}, {'id': 77, 'name': 'Team Sports'}]",25,manga,1440,pg_13,"[{'id': 10, 'name': 'Production I.G'}]",380,,,,,,sunday,01:58,2013.0,fall,32658,754471,11836,8233,72297,879495.0,0.9772,0.0228
5460,Meitantei Conan Movie 13: Shikkoku no Chaser,2009-04-18,2009-04-18,"Kudou Shinichi is living his life as Edogawa Conan, but those days seem like they might end pretty soon. The Black Syndicate is coming dangerously close to learning the truth about Shinichi having survived. Conan and everybody around him may end up dead if he doesn't manage to find Irish—a member of the Black Organization who has infiltrated the police forces, currently investigating a big serial murder case.",8.2,382.0,2933,61688,34816,white,movie,finished_airing,"[{'id': 1, 'name': 'Action'}, {'id': 39, 'name': 'Detective'}, {'id': 7, 'name': 'Mystery'}, {'id': 27, 'name': 'Shounen'}]",1,manga,6660,pg_13,"[{'id': 65, 'name': 'Tokyo Movie Shinsha'}, {'id': 73, 'name': 'TMS Entertainment'}]",381,,,,,,NIL,NIL,2009.0,spring,1166,52959,390,459,6709,61683.0,0.9862,0.0138
37078,Quanzhi Gaoshou Specials,2018-04-27,2018-05-11,"The All-Star Tournament is a three-day event that allows e-sports participants from various professional clubs to display their skills, while also giving casual Glory players the chance to interact with pros in the flesh.

Retired top-tier Glory player Ye Xiu agrees to watch the tournament together with Tang Rou and Chen Guo after the latter manages to get ahold of three tickets. It is a strange sensation for Ye Xiu, as unlike previous occasions, this time he attends the tournament as a spectator, not a participant. However, despite his attempts to keep a low profile, events in the All-Star Tournament may force the former Glory legend back into the limelight.

[Written by MAL Rewrite]",8.2,383.0,2072,108810,55848,white,ona,finished_airing,"[{'id': 1, 'name': 'Action'}, {'id': 79, 'name': 'Video Game'}]",3,web_novel,1620,pg_13,"[{'id': 2509, 'name': 'Colored Pencil Animation'}]",382,,,,,,NIL,NIL,2018.0,spring,4059,80426,803,797,22707,108792.0,0.9853,0.0147
35466,ReLIFE: Kanketsu-hen,2018-03-21,2018-03-21,"After reliving the life of a high school student through the ReLIFE experiment, 27-year-old Arata Kaizaki cannot believe how quickly it has changed him. He has begun to see the world through a different perspective that he had completely forgotten as an adult. He has made friends and formed deep relationships with each one of them. However his support, Ryou Yoake, reminds him that the experiment is all an illusion; after his experiment ends, he will be forgotten by all of them.

The experiment of another ReLIFE subject is also coming to an end. After spending two years with ReLIFE, Chizuru Hishiro has developed into a more open, more thoughtful person than she could have ever imagined. She has met people who have changed her life, her perspective, and ultimately her. However, now that their ReLIFE is coming to an end, will they be able to let go of the memories they have made?

[Written by MAL Rewrite]",8.2,384.0,583,413548,246040,white,special,finished_airing,"[{'id': 8, 'name': 'Drama'}, {'id': 22, 'name': 'Romance'}, {'id': 23, 'name': 'School'}]",4,web_manga,1420,pg_13,"[{'id': 73, 'name': 'TMS Entertainment'}]",383,,,,,,NIL,NIL,2018.0,winter,10900,325798,3359,2498,70972,413527.0,0.9858,0.0142
38249,Saiki Kusuo no Ψ-nan: Kanketsu-hen,2018-12-28,2018-12-28,"The ground shakes, a rumble follows, and before anyone in Japan can prepare themselves, a cataclysmic volcanic eruption engulfs the country in molten lava and suffocating ashes. Of course, high school student Kusou Saiki repeatedly uses his psychic powers to prevent this harrowing catastrophe.

But between restoring the planet and watching his friends discuss their aspirations, Saiki finally resolves to stop the eruption and allow the world to continue spinning. However, this straightforward task is challenging even for the most powerful of psychics, let alone one who must deal with the usual shenanigans his ludicrous friends present.

[Written by MAL Rewrite]",8.2,385.0,1115,230012,136935,white,tv_special,finished_airing,"[{'id': 4, 'name': 'Comedy'}, {'id': 57, 'name': 'Gag Humor'}, {'id': 23, 'name': 'School'}, {'id': 27, 'name': 'Shounen'}, {'id': 31, 'name': 'Super Power'}]",1,manga,2820,pg_13,"[{'id': 7, 'name': 'J.C.Staff'}, {'id': 1444, 'name': 'Egg Firm'}]",384,,,,,,NIL,NIL,2018.0,fall,4923,194122,1132,868,28957,230002.0,0.9913,0.0087
