id,title,start_date,end_date,synopsis,mean,rank,popularity,num_list_users,num_scoring_users,nsfw,media_type,status,genres,num_episodes,source,average_episode_duration,rating,studios,bypopularity_ranking,broadcast_day_of_the_week,broadcast_start_time,start_season_year,start_season_season,statistics_watching,statistics_completed,statistics_on_hold,statistics_dropped,statistics_plan_to_watch,statistics_num_list_users,positive_viewership_fraction,negative_viewership_fraction
28677,Yamada-kun to 7-nin no Majo,2015-04-12,2015-06-28,"When Ryuu Yamada entered high school, he wanted to turn over a new leaf and lead a productive school life. That is why he chose to attend Suzaku High School, where no one would know of his violent delinquent reputation. However, much to Ryuu's dismay, he is soon bored; now a second year, Ryuu has reverted to his old ways—lazy with abysmal grades and always getting into fights.

One day, back from yet another office visit, Ryuu encounters Urara Shiraishi, a beautiful honors student. A misstep causes them both to tumble down the stairs, ending in an accidental kiss! The pair discover they can switch bodies with a kiss: an ability which will prove to be both convenient and troublesome.
 
Learning of their new power, Toranosuke Miyamura, a student council officer and the single member of the Supernatural Studies Club, recruits them for the club. Soon joined by Miyabi Itou, an eccentric interested in all things supernatural, the group unearths the legend of the Seven Witches of Suzaku High, seven female students who have obtained different powers activated by a kiss. The Supernatural Studies Club embarks on its first quest: to find the identities of all the witches.

[Written by MAL Rewrite]",7.53,1839.0,249,812471,457582,white,tv,finished_airing,"[{'id': 4, 'name': 'Comedy'}, {'id': 35, 'name': 'Harem'}, {'id': 7, 'name': 'Mystery'}, {'id': 22, 'name': 'Romance'}, {'id': 23, 'name': 'School'}, {'id': 27, 'name': 'Shounen'}, {'id': 37, 'name': 'Supernatural'}]",12,manga,1498,pg_13,"[{'id': 839, 'name': 'LIDENFILMS'}]",249,sunday,23:30,2015.0,spring,35518,598695,16467,19939,141795,812414.0,0.9552,0.0448
40956,Enen no Shouboutai: Ni no Shou,2020-07-04,2020-12-12,"After his confrontation in the Nether with his younger brother Shou, Shinra Kusakabe's resolve to become a hero that saves lives from the flame terror strengthens. Finding a way to turn the Infernals back into people, unraveling the mystery of the Evangelist and Adolla Burst, and saving his mother and Shou—these are the goals Shinra has in mind. However, he has come to realize that attaining these goals will not be easy, especially with the imminent danger the Evangelist poses.

The Evangelist's plan is clear: to gather the eight pillars—the individuals who possess Adolla Burst—and sacrifice them to recreate the Great Cataclysm from 250 years ago. Having been revealed by the First Pillar that the birth of a new pillar is approaching, Shinra is determined to protect his fellow pillars from the Evangelist. Thus, the fiery battle between the Special Fire Force and the Evangelist ignites. Together with the Special Fire Force, Shinra's fight continues as he uncovers the truth about the Great Cataclysm and the nature of Adolla Bursts, as well as the mysteries behind human combustion. 

[Written by MAL Rewrite]",7.82,980.0,250,811037,429174,white,tv,finished_airing,"[{'id': 1, 'name': 'Action'}, {'id': 10, 'name': 'Fantasy'}, {'id': 24, 'name': 'Sci-Fi'}, {'id': 27, 'name': 'Shounen'}, {'id': 82, 'name': 'Urban Fantasy'}]",24,manga,1477,pg_13,"[{'id': 287, 'name': 'David Production'}]",250,saturday,01:55,2020.0,summer,93010,533061,31987,24322,128603,810983.0,0.9306,0.0694
2236,Toki wo Kakeru Shoujo,2006-07-15,2006-07-15,"Makoto Konno is in her last year of high school, but is having a hard time deciding what to do with her future. In between enduring the pressure of her teachers and killing time with her best friends, Makoto's life suddenly changes when she accidentally discovers that she is capable of literally leaping through time.

Toki wo Kakeru Shoujo follows Makoto as she plays around with her newfound power. However, she soon learns the hard way that every choice has a consequence, and time is a lot more complicated than it may seem.

[Written by MAL Rewrite]",8.1,520.0,251,807554,462802,white,movie,finished_airing,"[{'id': 46, 'name': 'Award Winning'}, {'id': 8, 'name': 'Drama'}, {'id': 22, 'name': 'Romance'}, {'id': 23, 'name': 'School'}, {'id': 24, 'name': 'Sci-Fi'}, {'id': 78, 'name': 'Time Travel'}]",1,novel,5884,g,"[{'id': 11, 'name': 'Madhouse'}]",251,NIL,NIL,2006.0,summer,14010,597061,4782,2324,189342,807519.0,0.9912,0.0088
52299,Ore dake Level Up na Ken,2024-01-07,2024-03-31,"Humanity was caught at a precipice a decade ago when the first gates—portals linked with other dimensions that harbor monsters immune to conventional weaponry—emerged around the world. Alongside the appearance of the gates, various humans were transformed into hunters and bestowed superhuman abilities. Responsible for entering the gates and clearing the dungeons within, many hunters chose to form guilds to secure their livelihoods.

Sung Jin-Woo is an E-rank hunter dubbed as the weakest hunter of all mankind. While exploring a supposedly safe dungeon, he and his party encounter an unusual tunnel leading to a deeper area. Enticed by the prospect of treasure, the group presses forward, only to be confronted with horrors beyond their imagination. Miraculously, Jin-Woo survives the incident and soon finds that he now has access to an interface visible only to him. This mysterious system promises him the power he has long dreamed of—but everything comes at a price.

[Written by MAL Rewrite]",8.27,313.0,252,802094,452566,white,tv,finished_airing,"[{'id': 1, 'name': 'Action'}, {'id': 50, 'name': 'Adult Cast'}, {'id': 2, 'name': 'Adventure'}, {'id': 10, 'name': 'Fantasy'}, {'id': 82, 'name': 'Urban Fantasy'}]",12,web_manga,1427,r,"[{'id': 56, 'name': 'A-1 Pictures'}]",252,sunday,00:00,2024.0,winter,118146,534174,7688,11194,130675,801877.0,0.9765,0.0235
40356,Tate no Yuusha no Nariagari Season 2,2022-04-06,2022-06-29,"With another Wave happening in a week, Naofumi Iwatani and his party have no time to waste. However, when bat familiars raid Lurolona Village and the Wave countdown comes to a halt, the Four Cardinal Heroes reconvene with the queen, Mirelia Q Melromarc, for a quick briefing. The queen presumes that the odd occurrences are linked to the Spirit Tortoise—a threatening creature that has awakened from its slumber, back to cause havoc once again. A plan to put the Spirit Tortoise to rest is devised—but out of the four men, only the cursed Shield Hero agrees to help.

[Written by MAL Rewrite]
",6.52,6893.0,253,799589,288069,white,tv,finished_airing,"[{'id': 1, 'name': 'Action'}, {'id': 2, 'name': 'Adventure'}, {'id': 8, 'name': 'Drama'}, {'id': 10, 'name': 'Fantasy'}, {'id': 62, 'name': 'Isekai'}]",13,light_novel,1420,pg_13,"[{'id': 290, 'name': 'Kinema Citrus'}, {'id': 1575, 'name': 'DR Movie'}]",253,wednesday,22:00,2022.0,spring,88869,341308,22528,55598,291202,799505.0,0.9023,0.0977
37086,Kakegurui××,2019-01-09,2019-03-27,"As Yumeko Jabami's fame grows and the reputation of the student council dwindles, Kirari Momobami decides to revolutionize the group. To this end, she announces an election for its next president. The rules are simple: each student in the school receives one chip. Whoever has the most chips by the end of thirty days becomes both the new president and the head of the Momobami clan.

Upon receiving news of this development, the Momobami branch families spring into action. Eleven transfer students arrive at Hyakkao Private Academy, each aiming to lead both the school and the Momobami clan. Equipped with unique talents, they will compete to get as many chips as possible—but their chips are not the only things on the line.

[Written by MAL Rewrite]
",7.19,3388.0,254,798255,478767,white,tv,finished_airing,"[{'id': 8, 'name': 'Drama'}, {'id': 59, 'name': 'High Stakes Game'}, {'id': 7, 'name': 'Mystery'}, {'id': 40, 'name': 'Psychological'}, {'id': 23, 'name': 'School'}, {'id': 27, 'name': 'Shounen'}, {'id': 11, 'name': 'Strategy Game'}, {'id': 41, 'name': 'Suspense'}]",12,manga,1469,r,"[{'id': 569, 'name': 'MAPPA'}]",254,wednesday,02:30,2019.0,winter,35013,622968,15861,20150,104240,798232.0,0.9549,0.0451
13125,Shinsekai yori,2012-09-29,2013-03-23,"In the year 2011, a small percentage of humans began manifesting psychokinetic abilities known as ""Cantus."" Over a millennium later, in the small town of Kamisu 66, Saki Watanabe is the last of her friends to awaken her powers and join the Sage Academy, a school for psychics like her. Although everyone at the institution has Cantus, they are not all equal; shortly after Saki enrolls, one of her classmates who is regarded as being weaker than the others suddenly disappears.

Walking home one day with her friends—the determined Maria Akizuki, the intelligent Shun Aonuma, the observant Satoru Asahina, and the timid Mamoru Itou—she comes across two unfamiliar creatures known as ""Monster Rats."" These beings resemble moles and worship those with Cantus as gods. As a result, when Saki uses her abilities to save one from trouble, she is met with exceptional gratitude.

Now unsure about the Monster Rats' place in society, Saki and her friends find out about another disappearance. As time passes, they slowly look for answers to the mysteries that surround them and begin to realize that this seemingly ""perfect"" new world masks humanity's dark past.

[Written by MAL Rewrite]",8.25,329.0,255,794297,281978,white,tv,finished_airing,"[{'id': 8, 'name': 'Drama'}, {'id': 10, 'name': 'Fantasy'}, {'id': 14, 'name': 'Horror'}, {'id': 7, 'name': 'Mystery'}, {'id': 40, 'name': 'Psychological'}, {'id': 24, 'name': 'Sci-Fi'}, {'id': 41, 'name': 'Suspense'}]",25,novel,1360,r,"[{'id': 56, 'name': 'A-1 Pictures'}]",255,saturday,00:30,2012.0,fall,54226,312993,36863,35388,354774,794244.0,0.909,0.091
39597,Sword Art Online: Alicization - War of Underworld,2019-10-13,2019-12-29,"Despite the defeat of Quinella—the pontifex of the Axiom Church—things have not seemed to calm down yet. Upon contacting the real world, Kazuto ""Kirito"" Kirigaya finds out that the Ocean Turtle—a mega-float controlled by Rath—was raided. Due to a sudden short-circuit caused by the raiders, Kirito's fluctlight is damaged, leaving him comatose. Feeling insecure about the people at the Axiom Church, Alice brings the unconscious Kirito back to their hometown—Rulid Village, disregarding her banishment due to an unabsolved crime. Now, Alice is living an ordinary and peaceful life close by the village, wishing for Kirito to wake up.

However, tragedy strikes when Alice notices that the Dark Territory has already started to invade the Human Empire. Reassuming her previous alias, Alice Synthesis Thirty, she promises to defeat the Dark Territory in order to defend the world that Kirito and Eugeo worked so hard to protect.

[Written by MAL Rewrite]",7.58,1606.0,256,793813,470786,white,tv,finished_airing,"[{'id': 1, 'name': 'Action'}, {'id': 2, 'name': 'Adventure'}, {'id': 10, 'name': 'Fantasy'}, {'id': 79, 'name': 'Video Game'}]",12,light_novel,1420,r,"[{'id': 56, 'name': 'A-1 Pictures'}]",256,sunday,00:00,2019.0,fall,35952,635637,9329,10580,102259,793757.0,0.9749,0.0251
32542,Sakamoto desu ga?,2016-04-08,2016-07-01,"Sophisticated, suave, sublime; all words which describe the exceedingly handsome and patently perfect Sakamoto. Though it is only his first day in high school, his attractiveness, intelligence, and charm already has the girls swooning and the guys fuming with jealousy. No one seems able to derail him, as all attempts at tripping him up are quickly foiled. His sangfroid is indomitable, his wits peerless. Will any of Sakamoto's classmates, or even teachers, be able to reach his level of excellence? Probably not, but they just might learn a thing or two trying...

[Written by MAL Rewrite]",7.54,1772.0,257,791474,398084,white,tv,finished_airing,"[{'id': 4, 'name': 'Comedy'}, {'id': 57, 'name': 'Gag Humor'}, {'id': 23, 'name': 'School'}, {'id': 42, 'name': 'Seinen'}]",12,manga,1460,pg_13,"[{'id': 37, 'name': 'Studio Deen'}]",257,friday,02:28,2016.0,spring,57091,477997,35883,51282,169174,791427.0,0.8899,0.1101
33506,Ao no Exorcist: Kyoto Fujouou-hen,2017-01-07,2017-03-25,"The ExWire of True Cross Academy are beset with shock and fear in the aftermath of discovering that one of their own classmates, Rin Okumura, is the son of Satan. But for the moment, they have more pressing concerns than that of Rin's parentage: the left eye of the Impure King, a powerful demon, has been stolen from the academy's Deep Keep. After an attempt is made to steal the right eye in Kyoto as well, Rin and the other ExWires are sent to investigate the mystery behind the Impure King and the ultimate goal of the thief.

While this mission has them cooperating for the time being, Rin has never felt more distant from his fellow exorcists. In his attempt to reconcile with them, he undergoes specialized training to control his dark power. However, when the right eye is stolen not long after their arrival, the unthinkable threat of a traitor amongst them leaves them in need of all the power they can get.

[Written by MAL Rewrite]",7.34,2583.0,258,787311,424285,white,tv,finished_airing,"[{'id': 1, 'name': 'Action'}, {'id': 6, 'name': 'Mythology'}, {'id': 23, 'name': 'School'}, {'id': 27, 'name': 'Shounen'}, {'id': 37, 'name': 'Supernatural'}]",12,manga,1470,pg_13,"[{'id': 56, 'name': 'A-1 Pictures'}]",258,saturday,01:55,2017.0,winter,36039,587672,17271,19824,126469,787275.0,0.9529,0.0471
6,Trigun,1998-04-01,1998-09-30,"Vash the Stampede is the man with a $$60,000,000,000 bounty on his head. The reason: he's a merciless villain who lays waste to all those that oppose him and flattens entire cities for fun, garnering him the title ""The Humanoid Typhoon."" He leaves a trail of death and destruction wherever he goes, and anyone can count themselves dead if they so much as make eye contact—or so the rumors say. In actuality, Vash is a huge softie who claims to have never taken a life and avoids violence at all costs.

With his crazy doughnut obsession and buffoonish attitude in tow, Vash traverses the wasteland of the planet Gunsmoke, all the while followed by two insurance agents, Meryl Stryfe and Milly Thompson, who attempt to minimize his impact on the public. But soon, their misadventures evolve into life-or-death situations as a group of legendary assassins are summoned to bring about suffering to the trio. Vash's agonizing past will be unraveled and his morality and principles pushed to the breaking point.

[Written by MAL Rewrite]",8.22,364.0,259,786448,382203,white,tv,finished_airing,"[{'id': 1, 'name': 'Action'}, {'id': 50, 'name': 'Adult Cast'}, {'id': 2, 'name': 'Adventure'}, {'id': 24, 'name': 'Sci-Fi'}, {'id': 27, 'name': 'Shounen'}]",26,manga,1480,pg_13,"[{'id': 11, 'name': 'Madhouse'}]",259,thursday,01:15,1998.0,spring,48081,459896,34457,19457,224519,786410.0,0.9314,0.0686
24415,Kuroko no Basket 3rd Season,2015-01-11,2015-06-30,"Seirin prepares to face major obstacles on their path to winning the Winter Cup, including the teams each possessing a member of the Generation of Miracles. Kuroko goes head-to-head with his old teammates once more as he attempts to show them that individual skill is not the only way to play basketball. His firm belief that his form of basketball, team play, is the right way to play the sport will clash with the talents of a perfect copy and an absolute authority.

While Kuroko tries to prove that his basketball is ""right,"" he and the rest of Seirin High ultimately have one goal: to win the Winter Cup and overcome the strength of the Generation of Miracles, who have long dominated the scene of middle and high school basketball.

[Written by MAL Rewrite]",8.29,283.0,260,785223,485374,white,tv,finished_airing,"[{'id': 23, 'name': 'School'}, {'id': 27, 'name': 'Shounen'}, {'id': 30, 'name': 'Sports'}, {'id': 77, 'name': 'Team Sports'}]",25,manga,1450,pg_13,"[{'id': 10, 'name': 'Production I.G'}]",260,sunday,01:58,2015.0,winter,33540,653549,12012,7579,78527,785207.0,0.975,0.025
43299,Wonder Egg Priority,2021-01-13,2021-03-31,"Following the suicide of her best and only friend, Koito Nagase, Ai Ooto is left grappling with her new reality. With nothing left to live for, she follows the instructions of a mysterious entity and gets roped into purchasing an egg, or specifically, a Wonder Egg.

Upon breaking the egg in a world that materializes during her sleep, Ai is tasked with saving people from the adversities that come their way. In doing so, she believes that she has moved one step closer to saving her best friend. With this dangerous yet tempting opportunity in the palms of her hands, Ai enters a place where she must recognize the relationship between other people's demons and her own.

As past trauma, unforgettable regrets, and innate fears hatch in the bizarre world of Wonder Egg Priority, a young girl discovers the different inner struggles tormenting humankind and rescues them from their worst fears.

[Written by MAL Rewrite]",7.57,1651.0,261,783247,351912,white,tv,finished_airing,"[{'id': 8, 'name': 'Drama'}, {'id': 40, 'name': 'Psychological'}, {'id': 37, 'name': 'Supernatural'}, {'id': 41, 'name': 'Suspense'}]",12,original,1382,r,"[{'id': 1835, 'name': 'CloverWorks'}]",261,wednesday,01:29,2021.0,winter,89489,388510,31156,38905,235148,783208.0,0.9105,0.0895
37982,Domestic na Kanojo,2019-01-12,2019-03-30,"In their teenage years, few things can hurt people more than the heartaches that come with unrequited love. Such is the case for Natsuo Fujii, who has found himself entranced by his school's ever-cheerful teacher Hina. Deflated by this unreachable desire, Natsuo humors his friends and attends a mixer. There he meets Rui, a girl whose lack of excitement rivals that of himself. After bonding over their mutual awkwardness, Rui takes Natsuo to her house and asks him to have sex with her, hoping that the experience will stop her friends from treating her like a clueless child. With his hopeless feelings towards Hina still on his mind, Natsuo hesitantly agrees.

Equally unfulfilled by their ""first times,"" the two decide to part ways as strangers. However, before he even has a chance to process this experience, Natsuo's father drops a major bombshell: he is getting remarried, and his new wife Tsukiko Tachibana is coming over now to meet Natsuo. As if that was not enough of a shock, her daughters—and, in turn, Natsuo's new sisters—are Hina and Rui Tachibana, the woman he's in love with and the girl with whom he shared his first night. Now, Natsuo must come to terms with the feelings he has for his step-siblings as his eyes open to a darker side of love.

[Written by MAL Rewrite]",6.64,6212.0,262,782694,469769,white,tv,finished_airing,"[{'id': 8, 'name': 'Drama'}, {'id': 64, 'name': 'Love Polygon'}, {'id': 22, 'name': 'Romance'}, {'id': 23, 'name': 'School'}, {'id': 27, 'name': 'Shounen'}]",12,manga,1512,r+,"[{'id': 51, 'name': 'Diomedéa'}]",262,saturday,01:55,2019.0,winter,39376,568598,12834,34318,127480,782606.0,0.9398,0.0602
14467,K,2012-10-05,2012-12-28,"""Kings"" are individuals who have been bestowed with incredible supernatural powers and granted the ability to recruit others into their clans. Protecting the lives and honor of their clansmen is an integral part of the Kings' duties. After a video depicting the heinous murder of a Red Clansman spreads virally, the unassuming student Yashiro Isana is accused of homicide. Now, a manhunt is underway for his head, bringing him into contact with the infamous ""Black Dog"" Kurou Yatogami—a skilled swordsman and martial artist determined to follow the wishes of his late master, the Seventh King.

Meanwhile, the current Red King, Mikoto Suou, faces his own imminent demise as the search for Yashiro narrows. But during Yashiro's struggle to prove his innocence, a greater conspiracy is unraveling behind the scenes; clouds begin to appear in his memory, and close friends start to question his very existence. What began as a simple murder is now leading towards a full blown war between Kings with the very fate of the world at stake. 

[Written by MAL Rewrite]",7.42,2214.0,263,777829,386974,white,tv,finished_airing,"[{'id': 1, 'name': 'Action'}, {'id': 7, 'name': 'Mystery'}, {'id': 31, 'name': 'Super Power'}]",13,original,1440,pg_13,"[{'id': 309, 'name': 'GoHands'}]",263,thursday,NIL,2012.0,fall,37992,509601,22346,29791,178045,777775.0,0.933,0.067
41389,Tonikaku Kawaii,2020-10-03,2020-12-19,"Nasa Yuzaki is determined to leave his name in the history books. Ranking first in the national mock exam and aiming for a distinguished high school, he is certain that he has his whole life mapped out. However, fate is a fickle mistress. On his way home one snowy evening, Nasa's eyes fall upon a peerless beauty across the street. Bewitched, Nasa tries to approach her—only to get blindsided by an oncoming truck. 

Thankfully, his life is spared due to the girl's swift action. Bleeding by the side of an ambulance, he watches as the girl walks away under the moonlight—reminiscent of Princess Kaguya leaving for the moon. Refusing to let this chance meeting end, he forces his crippled body to chase after her and asks her out. Surprised by his foolhardiness and pure resolve, the girl accepts his confession under a single condition: they can only be together if he marries her!

[Written by MAL Rewrite]",7.86,906.0,264,777608,437442,white,tv,finished_airing,"[{'id': 4, 'name': 'Comedy'}, {'id': 22, 'name': 'Romance'}, {'id': 27, 'name': 'Shounen'}]",12,manga,1425,pg_13,"[{'id': 35, 'name': 'Seven Arcs'}]",264,saturday,01:05,2020.0,fall,64334,523328,19156,23293,147403,777514.0,0.9454,0.0546
1210,NHK ni Youkoso!,2006-07-10,2006-12-18,"Twenty-two-year-old college dropout Tatsuhiro Satou has been a hikikomori for almost four years now. In his isolation, he has come to believe in many obscure conspiracy theories, but there is one in particular which he holds unshakable faith in: the theory that the evil conspirator behind his shut-in NEET (Not in Employment, Education or Training) status is the Nihon Hikikomori Kyokai (NHK)—an evil and secret organization dedicated to fostering the spread of hikikomori culture.

NHK ni Youkoso! is a psychological dramedy that follows Tatsuhiro as he strives to escape from the NHK's wicked machinations and the disease of self-wrought isolation, while struggling to even just leave his apartment and find a job. His unexpected encounter with the mysterious Misaki Nakahara might signal a reversal of fortune for Tatsuhiro, but with this meeting comes the inevitable cost of having to face his greatest fear—society.

[Written by MAL Rewrite]",8.31,267.0,265,772871,346678,white,tv,finished_airing,"[{'id': 50, 'name': 'Adult Cast'}, {'id': 4, 'name': 'Comedy'}, {'id': 8, 'name': 'Drama'}, {'id': 69, 'name': 'Otaku Culture'}, {'id': 40, 'name': 'Psychological'}, {'id': 22, 'name': 'Romance'}, {'id': 41, 'name': 'Suspense'}]",24,novel,1420,r+,"[{'id': 3, 'name': 'Gonzo'}]",265,monday,00:00,2006.0,summer,46251,400111,31859,22218,272385,772824.0,0.93,0.07
36896,Boku no Hero Academia the Movie 1: Futari no Hero,2018-08-03,2018-08-03,"U.A. High School's students of Class 1-A have made it to summer break. Izuku Midoriya accompanies his mentor All Might to a celebratory superhero festival on I-Island, an isolated patch of land dedicated to researching Quirks and everything else associated with the hero business. Midoriya is granted the opportunity to meet All Might's friend Dave and Dave's daughter Melissa, two talented hero equipment engineers. He also encounters his classmates, most of whom have been given the opportunity to spend part of their summer break at the festival.

However, a mysterious squad of villains infiltrates I-Island, and it is up to Midoriya and his friends to confront them, using their developing Quirks to fight off the new enemy and uncover a treacherous plot.

[Written by MAL Rewrite]",7.53,1799.0,266,772619,474770,white,movie,finished_airing,"[{'id': 1, 'name': 'Action'}, {'id': 27, 'name': 'Shounen'}, {'id': 31, 'name': 'Super Power'}]",1,manga,5760,pg_13,"[{'id': 4, 'name': 'Bones'}]",266,NIL,NIL,2018.0,summer,10412,670033,2217,1955,87970,772587.0,0.9946,0.0054
