id,title,start_date,end_date,synopsis,mean,rank,popularity,num_list_users,num_scoring_users,nsfw,media_type,status,genres,num_episodes,source,average_episode_duration,rating,studios,bypopularity_ranking,broadcast_day_of_the_week,broadcast_start_time,start_season_year,start_season_season,statistics_watching,statistics_completed,statistics_on_hold,statistics_dropped,statistics_plan_to_watch,statistics_num_list_users,positive_viewership_fraction,negative_viewership_fraction
23321,Log Horizon 2nd Season,2014-10-04,2015-03-28,"After being trapped in the world of Elder Tale for six months, Shiroe and the other Adventurers have begun to get the hang of things in their new environment. The Adventurers are starting to gain the trust of the People of the Land, and Akiba has flourished thanks to the law and order established by Shiroe's Round Table Alliance, regaining its everyday liveliness. Despite this success, however, the Alliance faces a new crisis: they are running out of funds to govern Akiba, and spies from the Minami district have infiltrated the city.

As formidable forces rise in other districts, there is also a need to discover more about the vast new world they are trapped in—leading Shiroe to decide that the time has come to venture outside the city. Accompanied by his friend Naotsugu and the Sage of Mirror Lake Regan, the calculative Shiroe makes his move, hoping to unravel new possibilities and eventually find a way home.

[Written by MAL Rewrite]",7.56,1695.0,362,627403,347754,white,tv,finished_airing,"[{'id': 1, 'name': 'Action'}, {'id': 50, 'name': 'Adult Cast'}, {'id': 2, 'name': 'Adventure'}, {'id': 10, 'name': 'Fantasy'}, {'id': 79, 'name': 'Video Game'}]",25,light_novel,1470,pg_13,"[{'id': 37, 'name': 'Studio Deen'}]",362,saturday,17:30,2014.0,fall,38843,451815,23674,21891,91144,627367.0,0.9274,0.0726
263,Hajime no Ippo,2000-10-04,2002-03-27,"In his father's absence, teenager Ippo Makunouchi works hard to help his mother run her fishing boat rental business. Ippo's timid nature, his lack of sleep, and the sea smell make him an easy target for relentless bullies who leave him bruised and beaten on a daily basis. Mamoru Takamura, an up-and-coming boxer, rescues Ippo from a violent after-school incident and takes him back to the Kamogawa Boxing Gym for recovery. Takamura and his fellow boxers, Masaru Aoki and Tatsuya Kimura, are stunned by Ippo's powerful punches—a result of strong muscles developed through years serving his physically taxing family business. 

Following brief training under Takamura, Ippo impresses the other boxers in a practice match against prodigy Ichirou Miyata. He gains a rival in Miyata and a coach in Genji Kamogawa, the gym owner and a former boxer himself. As Ippo takes the first steps in his official boxing career, he faces off against a series of challenging opponents, each more powerful than the last. Victory, loss, and a cycle of dedicated training await Ippo on his journey to achieve greatness. With his tough body and unstoppable fighting spirit, the kind young man seeks to take on the world.

[Written by MAL Rewrite]
",8.77,40.0,363,626668,309123,white,tv,finished_airing,"[{'id': 54, 'name': 'Combat Sports'}, {'id': 27, 'name': 'Shounen'}, {'id': 30, 'name': 'Sports'}]",75,manga,1435,pg_13,"[{'id': 11, 'name': 'Madhouse'}]",363,tuesday,00:50,2000.0,fall,64932,349057,31529,15205,165909,626632.0,0.9254,0.0746
6213,Toaru Kagaku no Railgun,2009-10-03,2010-03-20,"The student-filled Academy City is at the forefront of scientific advancement and home to the esper development program. The seven ""Level 5"" espers are the most powerful in Academy City, and ranked third among them is middle schooler Mikoto Misaka, an electricity manipulator known as ""The Railgun.""
 
When strange incidents begin occurring throughout the city, she finds each crime to be connected to the elusive ""Level Upper,"" a legendary device that allegedly increases the esper level of its user. As the situation escalates, it becomes apparent that there is more to the Level Upper than meets the eye, and that Academy City may be a far more twisted place than the glamorous utopia it appears to be.

Toaru Kagaku no Railgun focuses on Mikoto and her friends—and the dangerous situations they find themselves in—as they get caught up in the matter of the Level Upper. As Mikoto says, ""There's never a dull moment in this city.""

[Written by MAL Rewrite]",7.65,1418.0,364,623998,293670,white,tv,finished_airing,"[{'id': 1, 'name': 'Action'}, {'id': 10, 'name': 'Fantasy'}, {'id': 24, 'name': 'Sci-Fi'}, {'id': 31, 'name': 'Super Power'}]",24,manga,1440,pg_13,"[{'id': 7, 'name': 'J.C.Staff'}]",364,saturday,01:30,2009.0,fall,34736,368876,21612,17872,180838,623934.0,0.9367,0.0633
7311,Suzumiya Haruhi no Shoushitsu,2010-02-06,2010-02-06,"On a cold December day, Kyon arrives at school prepared for another outing with his fellow SOS Brigade members. However, much to his surprise, he discovers that almost everything has changed completely: Haruhi Suzumiya and Itsuki Koizumi are nowhere to be found; Mikuru Asahina does not recognize him at all; Yuki Nagato is a regular human; and Ryouko Asakura has mysteriously returned. Although he is no stranger to the supernatural, Kyon is disturbed by this odd turn of events and decides to investigate on his own.

Finding himself to be the only person that is aware of the previous reality, Kyon is now faced with a difficult choice: to finally live the normal life he has always wanted, or uncover a way to turn back the hands of time and restore his chaotic yet familiar world.

[Written by MAL Rewrite]
",8.6,99.0,365,623064,316843,white,movie,finished_airing,"[{'id': 46, 'name': 'Award Winning'}, {'id': 7, 'name': 'Mystery'}, {'id': 23, 'name': 'School'}, {'id': 24, 'name': 'Sci-Fi'}, {'id': 37, 'name': 'Supernatural'}]",1,light_novel,9707,pg_13,"[{'id': 2, 'name': 'Kyoto Animation'}]",365,NIL,NIL,2010.0,winter,16388,402970,6572,5253,191851,623034.0,0.981,0.019
39534,Jibaku Shounen Hanako-kun,2020-01-10,2020-03-27,"The famous Seven Mysteries that every school seems to have are a staple of Japanese urban legends. One of the most well-known of these tales is that of Hanako-san: the ghost of a young girl who haunts the school's bathrooms.

Kamome Academy has its own version of Hanako-san's legend. Rumors claim that if one successfully manages to summon Hanako-san, she will grant her summoner any wish. Lured by the gossip, many people have tried to call upon her, yet every attempt has failed. However, when Nene Yashiro, a girl hoping for romantic fortune, dares to summon Hanako-san, she discovers that the rumored ""girl"" is actually a boy!

After a series of unfortunate events involving Yashiro's romantic desires, she is unwillingly entangled in the world of the supernatural, becoming Hanako-kun's assistant. Soon, she finds out about Hanako-kun's lesser-known duty: maintaining the fragile balance between mortals and apparitions.

[Written by MAL Rewrite]",7.83,955.0,366,618304,302985,white,tv,finished_airing,"[{'id': 23, 'name': 'School'}, {'id': 27, 'name': 'Shounen'}, {'id': 37, 'name': 'Supernatural'}]",12,manga,1455,pg_13,"[{'id': 456, 'name': 'Lerche'}]",366,friday,01:58,2020.0,winter,51933,361739,24871,26902,152837,618282.0,0.9163,0.0837
36407,Kenja no Mago,2019-04-10,2019-06-26,"In the kingdom of Earlshide, Merlin Wolford was once regarded as a national hero, hailed for both his power and achievements. Preferring a quiet life however, he secludes himself deep in the rural woods, dedicating his time to raising an orphan that he saved. This orphan is Shin, a normal salaryman in modern-day Japan who was reincarnated into Merlin's world while still retaining his past memories. As the years pass, Shin displays unparalleled talent in both magic casting and martial arts, much to Merlin's constant amazement.

On his 15th birthday, however, it becomes apparent that Shin only developed his combat skills and nothing else, leaving him with blatant social awkwardness, a lack of common sense, and a middling sense of responsibility. As a result, Shin enrolls in the kingdom's Magic Academy to hone his skills and mature among other teenagers. However, living a normal life is impossible, as he is established as a local celebrity almost as soon as he arrives.

As Shin Wolford adjusts to his high school life in the capital, he makes new friends, learns about the world, and fights off the various forces of evil surrounding him and his city.

[Written by MAL Rewrite]",6.62,6334.0,367,618010,352213,white,tv,finished_airing,"[{'id': 1, 'name': 'Action'}, {'id': 4, 'name': 'Comedy'}, {'id': 10, 'name': 'Fantasy'}, {'id': 62, 'name': 'Isekai'}, {'id': 72, 'name': 'Reincarnation'}, {'id': 22, 'name': 'Romance'}]",12,light_novel,1420,pg_13,"[{'id': 300, 'name': 'SILVER LINK.'}]",367,wednesday,23:30,2019.0,spring,36669,466761,8050,29736,76666,617882.0,0.9388,0.0612
7724,Shiki,2010-07-09,2010-12-31,"Life is idyllic and unassuming in the small town of Sotoba, a simple place where everyone knows everyone. However, tragedy strikes when Megumi Shimizu, a young girl with high aspirations, unexpectedly passes away from an unnamed illness. Over the torrid summer months, as more unexplained deaths crop up around the village, the town's doctor—Toshio Ozaki—begins to suspect that something more sinister than a mere disease is at play. 

Toshio teams up with Natsuno Yuuki, an apathetic and aloof teenager, and siblings Kaori and Akira Tanaka, two of Megumi's friends, to unravel the dark mystery behind the deaths in Sotoba. With their combined efforts, the investigation leads them toward an eerie secret pertaining to the new family in the Kanemasa mansion.

[Written by MAL Rewrite]
",7.72,1227.0,368,616754,265409,white,tv,finished_airing,"[{'id': 58, 'name': 'Gore'}, {'id': 14, 'name': 'Horror'}, {'id': 7, 'name': 'Mystery'}, {'id': 40, 'name': 'Psychological'}, {'id': 27, 'name': 'Shounen'}, {'id': 37, 'name': 'Supernatural'}, {'id': 41, 'name': 'Suspense'}, {'id': 32, 'name': 'Vampire'}]",22,manga,1369,r,"[{'id': 39, 'name': 'Daume'}]",368,friday,01:15,2010.0,summer,31692,324173,20067,20829,219965,616726.0,0.9337,0.0663
3457,Vampire Knight,2008-04-08,2008-07-01,"The cheerful Yuuki Cross and the gruff Zero Kiryuu are members of the disciplinary committee at Cross Academy, which houses two very distinct classes: the Day Class and the Night Class. Their job consists of upholding order between the classes when they switch out. While that may not seem like an especially difficult task, the Day Class is unaware of the truth behind the Night Class—their utterly gorgeous students are vampires.

Ten years ago, Yuuki was saved from a vampire attack by Kaname Kuran, a Pureblood vampire. Now, Kaname is the leader of the Night Class, and Yuuki's disciplinary committee position allows her to see him again, making her feelings for him grow complicated. Meanwhile, Zero bears a white-hot hatred of all vampires and believes they can never live in harmony with humans. But a secret from Zero's past soon threatens the fragile peace of all at the academy, and things may never be the same again.

[Written by MAL Rewrite]
",6.85,5039.0,369,614891,358720,white,tv,finished_airing,"[{'id': 8, 'name': 'Drama'}, {'id': 64, 'name': 'Love Polygon'}, {'id': 7, 'name': 'Mystery'}, {'id': 22, 'name': 'Romance'}, {'id': 25, 'name': 'Shoujo'}, {'id': 37, 'name': 'Supernatural'}, {'id': 32, 'name': 'Vampire'}]",13,manga,1449,pg_13,"[{'id': 37, 'name': 'Studio Deen'}]",369,tuesday,01:00,2008.0,spring,21118,469621,13324,32603,78197,614863.0,0.9253,0.0747
16067,Nagi no Asu kara,2013-10-03,2014-04-03,"Long ago, all humans lived beneath the sea. However, some people preferred the surface and abandoned living underwater permanently. As a consequence, they were stripped of their god-given protection called ""Ena"" which allowed them to breathe underwater. Over time, the rift between the denizens of the sea and of the surface widened, although contact between the two peoples still existed.

Nagi no Asu kara follows the story of Hikari Sakishima and Manaka Mukaido, along with their childhood friends Chisaki Hiradaira and Kaname Isaki, who are forced to leave the sea and attend a school on the surface. There, the group also meets Tsumugu Kihara, a fellow student and fisherman who loves the sea.

Hikari and his friends' lives are bound to change as they have to deal with the deep-seated hatred and discrimination between the people of sea and of the surface, the storms in their personal lives, as well as an impending tempest which may spell doom for all who dwell on the surface.

[Written by MAL Rewrite]",7.95,729.0,370,614278,261004,white,tv,finished_airing,"[{'id': 8, 'name': 'Drama'}, {'id': 10, 'name': 'Fantasy'}, {'id': 64, 'name': 'Love Polygon'}, {'id': 22, 'name': 'Romance'}, {'id': 82, 'name': 'Urban Fantasy'}]",26,original,1419,pg_13,"[{'id': 132, 'name': 'P.A. Works'}]",370,thursday,22:00,2013.0,fall,36841,307038,26352,32327,211689,614247.0,0.9045,0.0955
512,Majo no Takkyuubin,1989-07-29,1989-07-29,"Kiki, a 13-year-old witch-in-training, must spend a year living on her own in a distant town in order to become a full-fledged witch. Leaving her family and friends, Kiki undertakes this tradition when she flies out into the open world atop her broomstick with her black cat Jiji.

As she settles down in the coastal town of Koriko, Kiki struggles to adapt and ends up wandering the streets with no place to stay—until she encounters Osono, who offers Kiki boarding in exchange for making deliveries for her small bakery. Before long, Kiki decides to open her own courier service by broomstick, beginning her journey to independence. In attempting to find her place among the townsfolk, Kiki brings with her exciting new experiences and comes to understand the true meaning of responsibility.

[Written by MAL Rewrite]",8.23,346.0,371,613935,398544,white,movie,finished_airing,"[{'id': 2, 'name': 'Adventure'}, {'id': 46, 'name': 'Award Winning'}, {'id': 4, 'name': 'Comedy'}, {'id': 8, 'name': 'Drama'}, {'id': 10, 'name': 'Fantasy'}]",1,novel,6182,g,"[{'id': 21, 'name': 'Studio Ghibli'}]",371,NIL,NIL,1989.0,summer,7322,528407,2496,898,74779,613902.0,0.9945,0.0055
2034,Lovely★Complex,2007-04-07,2007-09-29,"Love is unusual for Risa Koizumi and Atsushi Ootani, who are both striving to find their ideal partner in high school—172 cm tall Koizumi is much taller than the average girl, and Ootani is much shorter than the average guy at 156 cm. To add to their plights, their crushes fall in love with each other, leaving Koizumi and Ootani comically flustered and heartbroken. To make matters worse, they're even labeled as a comedy duo by their homeroom teacher due to their personalities and the stark difference in their heights, and their classmates even think of their arguments as sketches.

Lovely★Complex follows Koizumi and Ootani as they encourage each other in finding love and become close friends. Apart from their ridiculous antics, they soon find out an unexpected similarity in their music and fashion tastes. Maybe they possess a chemistry yet unknown, but could love ever bloom between the mismatched pair?

[Written by MAL Rewrite]",8.03,622.0,372,610602,300809,white,tv,finished_airing,"[{'id': 4, 'name': 'Comedy'}, {'id': 22, 'name': 'Romance'}, {'id': 23, 'name': 'School'}, {'id': 25, 'name': 'Shoujo'}]",24,manga,1440,pg_13,"[{'id': 18, 'name': 'Toei Animation'}]",372,NIL,NIL,2007.0,spring,28717,379794,19123,20101,162826,610561.0,0.9358,0.0642
136,Hunter x Hunter,1999-10-16,2001-03-31,"Hunters are specialized in a wide variety of fields, ranging from treasure hunting to cooking. They have access to otherwise unavailable funds and information that allow them to pursue their dreams and interests. However, being a hunter is a special privilege, only attained by taking a deadly exam with an extremely low success rate.

Gon Freecss, a 12-year-old boy with the hope of finding his missing father, sets out on a quest to take the Hunter Exam. Along the way, he picks up three companions who also aim to take the dangerous test: the revenge-seeking Kurapika, aspiring doctor Leorio Paladiknight, and a mischievous child the same age as Gon, Killua Zoldyck.

As the four aspiring hunters embark on a perilous adventure, they fight for their dreams while defying the odds.

[Written by MAL Rewrite]",8.42,188.0,373,610441,297113,white,tv,finished_airing,"[{'id': 1, 'name': 'Action'}, {'id': 2, 'name': 'Adventure'}, {'id': 10, 'name': 'Fantasy'}, {'id': 27, 'name': 'Shounen'}]",62,manga,1380,pg_13,"[{'id': 22, 'name': 'Nippon Animation'}]",373,saturday,18:00,1999.0,fall,44154,381836,23332,22143,138950,610415.0,0.9255,0.0745
11577,Steins;Gate Movie: Fuka Ryouiki no Déjà vu,2013-04-20,2013-04-20,"After a year in America, Kurisu Makise returns to Akihabara and reunites with Rintarou Okabe. However, their reunion is cut short when Okabe begins to experience recurring flashes of other timelines as the consequences of his time traveling start to manifest. These side effects eventually culminate in Okabe suddenly vanishing from the world, and only the startled Kurisu has any memory of his existence.

In the midst of despair, Kurisu is faced with a truly arduous choice that will test both her duty as a scientist and her loyalty as a friend: follow Okabe's advice and stay away from traveling through time to avoid the potential consequences it may have on the world lines, or ignore it to rescue the person that she cherishes most. Regardless of her decision, the path she chooses is one that will affect the past, the present, and the future.

[Written by MAL Rewrite]",8.45,165.0,374,610182,364485,white,movie,finished_airing,"[{'id': 8, 'name': 'Drama'}, {'id': 24, 'name': 'Sci-Fi'}]",1,visual_novel,5400,pg_13,"[{'id': 314, 'name': 'White Fox'}]",374,NIL,NIL,2013.0,spring,10282,467997,3583,1508,126784,610154.0,0.9917,0.0083
9513,Beelzebub,2011-01-09,2012-03-25,"Ishiyama High is a school populated entirely by delinquents, where nonstop violence and lawlessness are the norm. However, there is one universally acknowledged rule—don't cross first year student Tatsumi Oga, Ishiyama's most vicious fighter.

One day, Oga is by a riverbed when he encounters a man floating down the river. After being retrieved by Oga, the man splits down the middle to reveal a baby, which crawls onto Oga's back and immediately forms an attachment to him. Though he doesn't know it yet, this baby is named Kaiser de Emperana Beelzebub IV, or ""Baby Beel"" for short—the son of the Demon Lord!

As if finding the future Lord of the Underworld isn't enough, Oga is also confronted by Hildegard, Beel's demon maid. Together they attempt to raise Baby Beel—although surrounded by juvenile delinquents and demonic powers, the two of them may be in for more of a challenge than they can imagine.

[Written by MAL Rewrite]",7.84,944.0,375,610005,286407,white,tv,finished_airing,"[{'id': 1, 'name': 'Action'}, {'id': 53, 'name': 'Childcare'}, {'id': 4, 'name': 'Comedy'}, {'id': 55, 'name': 'Delinquents'}, {'id': 6, 'name': 'Mythology'}, {'id': 23, 'name': 'School'}, {'id': 27, 'name': 'Shounen'}, {'id': 37, 'name': 'Supernatural'}]",60,manga,1470,pg_13,"[{'id': 1129, 'name': 'Pierrot Plus'}]",375,sunday,07:00,2011.0,winter,53388,330977,41442,44311,139854,609972.0,0.8594,0.1406
14075,Zetsuen no Tempest,2012-10-05,2013-03-29,"Yoshino Takigawa, an ordinary teenager, is secretly dating his best friend Mahiro Fuwa's younger sister, Aika. But when Aika mysteriously dies, Mahiro disappears, vowing to find the one responsible and make them pay for murdering his beloved sister. Yoshino continues his life as usual and has not heard from Mahiro in a month—until he is confronted by a strange girl who holds him at gunpoint, and his best friend arrives in the nick of time to save him.

Yoshino learns that Mahiro has enlisted the help of a witch named Hakaze Kusaribe to find Aika's killer. However, the witch has been banished to a deserted island due to infighting within her clan. Hakaze's brother, Samon, selfishly desires to make use of the Tree of Exodus' power, in spite of both his sister's opposition and the impending peril to the world. With Hakaze out of the picture, it is now up to Yoshino and Mahiro to help her save the world, all while inching ever closer to the truth behind Aika's death.

[Written by MAL Rewrite]",7.89,842.0,376,609580,265142,white,tv,finished_airing,"[{'id': 1, 'name': 'Action'}, {'id': 8, 'name': 'Drama'}, {'id': 10, 'name': 'Fantasy'}, {'id': 7, 'name': 'Mystery'}, {'id': 40, 'name': 'Psychological'}, {'id': 27, 'name': 'Shounen'}, {'id': 41, 'name': 'Suspense'}, {'id': 82, 'name': 'Urban Fantasy'}]",24,manga,1470,pg_13,"[{'id': 4, 'name': 'Bones'}]",376,friday,02:00,2012.0,fall,36472,326145,24427,24369,198124,609537.0,0.9199,0.0801
35860,Karakai Jouzu no Takagi-san,2018-01-08,2018-03-26,"Having a friend that knows you inside out should be a good thing, but in Nishikata's case, the opposite is true.

His classmate Takagi loves to tease him on a daily basis, and she uses her extensive knowledge of his behavior to predict exactly how he will react to her teasing, making it nearly impossible for Nishikata to ever make a successful comeback. Despite this, Nishikata vows to someday give Takagi a taste of her own medicine by making her blush out of embarrassment from his teasing.

[Written by MAL Rewrite]
",7.68,1329.0,377,608817,303323,white,tv,finished_airing,"[{'id': 4, 'name': 'Comedy'}, {'id': 74, 'name': 'Love Status Quo'}, {'id': 23, 'name': 'School'}, {'id': 27, 'name': 'Shounen'}]",12,manga,1417,pg_13,"[{'id': 247, 'name': 'Shin-Ei Animation'}]",377,monday,23:00,2018.0,winter,42597,364130,21097,26356,154589,608769.0,0.9221,0.0779
40750,Kaifuku Jutsushi no Yarinaoshi,2021-01-13,2021-03-31,"When Keyaru acquired his powers as a Hero who specialized in healing all injuries regardless of severity, it seemed that he would walk the path to a great future. But what awaited him instead was great agony; he was subjected to years of seemingly endless hellish torture and abuse. Keyaru's healing skills allowed him to secretly collect the memories and abilities of those he treated, gradually making him stronger than anyone else. But by the time he reached his full potential, it was far too late—he had already lost everything.

Determined to put his life back on track, Keyaru decided to unleash a powerful healing spell that rewound the entire world back to the time before he began to suffer his horrible fate. Equipped with the anguish of his past, he vows to redo everything in order to fulfill a new purpose—to exact revenge upon those who have wronged him.

[Written by MAL Rewrite]",6.33,-1,378,606824,347266,white,tv,finished_airing,"[{'id': 1, 'name': 'Action'}, {'id': 2, 'name': 'Adventure'}, {'id': 8, 'name': 'Drama'}, {'id': 49, 'name': 'Erotica'}, {'id': 10, 'name': 'Fantasy'}, {'id': 58, 'name': 'Gore'}, {'id': 35, 'name': 'Harem'}, {'id': 78, 'name': 'Time Travel'}]",12,light_novel,1440,r+,"[{'id': 120, 'name': 'TNK'}]",378,wednesday,23:30,2021.0,winter,66609,395362,11027,50701,82983,606682.0,0.8983,0.1017
2890,Gake no Ue no Ponyo,2008-07-19,2008-07-19,"A goldfish sneaks away from home and floats off on the back of a jellyfish. After getting stuck in a glass jar, she drifts to the shore where she is freed by Sousuke, a five-year-old boy who lives with his mother Lisa in a house by the sea while his father Koichi works on a fishing boat. After healing a cut on Sousuke's finger by licking it, the goldfish is named Ponyo by her new friend.

Unknown to Sousuke, Ponyo already has a name and a family. Her father Fujimoto, a sorcerer who forsook his humanity to live underwater, searches frantically for his daughter Brunhilde. When found and captured, Ponyo rejects her birth name and declares that she wants to become a human. Using the power received from Sousuke's blood, she grows arms and legs and escapes to the surface once more. But the magic released into the ocean causes an imbalance in nature, causing the Moon to start falling out of orbit and the tides to grow dangerously stronger. Reunited with Ponyo, Sousuke must pass an ancient test to restore order in the world and let his companion live on as a human.

[Written by MAL Rewrite]",7.95,724.0,379,606428,401861,white,movie,finished_airing,"[{'id': 2, 'name': 'Adventure'}, {'id': 46, 'name': 'Award Winning'}, {'id': 10, 'name': 'Fantasy'}]",1,original,6050,g,"[{'id': 21, 'name': 'Studio Ghibli'}]",379,NIL,NIL,2008.0,summer,6781,538871,1994,947,57812,606405.0,0.9952,0.0048
