id,title,start_date,end_date,synopsis,mean,rank,popularity,num_list_users,num_scoring_users,nsfw,media_type,status,genres,num_episodes,source,average_episode_duration,rating,studios,movie_ranking,broadcast_day_of_the_week,broadcast_start_time,start_season_year,start_season_season,statistics_watching,statistics_completed,statistics_on_hold,statistics_dropped,statistics_plan_to_watch,statistics_num_list_users,positive_viewership_fraction,negative_viewership_fraction
451,InuYasha Movie 3: Tenka Hadou no Ken,2003-12-20,2003-12-20,"Following Inu no Taishou's death, his swords Tenseiga and Tessaiga were passed on to his sons, Sesshoumaru and Inuyasha respectively. However, there exists one more blade. During a visit to his friend Kagome Higurashi in modern times, Inuyasha encounters Sounga—his father's third sword. Found by one of Kagome's ancestors inside the old well that connects the past to the future, Sounga has been kept for years as a treasured artifact at the Higurashi shrine. Nevertheless, it soon reveals itself to harbor an evil spirit with a terrible urge to kill. 

While struggling to subdue its calamitous nature, Inuyasha manages to bring Sounga back to the feudal era where he must confront his brother Sesshoumaru, who has always desired to possess it. But when they lose track of the sword during their fight, the siblings engage in a fervent competition to find it, still unaware of its secret and the legacy that Inu no Taishou has left for them.

[Written by MAL Rewrite]
",7.8,1027,2124,104259,55129,white,movie,finished_airing,"[{'id': 1, 'name': 'Action'}, {'id': 2, 'name': 'Adventure'}, {'id': 10, 'name': 'Fantasy'}, {'id': 13, 'name': 'Historical'}, {'id': 6, 'name': 'Mythology'}, {'id': 22, 'name': 'Romance'}, {'id': 27, 'name': 'Shounen'}, {'id': 78, 'name': 'Time Travel'}]",1,manga,5880,pg_13,"[{'id': 14, 'name': 'Sunrise'}]",233,,NIL,2003.0,fall,1396,86469,722,401,15266,104254.0,0.9892,0.0108
28725,Kokoro ga Sakebitagatterunda.,2015-09-19,2015-09-19,"Jun Naruse is a chatterbox whose life is colored by fairy tales and happy endings. However, influenced by her deep belief in those tales, she is too naive and trusting, and her words soon shatter her family's bond when she inadvertently reveals her father's affair. Naruse is scarred for life after being blamed for her parent's divorce, and her regrets soon manifest into a fairy egg—a being who seals her mouth from speaking in order to protect everyone's happy ending.

Now, even in high school, Naruse's speech remains locked by the fairy egg. Even trying to speak causes her stomach to twist. Though unable to convey her thoughts through words, she is unexpectedly chosen to perform in a musical alongside three other students: Takumi Sakagami, Natsuki Nitou, and Daiki Tasaki. Naruse makes her way to the club room to reject the daunting task, but changes her mind when she overhears Sakagami's beautiful singing.

Perhaps the fairy egg ""curse"" does not apply to singing, and perhaps Sakagami is the fairy tale prince she has been seeking all along. Will Naruse be able to convey the anthem of her heart?

[Written by MAL Rewrite]",7.8,1029,737,340186,161796,white,movie,finished_airing,"[{'id': 8, 'name': 'Drama'}, {'id': 70, 'name': 'Performing Arts'}, {'id': 22, 'name': 'Romance'}, {'id': 23, 'name': 'School'}]",1,original,7157,pg_13,"[{'id': 56, 'name': 'A-1 Pictures'}]",234,,NIL,2015.0,summer,10173,203817,3225,1270,121689,340174.0,0.9868,0.0132
40082,Lupin III: The First,2019-12-06,2019-12-06,"The iconic ""gentleman thief"" Lupin III returns in an action-packed, continent-spanning adventure, as Lupin III and his colorful underworld companions race to uncover the secrets of the mysterious Bresson Diary, before it falls into the hands of a dark cabal that will stop at nothing to resurrect the Third Reich. The gang undertakes trap-filled tombs, aerial escapades, and daring prison escapes with the trademark wit and visual finesse that have made Lupin the 3rd one of the most storied animation franchises in the world, in a thrilling new caper that is sure to delight fans old and new.

(Source: GKIDS, edited)",7.8,1032,3971,34455,18360,white,movie,finished_airing,"[{'id': 1, 'name': 'Action'}, {'id': 50, 'name': 'Adult Cast'}, {'id': 2, 'name': 'Adventure'}, {'id': 4, 'name': 'Comedy'}, {'id': 7, 'name': 'Mystery'}, {'id': 42, 'name': 'Seinen'}]",1,manga,5540,pg_13,"[{'id': 73, 'name': 'TMS Entertainment'}, {'id': 1296, 'name': 'Marza Animation Planet'}]",235,,NIL,2019.0,fall,761,23098,220,197,10176,34452.0,0.9879,0.0121
23293,Lupin the IIIrd: Jigen Daisuke no Bohyou,2014-06-21,2014-06-21,"The film will be a continuation spinoff of the 2012 ""Lupin III: The Woman Called Fujiko Mine"" television anime series.

Lupin and Jigen have their sights set on a treasure worth stealing called the Little Comet which is located in the country of East Doroa. The country has fortified its border after a singer named Queen Malta got assassinated in the neighboring country of West Doroa upon visit. 

Despite the two countries being enemies, Lupin and Jigen still plan to steal the treasure. During the heist, Jigen almost got killed by a skilled sniper named Yael Okuzaki. His specialty is preparing tombstones for his targets before executing his kills. Its said that no one has survived after Yael makes a grave for that target.

(Source: ANN)",7.8,1033,4190,30652,14390,white,movie,finished_airing,"[{'id': 1, 'name': 'Action'}, {'id': 50, 'name': 'Adult Cast'}, {'id': 2, 'name': 'Adventure'}, {'id': 8, 'name': 'Drama'}, {'id': 42, 'name': 'Seinen'}]",1,manga,3060,r+,"[{'id': 94, 'name': 'Telecom Animation Film'}]",236,,NIL,2014.0,spring,805,18836,308,247,10454,30650.0,0.9819,0.0181
19613,New Initial D Movie: Legend 1 - Kakusei,2014-08-24,2014-08-24,"One foggy morning, a black and white Toyota AE86 flies past Keisuke Takahashi's Mazda RX7 on Mount Akina, making him believe he has seen the ghost of a racer who died on the mountain. Resolving to defeat this phantom, Keisuke mobilizes the Akagi Red Suns to take on the local Akina Speed Stars racing team in an exchange race. He anticipates that the competition will lure the elusive ""Ghost of Akina"" out into the open and give him the opportunity to exact revenge for his previous defeat. 

While his friend Itsuki Takeuchi is obsessed with cars and racing, Takumi Fujiwara is not. He fails to understand the ""rush"" that racers experience and any talk of cars reminds him of the tofu deliveries he makes for his father in an old AE86. His early morning routine takes him up and down Mount Akina, where he has memorized every hairpin, brake point, and turn better than anyone else. 

When the Akagi team appears one night to challenge the Speed Stars to an exchange race, they accept the challenge only to find out that they are completely outclassed. The only way the Speed Stars can stand a chance against them is if they can get the panda-colored AE86 to join their team. With a bit of coercion, Takumi takes the wheel of the AE86 and heads off to Mount Akina to defend the pride of all racers in Akina.

[Written by MAL Rewrite]",7.8,1036,3668,40663,20178,white,movie,finished_airing,"[{'id': 1, 'name': 'Action'}, {'id': 3, 'name': 'Racing'}, {'id': 42, 'name': 'Seinen'}]",1,manga,3756,pg_13,"[{'id': 537, 'name': 'SANZIGEN'}, {'id': 839, 'name': 'LIDENFILMS'}]",237,,NIL,2014.0,summer,884,28967,327,337,10147,40662.0,0.9837,0.0163
33190,Planetarian: Hoshi no Hito,2016-09-03,2016-09-03,"An adaptation of the visual-novel by Key, Planetarian: Hoshi no Hito combines the story of the original work with an expansion that extends the narrative with content from the Hoshi no Hito light-novel sequel. 

In the future after much of the world has been devastated by nuclear and biological warfare, a young scavenger or ""Junker"" exploring a quarantined and abandoned city comes across a service robot still faithfully awaiting customers in the rooftop planetarium of a department store. Against his pragmatic instincts he helps the robot repair the planetarium's projector: a decision which will change both their fates.

(Source: ANN)",7.8,1037,3233,50951,16783,white,movie,finished_airing,"[{'id': 8, 'name': 'Drama'}, {'id': 24, 'name': 'Sci-Fi'}]",1,visual_novel,7013,pg_13,"[{'id': 287, 'name': 'David Production'}]",238,,NIL,2016.0,summer,1885,22175,810,399,25679,50948.0,0.9763,0.0237
29830,Tamayura: Sotsugyou Shashin Part 3 - Akogare,2015-11-28,2015-11-28,The third movie of a four-part finale of Tamayura.,7.8,1040,6453,10813,3874,white,movie,finished_airing,"[{'id': 52, 'name': 'CGDCT'}, {'id': 63, 'name': 'Iyashikei'}, {'id': 36, 'name': 'Slice of Life'}]",1,original,3060,g,"[{'id': 333, 'name': 'TYO Animations'}]",239,,NIL,2015.0,fall,363,5043,241,182,4983,10812.0,0.9609,0.0391
42091,Shingeki no Kyojin: Chronicle,2020-07-17,2020-07-17,The compilation film will recap the anime's 59 episodes from seasons one to three.,7.79,1042,2308,91618,30202,white,movie,finished_airing,"[{'id': 1, 'name': 'Action'}, {'id': 8, 'name': 'Drama'}, {'id': 58, 'name': 'Gore'}, {'id': 38, 'name': 'Military'}, {'id': 27, 'name': 'Shounen'}, {'id': 76, 'name': 'Survival'}, {'id': 41, 'name': 'Suspense'}]",1,manga,7200,r,"[{'id': 858, 'name': 'Wit Studio'}]",240,,NIL,2020.0,summer,2348,50636,933,1362,36329,91608.0,0.9749,0.0251
38850,Star☆Twinkle Precure: Hoshi no Uta ni Omoi wo Komete,2019-10-19,2019-10-19,"When a meteor shower causes a mysterious star-shaped alien to land in Lala Hagoromo and Hikaru Hoshina's home, the girls find themselves having to take care of the mischievous creature whom they name ""Yuma."" Although their relationship gets off to a rocky start, Lala and Yuma eventually connect through their similar passions for music and exploration. 

However, when strange alien hunters targeting Yuma arrive on Earth, the girls learn that there is more to Yuma than what meets the eye. In protecting Yuma, the Star☆Twinkle Precure find themselves entangled in an astronomical battle where the fate of the galaxy is at stake! Will Yuma feel the Precure's emotions through their melody, and can they make the necessary sacrifices to defend everything they love?

[Written by MAL Rewrite]",7.79,1043,8955,4805,2036,white,movie,finished_airing,"[{'id': 1, 'name': 'Action'}, {'id': 66, 'name': 'Mahou Shoujo'}]",1,original,4320,g,"[{'id': 18, 'name': 'Toei Animation'}]",241,,NIL,2019.0,fall,172,2620,83,175,1753,4803.0,0.9463,0.0537
16870,The Last: Naruto the Movie,2014-12-06,2014-12-06,"Two years have passed since the end of the Fourth Great Ninja War. Konohagakure has remained in a state of peace and harmony—until Sixth Hokage Kakashi Hatake notices the moon is dangerously approaching the Earth, posing the threat of planetary ruin.

Amidst the grave ordeal, Konoha is invaded by a new evil, Toneri Oosutuski, who suddenly abducts Hinata Hyuuga's little sister Hanabi. Kakashi dispatches a skilled ninja team comprised of Naruto Uzumaki, Sakura Haruno, Shikamaru Nara, Sai, and Hinata in an effort to rescue Hanabi from the diabolical clutches of Toneri. However, during their mission, the team faces several obstacles that challenge them, foiling their efforts.

With her abduction, the relationships the team share with one another are tested, and with the world reaching the brink of destruction, they must race against time to ensure the safety of their planet. Meanwhile, as the battle ensues, Naruto is driven to fight for something greater than he has ever imagined—love.

[Written by MAL Rewrite]",7.79,1045,361,629515,417868,white,movie,finished_airing,"[{'id': 1, 'name': 'Action'}, {'id': 2, 'name': 'Adventure'}, {'id': 10, 'name': 'Fantasy'}, {'id': 22, 'name': 'Romance'}, {'id': 27, 'name': 'Shounen'}]",1,manga,6720,pg_13,"[{'id': 1, 'name': 'Pierrot'}]",242,,NIL,2014.0,fall,8460,581321,1397,1149,37167,629494.0,0.996,0.004
33280,Gochuumon wa Usagi desu ka?? Dear My Sister,2017-11-11,2017-11-11,"Cocoa visits her family, in the mountains, after quite some time again after her sister Mocha wrote her, through a letter, to come back soon. Her friends will have to spend a week in the town without her, while Cocoa has time with her family that she hasn't seen for a long time. But Chino, Cocoa's self proclaimed little sister, wants to go watch, with Cocoa and all her friends, the fireworks in the fireworks festival, which is coming up in less than a week. Cocoa decides to return early as she misses them all, but will she arrive in time for the climax of the festival?

(Source: TMDB)",7.79,1057,3522,43879,18647,white,movie,finished_airing,"[{'id': 52, 'name': 'CGDCT'}, {'id': 63, 'name': 'Iyashikei'}, {'id': 36, 'name': 'Slice of Life'}, {'id': 48, 'name': 'Workplace'}]",1,4_koma_manga,3604,pg_13,"[{'id': 1669, 'name': 'production doA'}]",243,,NIL,2017.0,fall,1382,24411,484,341,17256,43874.0,0.9812,0.0188
39938,Inu-Ou,2022-05-28,2022-05-28,"After diving for an ancient sword in the waters where the battle of Dan-no-ura was fought and the Heike clan fell, Tomona loses both his sight and his father. Left with few options other than learning to play the biwa, Tomona gains enough skill to join a prestigious troupe of storytelling performers and takes the name ""Tomoichi."" 

Soon after, Tomoichi meets a strange person who finds joy in terrorizing others with his deformed appearance, but is surprised when the sightless storyteller treats him as an equal. The pair become fast friends and begin performing together after the stranger—who chooses the name ""Inu-Ou""—discovers that he is able to hear spirits telling forgotten tales of the Heike clan.

Tomoichi changes his name again to Tomoari and uses his music to promote Inu-Ou's underground dance performances, achieving incredible popularity among the masses. However, the brazen and unconventional style they develop challenges traditions that the shogunate values deeply. As the pair's fame continues to increase, they must contend with the forces of tradition that control the society around them.

[Written by MAL Rewrite]",7.79,1059,4133,31811,9895,white,movie,finished_airing,"[{'id': 46, 'name': 'Award Winning'}, {'id': 10, 'name': 'Fantasy'}, {'id': 13, 'name': 'Historical'}, {'id': 19, 'name': 'Music'}, {'id': 70, 'name': 'Performing Arts'}]",1,novel,5853,r,"[{'id': 1591, 'name': 'Science SARU'}]",244,,NIL,2022.0,spring,963,12060,363,221,18199,31806.0,0.9816,0.0184
14349,Little Witch Academia,2013-03-02,2013-03-02,"For young witches everywhere, the world-renowned witch Shiny Chariot reigns as the most revered and celebrated role model. But as the girls age, so do their opinions of her—now just the mention of Chariot would get a witch labeled a child. However, undeterred in her blind admiration for Chariot, ordinary girl Atsuko Kagari enrolls into Luna Nova Magical Academy, hoping to someday become just as mesmerizing as her idol.

However, the witch academy isn't all the fun and games Atsuko thought it would be: boring lectures, strict teachers, and students who mock Chariot plague the campus. Coupled with her own ineptness in magic, she's seen as little more than a rebel student. But when a chance finally presents itself to prove herself to her peers and teachers, she takes it, and now it's up to her to stop a rampaging dragon before it flattens the entire academy. 

[Written by MAL Rewrite]",7.79,1063,799,316987,177361,white,movie,finished_airing,"[{'id': 2, 'name': 'Adventure'}, {'id': 4, 'name': 'Comedy'}, {'id': 10, 'name': 'Fantasy'}, {'id': 23, 'name': 'School'}]",1,original,1570,pg_13,"[{'id': 803, 'name': 'Trigger'}]",245,,NIL,2013.0,winter,6259,240142,2352,2109,66108,316970.0,0.9859,0.0141
1366,Meitantei Conan Movie 07: Meikyuu no Crossroad,2003-04-19,2003-04-19,"Under the cover of darkness, a masked samurai murders five men across the metropolis of Japan: three in Tokyo, one in Osaka, and the last in Kyoto. In their investigation, the police learn that each man was a member of the Genjibotaru—a thieves gang centered on the theft of Buddhist statues and artifacts and who go by the names of Minomoto no Yoshitune's servants.
 
Without a clear motive or clues to the other members' identities, the case runs dry until a Kyoto temple calls for the famous Kogorou Mouri. Having received an anonymous letter containing a peculiar puzzle, the temple monks ask for his assistance in solving it to recover their long lost statue. Meanwhile, Conan Edogawa and high school detective Heiji Hattori team up in order to solve the cryptic puzzle and find the murderer, as Hattori searches for his childhood love.
 
With Hattori's knowledge of Kyoto, the two scour the streets and gradually discover the truth, but not before the murderer strikes again—killing another Genjibotaru member and, after repeated attempts on Hattori's life, eventually kidnapping Hattori's childhood sweetheart. It is only by working together to bring buried clues to light can Conan and Hattori hope to end the rogue samurai's bloodshed and save Hattori's love.
 
[Written by MAL Rewrite]",7.79,1066,3140,54016,31939,white,movie,finished_airing,"[{'id': 2, 'name': 'Adventure'}, {'id': 4, 'name': 'Comedy'}, {'id': 39, 'name': 'Detective'}, {'id': 7, 'name': 'Mystery'}, {'id': 27, 'name': 'Shounen'}]",1,manga,6480,pg_13,"[{'id': 73, 'name': 'TMS Entertainment'}]",246,,NIL,2003.0,spring,628,48731,273,291,4089,54012.0,0.9896,0.0104
875,Mind Game,2004-08-07,2004-08-07,"After seeing her jump onto a subway at the last second and getting her ankle crushed between the doors, Nishi reconnects with his high school sweetheart, Myon. Nishi is still very much in love with Myon, but is shocked to learn that she is engaged to another man. Nishi agrees to meet Myon's fiancé at her family's Yakitori restaurant, but members of the Yakuza storm the joint and murder Nishi when he tries to stop them from raping Myon.

Nishi, now dead, wakes up and meets a constantly shapeshifting god, who mocks him for dying. The god tells Nishi to walk into a portal and disappear from existence, which Nishi rejects, choosing instead to sprint past the god and reanimate. With a new outlook on life and knowledge of how the Yakuza are going to attack him, Nishi kills one of the Yakuza with his own gun, fleeing in a stolen car with Myon and her sister.

Acclaimed director Masaaki Yuasa's debut film, Mind Game's constantly shifting visuals tell a story about living one's life without regrets that is unlike any other.

[Written by MAL Rewrite]",7.79,1067,2335,89726,33485,white,movie,finished_airing,"[{'id': 50, 'name': 'Adult Cast'}, {'id': 2, 'name': 'Adventure'}, {'id': 5, 'name': 'Avant Garde'}, {'id': 46, 'name': 'Award Winning'}, {'id': 4, 'name': 'Comedy'}, {'id': 40, 'name': 'Psychological'}, {'id': 22, 'name': 'Romance'}]",1,manga,6187,r,"[{'id': 13, 'name': 'Studio 4°C'}]",247,,NIL,2004.0,summer,2180,41011,1004,687,44836,89718.0,0.9812,0.0188
48896,Overlord Movie 3: Sei Oukoku-hen,2024-09-20,2024-09-20,"The Sacred Kingdom has enjoyed a great many years without war thanks to a colossal wall constructed after a historic tragedy. They understand best how fragile peace can be. When the terrible demon Jaldabaoth takes to the field at the head of a united army of monstrous tribes, the Sacred Kingdom's leaders know their defenses are not enough. With the very existence of the country at stake, the pious have no choice but to seek help wherever they can get it, even if it means breaking taboo and parlaying with the undead king of the Nation of Darkness!

(Source: Yen Press)",7.79,1069,2674,72192,4523,white,movie,finished_airing,"[{'id': 1, 'name': 'Action'}, {'id': 2, 'name': 'Adventure'}, {'id': 10, 'name': 'Fantasy'}, {'id': 62, 'name': 'Isekai'}]",1,light_novel,8100,r,"[{'id': 11, 'name': 'Madhouse'}]",248,,NIL,2024.0,summer,2617,5455,758,123,63220,72173.0,0.9878,0.0122
15771,Saint☆Oniisan (Movie),2013-05-10,2013-05-10,"After thousands of years of hard work, Jesus Christ and Gautama Buddha decide that they have earned a vacation and descend from the heavens to rent a small apartment in Tokyo, Japan. As the pair struggles to live incognito, they enjoy the luxuries of modern society, such as amusement parks, and limited-time store sales. Jesus and Buddha take the time to celebrate each other's holidays, watch the changing of the seasons, and explore their new surroundings.

[Written by MAL Rewrite]",7.79,1070,2204,98489,44566,white,movie,finished_airing,"[{'id': 4, 'name': 'Comedy'}, {'id': 42, 'name': 'Seinen'}]",1,manga,5384,pg_13,"[{'id': 56, 'name': 'A-1 Pictures'}]",249,,NIL,2013.0,spring,2260,58493,923,646,36162,98484.0,0.9841,0.0159
570,Jin-Rou,2000-06-03,2000-06-03,"In an alternate history, following World War II, civil unrest and terrorism run rampant in a devastated Japan under foreign occupation. During a botched interception of underground munitions being transferred by a terrorist organization, Constable Kazuki Fuse, a soldier in an elite counter-terrorism unit, witnesses the true terror of human nature. He fails to prevent a teenage girl from carrying out a desperate suicide bombing that subsequently causes immense destruction to Tokyo. With mental scars and his competence under question, Fuse is sent back to the military academy for re-evaluation. Unbeknownst to him, he will soon be caught up in a web of government conspiracies that have the power to determine the future of all of Japan.

As Fuse treads the fine line between human and beast, he ultimately discovers to which side he truly belongs.

[Written by MAL Rewrite]",7.78,1071,1322,189895,82026,white,movie,finished_airing,"[{'id': 1, 'name': 'Action'}, {'id': 50, 'name': 'Adult Cast'}, {'id': 46, 'name': 'Award Winning'}, {'id': 8, 'name': 'Drama'}, {'id': 38, 'name': 'Military'}, {'id': 40, 'name': 'Psychological'}, {'id': 22, 'name': 'Romance'}, {'id': 41, 'name': 'Suspense'}]",1,manga,6120,r,"[{'id': 10, 'name': 'Production I.G'}]",250,,NIL,2000.0,spring,5644,102903,1801,946,78585,189879.0,0.9855,0.0145
5310,Macross F Movie 1: Itsuwari no Utahime,2009-11-21,2009-11-21,"Half retelling of the original Frontier series, half new story. Conspiracies arise within the Frontier government when Sheryl Nome arrives to the colonial fleet for her concert and is soon marked as a spy for Galaxy while childhood friends, Alto Saotome and Ranka Lee both try to achieve their dreams as the battle between Frontier and the Vajra draws closer.

This movie serves as part one of the Frontier retelling and will conclude with the second, The Wings of Goodbye.",7.78,1076,4128,31934,16427,white,movie,finished_airing,"[{'id': 1, 'name': 'Action'}, {'id': 18, 'name': 'Mecha'}, {'id': 38, 'name': 'Military'}, {'id': 19, 'name': 'Music'}, {'id': 22, 'name': 'Romance'}, {'id': 24, 'name': 'Sci-Fi'}, {'id': 29, 'name': 'Space'}]",1,original,7169,pg_13,"[{'id': 41, 'name': 'Satelight'}, {'id': 441, 'name': '8bit'}]",251,,NIL,2009.0,fall,687,22388,317,307,8233,31932.0,0.9805,0.0195
1505,Meitantei Conan Movie 09: Suihei Senjou no Strategy,2005-04-09,2005-04-09,"Fifteen years ago in a barren stretch of the Pacific, a cruise ship collided with an iceberg and was lost at sea. More than a decade later, Hideto Yashiro—a ship engineer—died in a fatal car accident. The unlikely connection between these events only comes to light on the luxury liner St. Aphrodite during her maiden voyage.

Aboard it on a much needed vacation, Kogorou Mouri, his daughter Ran, Conan Edogawa, and the Detective Boys enjoy a trip provided by Sonoko Suzuki's family. But their fun is soon cut short when a game of hide-and-seek leads to Sonoko's disappearance. Some time later, the CEO of the Yashiro group, who built the St. Aphrodite, is found stabbed to death and her father missing. While the police's investigation turns to a dead end, Conan closes in on the culprit. Unwilling to be apprehended, the culprit threatens to blow up the St. Aphrodite and sink all her passengers.

As the ship's hull rapidly fills with water, the truth behind the vengeful murders is finally revealed. With no place to escape, Conan and Kogorou must wrestle with the elusive culprit before everyone on board is dragged to the ocean floor.

[Written by MAL Rewrite]",7.78,1077,3212,51692,30036,white,movie,finished_airing,"[{'id': 2, 'name': 'Adventure'}, {'id': 4, 'name': 'Comedy'}, {'id': 39, 'name': 'Detective'}, {'id': 7, 'name': 'Mystery'}, {'id': 27, 'name': 'Shounen'}]",1,manga,6600,pg_13,"[{'id': 73, 'name': 'TMS Entertainment'}]",252,,NIL,2005.0,spring,569,46371,271,286,4190,51687.0,0.9892,0.0108
4447,Meitantei Conan Movie 12: Senritsu no Full Score,2008-04-19,2008-04-19,"Serial murders involving all kinds have happened. All the victims are from a Music School led by a famous pianist. Conan and company have been invited to a opening concert of the Music Hall built by the pianist. The biggest attraction of this concert is the world famous violin called ""Stradivarius"" and a special appearance of a singer who has perfect pitch. 

(Source: ANN)",7.78,1078,3298,49253,28453,white,movie,finished_airing,"[{'id': 2, 'name': 'Adventure'}, {'id': 4, 'name': 'Comedy'}, {'id': 39, 'name': 'Detective'}, {'id': 7, 'name': 'Mystery'}, {'id': 27, 'name': 'Shounen'}]",1,manga,6960,pg_13,"[{'id': 73, 'name': 'TMS Entertainment'}]",253,,NIL,2008.0,spring,575,43737,282,315,4339,49248.0,0.9879,0.0121
