id,title,start_date,end_date,synopsis,mean,rank,popularity,num_list_users,num_scoring_users,nsfw,media_type,status,genres,num_episodes,source,average_episode_duration,rating,studios,bypopularity_ranking,broadcast_day_of_the_week,broadcast_start_time,start_season_year,start_season_season,statistics_watching,statistics_completed,statistics_on_hold,statistics_dropped,statistics_plan_to_watch,statistics_num_list_users,positive_viewership_fraction,negative_viewership_fraction
23283,Zankyou no Terror,2014-07-11,2014-09-26,"Painted in red, the word ""VON"" is all that is left behind after a terrorist attack on a nuclear facility in Japan. The government is shattered by their inability to act, and the police are left frantically searching for ways to crack down the perpetrators. The public are clueless—until, six months later, a strange video makes its way onto the internet. In it, two teenage boys who identify themselves only as ""Sphinx"" directly challenge the police, threatening to cause destruction and mayhem across Tokyo. Unable to stop the mass panic quickly spreading through the city and desperate for any leads in their investigation, the police struggle to act effectively against these terrorists, with Detective Kenjirou Shibazaki caught in the middle of it all.

Zankyou no Terror tells the story of Nine and Twelve, the two boys behind the masked figures of Sphinx. They should not exist, yet they stand strong in a world of deception and secrets while they make the city fall around them, all in the hopes of burying their own tragic truth.

[Written by MAL Rewrite]",8.08,537.0,122,1203565,634978,white,tv,finished_airing,"[{'id': 39, 'name': 'Detective'}, {'id': 7, 'name': 'Mystery'}, {'id': 40, 'name': 'Psychological'}, {'id': 41, 'name': 'Suspense'}]",11,original,1370,r,"[{'id': 569, 'name': 'MAPPA'}]",122,friday,00:50,2014.0,summer,55041,779532,27276,23576,318076,1203501.0,0.9577,0.0423
18897,Nisekoi,2014-01-11,2014-05-24,"Raku Ichijou, a first-year student at Bonyari High School, is the sole heir to an intimidating yakuza family. Ten years ago, Raku made a promise to his childhood friend. Now, all he has to go on is a pendant with a lock, which can only be unlocked with the key which the girl took with her when they parted.

Now, years later, Raku has grown into a typical teenager, and all he wants is to remain as uninvolved in his yakuza background as possible while spending his school days alongside his middle school crush Kosaki Onodera. However, when the American Bee Hive Gang invades his family's turf, Raku's idyllic romantic dreams are sent for a toss as he is dragged into a frustrating conflict: Raku is to pretend that he is in a romantic relationship with Chitoge Kirisaki, the beautiful daughter of the Bee Hive's chief, so as to reduce the friction between the two groups. Unfortunately, reality could not be farther from this whopping lie—Raku and Chitoge fall in hate at first sight, as the girl is convinced he is a pathetic pushover, and in Raku's eyes, Chitoge is about as attractive as a savage gorilla. 

Nisekoi follows the daily antics of this mismatched couple who have been forced to get along for the sake of maintaining the city's peace. With many more girls popping up his life, all involved with Raku's past somehow, his search for the girl who holds his heart and his promise leads him in more unexpected directions than he expects.

[Written by MAL Rewrite]",7.56,1699.0,123,1197072,671726,white,tv,finished_airing,"[{'id': 4, 'name': 'Comedy'}, {'id': 35, 'name': 'Harem'}, {'id': 22, 'name': 'Romance'}, {'id': 23, 'name': 'School'}, {'id': 27, 'name': 'Shounen'}]",20,manga,1460,pg_13,"[{'id': 44, 'name': 'Shaft'}]",123,saturday,23:30,2014.0,winter,57093,850476,29764,40600,219067,1197000.0,0.9412,0.0588
18153,Kyoukai no Kanata,2013-10-03,2013-12-19,"Mirai Kuriyama is the sole survivor of a clan of Spirit World warriors with the power to employ their blood as weapons. As such, Mirai is tasked with hunting down and killing ""youmu""—creatures said to be the manifestation of negative human emotions. One day, while deep in thought on the school roof, Mirai comes across Akihito Kanbara, a rare half-breed of youmu in human form. In a panicked state, she plunges her blood saber into him only to realize that he's an immortal being. From then on, the two form an impromptu friendship that revolves around Mirai constantly trying to kill Akihito, in an effort to boost her own wavering confidence as a Spirit World warrior. Eventually, Akihito also manages to convince her to join the Literary Club, which houses two other powerful Spirit World warriors, Hiroomi and Mitsuki Nase.

As the group's bond strengthens, however, so does the tenacity of the youmu around them. Their misadventures will soon turn into a fight for survival as the inevitable release of the most powerful youmu, Beyond the Boundary, approaches.

[Written by MAL Rewrite]",7.72,1220.0,124,1196256,562176,white,tv,finished_airing,"[{'id': 1, 'name': 'Action'}, {'id': 23, 'name': 'School'}, {'id': 37, 'name': 'Supernatural'}]",12,light_novel,1440,pg_13,"[{'id': 2, 'name': 'Kyoto Animation'}]",124,thursday,00:30,2013.0,fall,65015,718740,36767,36068,339579,1196169.0,0.9391,0.0609
35120,Devilman: Crybaby,2018-01-05,2018-01-05,"Devils cannot take form without a living host. However, if the will of an individual is strong enough, they can overcome the demon and make its power their own, becoming a Devilman.

Weak and unassuming, Akira Fudou has always had a bleeding heart. So when his childhood friend Ryou Asuka asks for his help in uncovering devils, Akira accepts without hesitation. However, to Akira's surprise, the place they go to is Sabbath: an immoral party of debauchery and degeneracy. Amidst bloodshed and death, demons possess the partiers, turning their bodies into grotesque monsters, and begin wreaking havoc. In a reckless attempt to save his best friend, Akira unwittingly merges with the devil Amon and becomes a Devilman, gaining the power to defeat the remaining demons.

Though it grants him great power, this new partnership awakens an insatiable and primeval part of Akira. Having the body of a devil but the same crybaby heart, Akira works alongside Ryou, destroying those that harm humanity and his loved ones.

[Written by MAL Rewrite]",7.75,1160.0,125,1194538,720539,white,ona,finished_airing,"[{'id': 1, 'name': 'Action'}, {'id': 5, 'name': 'Avant Garde'}, {'id': 58, 'name': 'Gore'}, {'id': 14, 'name': 'Horror'}, {'id': 6, 'name': 'Mythology'}, {'id': 27, 'name': 'Shounen'}, {'id': 37, 'name': 'Supernatural'}]",10,manga,1489,r+,"[{'id': 1591, 'name': 'Science SARU'}]",125,NIL,NIL,2018.0,winter,51192,875242,25195,37299,205562,1194490.0,0.9477,0.0523
19,Monster,2004-04-07,2005-09-28,"Dr. Kenzou Tenma, an elite neurosurgeon recently engaged to his hospital director's daughter, is well on his way to ascending the hospital hierarchy. That is until one night, a seemingly small event changes Dr. Tenma's life forever. While preparing to perform surgery on someone, he gets a call from the hospital director telling him to switch patients and instead perform life-saving brain surgery on a famous performer. His fellow doctors, fiancée, and the hospital director applaud his accomplishment; but because of the switch, a poor immigrant worker is dead, causing Dr. Tenma to have a crisis of conscience.

So when a similar situation arises, Dr. Tenma stands his ground and chooses to perform surgery on the young boy Johan Liebert instead of the town's mayor. Unfortunately, this choice leads to serious ramifications for Dr. Tenma—losing his social standing being one of them. However, with the mysterious death of the director and two other doctors, Dr. Tenma's position is restored. With no evidence to convict him, he is released and goes on to attain the position of hospital director. 

Nine years later when Dr. Tenma saves the life of a criminal, his past comes back to haunt him—once again, he comes face to face with the monster he operated on. He must now embark on a quest of pursuit to make amends for the havoc spread by the one he saved.

[Written by MAL Rewrite]",8.88,25.0,126,1187730,448259,white,tv,finished_airing,"[{'id': 50, 'name': 'Adult Cast'}, {'id': 8, 'name': 'Drama'}, {'id': 7, 'name': 'Mystery'}, {'id': 40, 'name': 'Psychological'}, {'id': 42, 'name': 'Seinen'}, {'id': 41, 'name': 'Suspense'}]",74,manga,1440,r+,"[{'id': 11, 'name': 'Madhouse'}]",126,wednesday,00:40,2004.0,spring,161416,439227,85345,38917,462763,1187668.0,0.8954,0.1046
37349,Goblin Slayer,2018-10-07,2018-12-30,"Goblins are known for their ferocity, cunning, and rapid reproduction, but their reputation as the lowliest of monsters causes their threat to be overlooked. Raiding rural civilizations to kidnap females of other species for breeding, these vile creatures are free to continue their onslaught as adventurers turn a blind eye in favor of more rewarding assignments with larger bounties.

To commemorate her first day as a Porcelain-ranked adventurer, the 15-year-old Priestess joins a band of young, enthusiastic rookies to investigate a tribe of goblins responsible for the disappearance of several village women. Unprepared and inexperienced, the group soon faces its inevitable demise from an ambush while exploring a cave. With no one else left standing, the terrified Priestess accepts her fate—until the Goblin Slayer unexpectedly appears to not only rescue her with little effort, but destroy the entire goblin nest. 

As a holder of the prestigious Silver rank, the Goblin Slayer allows her to accompany him as he assists the Adventurer's Guild in all goblin-related matters. Together with the Priestess, High Elf, Dwarf, and Lizardman, the armored warrior will not rest until every single goblin in the frontier lands has been eradicated for good.

[Written by MAL Rewrite]",7.42,2254.0,127,1168221,695897,white,tv,finished_airing,"[{'id': 1, 'name': 'Action'}, {'id': 2, 'name': 'Adventure'}, {'id': 10, 'name': 'Fantasy'}, {'id': 58, 'name': 'Gore'}]",12,light_novel,1420,r,"[{'id': 314, 'name': 'White Fox'}]",127,sunday,00:30,2018.0,fall,73769,862167,25678,58845,147659,1168118.0,0.9276,0.0724
31933,JoJo no Kimyou na Bouken Part 4: Diamond wa Kudakenai,2016-04-02,2016-12-24,"The year is 1999. Morioh, a normally quiet and peaceful town, has recently become a hotbed of strange activity. Joutarou Kuujou, now a marine biologist, heads to the mysterious town to meet Jousuke Higashikata. While the two may seem like strangers at first, Jousuke is actually the illegitimate child of Joutarou's grandfather, Joseph Joestar. When they meet, Joutarou realizes that he may have more in common with Jousuke than just a blood relation.

Along with the mild-mannered Kouichi Hirose and the boisterous Okuyasu Nijimura, the group dedicates themselves to investigating recent disappearances and other suspicious occurrences within Morioh. Aided by the power of Stands, the four men will encounter danger at every street corner, as it is up to them to unravel the town's secrets, before another occurs.

[Written by MAL Rewrite]",8.5,140.0,128,1168032,806091,white,tv,finished_airing,"[{'id': 1, 'name': 'Action'}, {'id': 2, 'name': 'Adventure'}, {'id': 27, 'name': 'Shounen'}, {'id': 31, 'name': 'Super Power'}]",39,manga,1422,r,"[{'id': 287, 'name': 'David Production'}]",128,saturday,00:30,2016.0,spring,61762,978511,17978,11015,98738,1168004.0,0.9752,0.0248
39587,Re:Zero kara Hajimeru Isekai Seikatsu 2nd Season,2020-07-08,2020-09-30,"A reunion that was supposed to spell the arrival of peaceful times is quickly shattered when Subaru Natsuki and Emilia return to Irlam village. Witnessing the devastation left behind by the calamities known as Sin Archbishops, Subaru sinks into the depths of despair as his ability to redo proves futile.

As the group makes their way to the Sanctuary in search of answers, Subaru has an unexpected encounter with the Witch of Greed—Echidna. Subjected to her untamed rhythm, he is forced to dive into the spirals of the past and future. At the same time, several mysterious threats set their sights on the Sanctuary, heralding a horrific fate for the hapless people trapped within.

Everlasting contracts, past sins, and unrequited love will clash and submerge into a river of blood in the second season of Re:Zero kara Hajimeru Isekai Seikatsu. Pushed to the brink of hopelessness, how long will Subaru's resolve to save his loved ones last?

[Written by MAL Rewrite]",8.33,252.0,129,1164995,679075,white,tv,finished_airing,"[{'id': 8, 'name': 'Drama'}, {'id': 10, 'name': 'Fantasy'}, {'id': 62, 'name': 'Isekai'}, {'id': 40, 'name': 'Psychological'}, {'id': 41, 'name': 'Suspense'}, {'id': 78, 'name': 'Time Travel'}]",13,light_novel,1588,r,"[{'id': 314, 'name': 'White Fox'}]",129,wednesday,22:30,2020.0,summer,89946,840475,22095,15392,197018,1164926.0,0.9678,0.0322
32282,Shokugeki no Souma: Ni no Sara,2016-07-02,2016-09-24,"The qualifiers of the Autumn Elections are now over, and only eight talented chefs remain. Now, they face off in one-on-one food wars, each with their own unique themes. Met with both new judges and new opponents all with their own specialties, Souma must stay on his toes if he hopes to make it to the top of both the Autumn Elections and Tootsuki Culinary Academy.

[Written by MAL Rewrite]",8.07,560.0,130,1162378,737174,white,tv,finished_airing,"[{'id': 9, 'name': 'Ecchi'}, {'id': 47, 'name': 'Gourmet'}, {'id': 23, 'name': 'School'}, {'id': 27, 'name': 'Shounen'}]",13,manga,1460,pg_13,"[{'id': 7, 'name': 'J.C.Staff'}]",130,saturday,22:00,2016.0,summer,44718,995136,12920,11721,97841,1162336.0,0.9788,0.0212
26055,JoJo no Kimyou na Bouken Part 3: Stardust Crusaders - Egypt-hen,2015-01-10,2015-06-20,"Joutarou Kuujou and his allies have finally made it to Egypt, where the immortal Dio awaits. Upon their arrival, the group gains a new comrade: Iggy, a mutt who wields the Stand ""The Fool."" It's not all good news however, as standing in their path is a new group of Stand users who serve Dio, each with a Stand representative of an ancient Egyptian god. As their final battle approaches, it is a race against time to break Joutarou's mother free from her curse and end Dio's reign of terror over the Joestar family once and for all.

[Written by MAL Rewrite]",8.44,167.0,131,1156425,820094,white,tv,finished_airing,"[{'id': 1, 'name': 'Action'}, {'id': 2, 'name': 'Adventure'}, {'id': 27, 'name': 'Shounen'}, {'id': 31, 'name': 'Super Power'}]",24,manga,1400,r,"[{'id': 287, 'name': 'David Production'}]",131,saturday,00:30,2015.0,winter,33093,1029707,8623,5477,79498,1156398.0,0.9878,0.0122
853,Ouran Koukou Host Club,2006-04-05,2006-09-27,"Haruhi Fujioka is a studious girl who has recently enrolled at the prestigious Ouran Academy. One day, while looking for a quiet and peaceful place to study, she stumbles across a seemingly unused music room. Upon entering, Haruhi is welcomed by the members of the well-known Host Club: a club in which attractive boys amuse girls from across the entire school. However, when Tamaki Suou—the founder and president of the club—startles the bright scholarship student, she accidentally breaks an expensive vase.

With repayment looking difficult for Haruhi, the Host Club members come up with the perfect solution to the girl's problem: work for the club and ultimately become a Host herself! Mistaken for a boy by her peers, Haruhi has to entertain various female students while coping with her fellow Hosts' extravagant personalities.

[Written by MAL Rewrite]
",8.16,450.0,132,1155483,695829,white,tv,finished_airing,"[{'id': 4, 'name': 'Comedy'}, {'id': 81, 'name': 'Crossdressing'}, {'id': 73, 'name': 'Reverse Harem'}, {'id': 22, 'name': 'Romance'}, {'id': 23, 'name': 'School'}, {'id': 25, 'name': 'Shoujo'}]",26,manga,1401,pg_13,"[{'id': 4, 'name': 'Bones'}]",132,wednesday,00:50,2006.0,spring,56498,875282,37439,35754,150477,1155450.0,0.9367,0.0633
34577,Nanatsu no Taizai: Imashime no Fukkatsu,2018-01-13,2018-06-30,"The fierce battle between Meliodas, the captain of the Seven Deadly Sins, and the Great Holy Knight Hendrickson has devastating consequences. Armed with the fragments necessary for the revival of the Demon Clan, Hendrickson breaks the seal, allowing the Commandments to escape, all of whom are mighty warriors working directly under the Demon King himself. Through a mysterious connection, Meliodas instantly identifies them; likewise, the 10 Commandments, too, seem to sense his presence.

As the demons leave a path of destruction in their wake, the Seven Deadly Sins must find a way to stop them before the Demon Clan drowns Britannia in blood and terror.

[Written by MAL Rewrite]",7.55,1750.0,133,1155053,719107,white,tv,finished_airing,"[{'id': 1, 'name': 'Action'}, {'id': 2, 'name': 'Adventure'}, {'id': 10, 'name': 'Fantasy'}, {'id': 27, 'name': 'Shounen'}]",24,manga,1467,pg_13,"[{'id': 56, 'name': 'A-1 Pictures'}]",133,saturday,06:30,2018.0,winter,63545,964467,12897,20433,93675,1155017.0,0.9711,0.0289
33255,Saiki Kusuo no Ψ-nan,2016-07-04,2016-12-26,"To the average person, psychic abilities might seem a blessing; for Kusuo Saiki, however, this could not be further from the truth. Gifted with a wide assortment of supernatural abilities ranging from telepathy to x-ray vision, he finds this so-called blessing to be nothing but a curse. As all the inconveniences his powers cause constantly pile up, all Kusuo aims for is an ordinary, hassle-free life—a life where ignorance is bliss.

Unfortunately, the life of a psychic is far from quiet. Though Kusuo tries to stay out of the spotlight by keeping his powers a secret from his classmates, he ends up inadvertently attracting the attention of many odd characters, such as the empty-headed Riki Nendou and the delusional Shun Kaidou. Forced to deal with the craziness of the people around him, Kusuo comes to learn that the ordinary life he has been striving for is a lot more difficult to achieve than expected.

[Written by MAL Rewrite]",8.41,189.0,134,1153269,644155,white,tv,finished_airing,"[{'id': 4, 'name': 'Comedy'}, {'id': 57, 'name': 'Gag Humor'}, {'id': 23, 'name': 'School'}, {'id': 27, 'name': 'Shounen'}, {'id': 31, 'name': 'Super Power'}]",120,manga,330,pg_13,"[{'id': 7, 'name': 'J.C.Staff'}, {'id': 1444, 'name': 'Egg Firm'}]",134,other,07:05,2016.0,summer,111138,743788,55814,41969,200505,1153214.0,0.9152,0.0848
11741,Fate/Zero 2nd Season,2012-04-08,2012-06-24,"As the Fourth Holy Grail War rages on with no clear victor in sight, the remaining Servants and their Masters are called upon by Church supervisor Risei Kotomine, in order to band together and confront an impending threat that could unravel the Grail War and bring about the destruction of Fuyuki City. The uneasy truce soon collapses as Masters demonstrate that they will do anything in their power, no matter how despicable, to win.

Seeds of doubt are sown between Kiritsugu Emiya and Saber, his Servant, as their conflicting ideologies on heroism and chivalry clash. Meanwhile, an ominous bond forms between Kirei Kotomine, who still seeks to find his purpose in life, and one of the remaining Servants. As the countdown to the end of the war reaches zero, the cost of winning begins to blur the line between victory and defeat.

[Written by MAL Rewrite]",8.54,124.0,135,1142836,726089,white,tv,finished_airing,"[{'id': 1, 'name': 'Action'}, {'id': 10, 'name': 'Fantasy'}, {'id': 82, 'name': 'Urban Fantasy'}]",12,light_novel,1440,r,"[{'id': 43, 'name': 'ufotable'}]",135,sunday,00:00,2012.0,spring,31947,923794,11712,7043,168295,1142791.0,0.9836,0.0164
17265,Log Horizon,2013-10-05,2014-03-22,"In the blink of an eye, thirty thousand bewildered Japanese gamers are whisked from their everyday lives into the world of the popular MMORPG, Elder Tale, after the game's latest update—unable to log out. Among them is the socially awkward college student Shiroe, whose confusion and shock lasts only a moment as, a veteran of the game, he immediately sets out to explore the limits of his new reality.

Shiroe must learn to live in this new world, leading others and negotiating with the NPC ""natives"" in order to bring stability to the virtual city of Akihabara. He is joined by his unfortunate friend Naotsugu, having logged in for the first time in years only to find himself trapped, and Akatsuki, a petite but fierce assassin who labels Shiroe as her master. A tale of fantasy, adventure, and politics, Log Horizon explores the elements of gaming through the eyes of a master strategist who attempts to make the best of a puzzling situation.

[Written by MAL Rewrite]",7.91,797.0,136,1142772,590311,white,tv,finished_airing,"[{'id': 1, 'name': 'Action'}, {'id': 50, 'name': 'Adult Cast'}, {'id': 2, 'name': 'Adventure'}, {'id': 10, 'name': 'Fantasy'}, {'id': 79, 'name': 'Video Game'}]",25,light_novel,1472,pg_13,"[{'id': 41, 'name': 'Satelight'}]",136,saturday,17:30,2013.0,fall,70324,741683,42084,50149,238420,1142660.0,0.9193,0.0807
48736,Sono Bisque Doll wa Koi wo Suru,2022-01-09,2022-03-27,"High school student Wakana Gojou spends his days perfecting the art of making hina dolls, hoping to eventually reach his grandfather's level of expertise. While his fellow teenagers busy themselves with pop culture, Gojou finds bliss in sewing clothes for his dolls. Nonetheless, he goes to great lengths to keep his unique hobby a secret, as he believes that he would be ridiculed were it revealed. 

Enter Marin Kitagawa, an extraordinarily pretty girl whose confidence and poise are in stark contrast to Gojou's meekness. It would defy common sense for the friendless Gojou to mix with the likes of Kitagawa, who is always surrounded by her peers. However, the unimaginable happens when Kitagawa discovers Gojou's prowess with a sewing machine and brightly confesses to him about her own hobby: cosplay. Because her sewing skills are pitiable, she decides to enlist his help.

As Gojou and Kitagawa work together on one cosplay outfit after another, they cannot help but grow close—even though their lives are worlds apart.

[Written by MAL Rewrite]
",8.16,451.0,137,1135762,687441,white,tv,finished_airing,"[{'id': 69, 'name': 'Otaku Culture'}, {'id': 22, 'name': 'Romance'}, {'id': 23, 'name': 'School'}, {'id': 42, 'name': 'Seinen'}]",12,manga,1420,pg_13,"[{'id': 1835, 'name': 'CloverWorks'}]",137,sunday,00:00,2022.0,winter,110085,835661,17649,25742,146480,1135617.0,0.9618,0.0382
14227,Tonari no Kaibutsu-kun,2012-10-02,2012-12-25,"Shizuku Mizutani is apathetic toward her classmates, only caring about her grades. However, her cold view of life begins to change when she meets Haru Yoshida, a violent troublemaker who stopped attending class after getting into a fight early in the school year. He is not much different from her, though—he too understands little about human nature and does not have any friends. Much to Shizuku's surprise, he proclaims that she will be his friend and immediately confesses his feelings toward her upon meeting her.
 
Because of her lack of friends and social interaction, Shizuku has a hard time understanding her relationship with Haru. But slowly, their friendship begins to progress, and she discovers that there is more to Haru than violence. She begins to  develop feelings for him, but is unsure what kind of emotions she is experiencing. Together, Shizuku and Haru explore the true nature of their relationship and emotions.

[Written by MAL Rewrite]",7.46,2063.0,138,1113617,622645,white,tv,finished_airing,"[{'id': 4, 'name': 'Comedy'}, {'id': 22, 'name': 'Romance'}, {'id': 23, 'name': 'School'}, {'id': 25, 'name': 'Shoujo'}]",13,manga,1462,pg_13,"[{'id': 112, 'name': ""Brain's Base""}]",138,tuesday,01:35,2012.0,fall,50927,820244,26475,26495,189407,1113548.0,0.9524,0.0476
51009,Jujutsu Kaisen 2nd Season,2023-07-06,2023-12-28,"The year is 2006, and the halls of Tokyo Prefectural Jujutsu High School echo with the endless bickering and intense debate between two inseparable best friends. Exuding unshakeable confidence, Satoru Gojou and Suguru Getou believe there is no challenge too great for young and powerful Special Grade sorcerers such as themselves. They are tasked with safely delivering a sensible girl named Riko Amanai to the entity whose existence is the very essence of the jujutsu world. However, the mission plunges them into an exhausting swirl of moral conflict that threatens to destroy the already feeble amity between sorcerers and ordinary humans.

Twelve years later, students and sorcerers are the frontline defense against the rising number of high-level curses born from humans' negative emotions. As the entities grow in power, their self-awareness and ambition increase too. The curses unite for the common goal of eradicating humans and creating a world of only cursed energy users, led by a dangerous, ancient cursed spirit. To dispose of their greatest obstacle—the strongest sorcerer, Gojou—they orchestrate an attack at Shibuya Station on Halloween. Dividing into teams, the sorcerers enter the fight prepared to risk everything to protect the innocent and their own kind.

[Written by MAL Rewrite]",8.78,34.0,139,1101597,611454,white,tv,finished_airing,"[{'id': 1, 'name': 'Action'}, {'id': 58, 'name': 'Gore'}, {'id': 23, 'name': 'School'}, {'id': 27, 'name': 'Shounen'}, {'id': 37, 'name': 'Supernatural'}]",23,manga,1435,r,"[{'id': 569, 'name': 'MAPPA'}]",139,thursday,23:56,2023.0,summer,191912,710092,15148,7666,176667,1101485.0,0.9793,0.0207
