id,title,start_date,end_date,synopsis,mean,rank,popularity,num_list_users,num_scoring_users,nsfw,media_type,status,genres,num_episodes,source,average_episode_duration,rating,studios,movie_ranking,broadcast_day_of_the_week,broadcast_start_time,start_season_year,start_season_season,statistics_watching,statistics_completed,statistics_on_hold,statistics_dropped,statistics_plan_to_watch,statistics_num_list_users,positive_viewership_fraction,negative_viewership_fraction
39486,Gintama: The Final,2021-01-08,2021-01-08,"Two years have passed following the Tendoshuu's invasion of the O-Edo Central Terminal. Since then, the Yorozuya have gone their separate ways. Foreseeing Utsuro's return, Gintoki Sakata begins surveying Earth's ley lines for traces of the other man's Altana. After an encounter with the remnants of the Tendoshuu—who continue to press on in search of immortality—Gintoki returns to Edo.

Later, the regrouped Shinsengumi and Yorozuya begin an attack on the occupied Central Terminal. With the Altana harvested by the wreckage of the Tendoshuu's ship in danger of detonating, the Yorozuya and their allies fight their enemies while the safety of Edo—and the rest of the world—hangs in the balance. Fulfilling the wishes of their teacher, Shouyou Yoshida's former students unite and relive their pasts one final time in an attempt to save their futures.

[Written by MAL Rewrite]
",9.04,7,1537,160484,76758,white,movie,finished_airing,"[{'id': 1, 'name': 'Action'}, {'id': 4, 'name': 'Comedy'}, {'id': 8, 'name': 'Drama'}, {'id': 57, 'name': 'Gag Humor'}, {'id': 13, 'name': 'Historical'}, {'id': 20, 'name': 'Parody'}, {'id': 21, 'name': 'Samurai'}, {'id': 24, 'name': 'Sci-Fi'}, {'id': 27, 'name': 'Shounen'}]",1,manga,6240,pg_13,"[{'id': 1258, 'name': 'Bandai Namco Pictures'}]",1,,NIL,2021.0,winter,7246,88689,1707,1574,61259,160475.0,0.9796,0.0204
28851,Koe no Katachi,2016-09-17,2016-09-17,"As a wild youth, elementary school student Shouya Ishida sought to beat boredom in the cruelest ways. When the deaf Shouko Nishimiya transfers into his class, Shouya and the rest of his class thoughtlessly bully her for fun. However, when her mother notifies the school, he is singled out and blamed for everything done to her. With Shouko transferring out of the school, Shouya is left at the mercy of his classmates. He is heartlessly ostracized all throughout elementary and middle school, while teachers turn a blind eye.

Now in his third year of high school, Shouya is still plagued by his wrongdoings as a young boy. Sincerely regretting his past actions, he sets out on a journey of redemption: to meet Shouko once more and make amends.

Koe no Katachi tells the heartwarming tale of Shouya's reunion with Shouko and his honest attempts to redeem himself, all while being continually haunted by the shadows of his past.
 
[Written by MAL Rewrite]",8.93,19,20,2419998,1670366,white,movie,finished_airing,"[{'id': 46, 'name': 'Award Winning'}, {'id': 8, 'name': 'Drama'}, {'id': 27, 'name': 'Shounen'}]",1,manga,7803,pg_13,"[{'id': 2, 'name': 'Kyoto Animation'}]",2,,NIL,2016.0,summer,51746,2079147,6795,3424,278740,2419852.0,0.9958,0.0042
15335,Gintama Movie 2: Kanketsu-hen - Yorozuya yo Eien Nare,2013-07-06,2013-07-06,"When Gintoki apprehends a movie pirate at a premiere, he checks the camera's footage and finds himself transported to a bleak, post-apocalyptic version of Edo, where a mysterious epidemic called the ""White Plague"" has ravished the world's population. It turns out that the movie pirate wasn't a pirate after all—it was an android time machine, and Gintoki has been hurtled five years into the future! Shinpachi and Kagura, his Yorozuya cohorts, have had a falling out and are now battle-hardened solo vigilantes and he himself has been missing for years, disappearing without a trace after scribbling a strange message in his journal.

Setting out in the disguise given to him by the android time machine, Gintoki haphazardly reunites the Yorozuya team to investigate the White Plague, and soon discovers that the key to saving the future lies in the darkness of his own past. Determined to confront a powerful foe, he makes an important discovery—with a ragtag band of friends and allies at his side, he doesn't have to fight alone.

[Written by MAL Rewrite]",8.9,22,1027,247061,138344,white,movie,finished_airing,"[{'id': 1, 'name': 'Action'}, {'id': 4, 'name': 'Comedy'}, {'id': 57, 'name': 'Gag Humor'}, {'id': 13, 'name': 'Historical'}, {'id': 20, 'name': 'Parody'}, {'id': 21, 'name': 'Samurai'}, {'id': 24, 'name': 'Sci-Fi'}, {'id': 27, 'name': 'Shounen'}, {'id': 78, 'name': 'Time Travel'}]",1,manga,6600,pg_13,"[{'id': 14, 'name': 'Sunrise'}]",3,,NIL,2013.0,summer,5584,175070,1821,1845,62736,247056.0,0.9852,0.0148
37987,Violet Evergarden Movie,2020-09-18,2020-09-18,"Several years have passed since the end of The Great War. As the radio tower in Leidenschaftlich continues to be built, telephones will soon become more relevant, leading to a decline in demand for ""Auto Memory Dolls."" Even so, Violet Evergarden continues to rise in fame after her constant success with writing letters. However, sometimes the one thing you long for is the one thing that does not appear.

Violet Evergarden Movie follows Violet as she continues to comprehend the concept of emotion and the meaning of love. At the same time, she pursues a glimmer of hope that the man who once told her, ""I love you,"" may still be alive even after the many years that have passed.

[Written by MAL Rewrite]",8.85,28,343,648702,296587,white,movie,finished_airing,"[{'id': 46, 'name': 'Award Winning'}, {'id': 8, 'name': 'Drama'}]",1,light_novel,8400,pg_13,"[{'id': 2, 'name': 'Kyoto Animation'}]",4,,NIL,2020.0,summer,18369,382197,5273,2138,240692,648669.0,0.9886,0.0114
32281,Kimi no Na wa.,2016-08-26,2016-08-26,"Mitsuha Miyamizu, a high school girl, yearns to live the life of a boy in the bustling city of Tokyo—a dream that stands in stark contrast to her present life in the countryside. Meanwhile in the city, Taki Tachibana lives a busy life as a high school student while juggling his part-time job and hopes for a future in architecture.

One day, Mitsuha awakens in a room that is not her own and suddenly finds herself living the dream life in Tokyo—but in Taki's body! Elsewhere, Taki finds himself living Mitsuha's life in the humble countryside. In pursuit of an answer to this strange phenomenon, they begin to search for one another.

Kimi no Na wa. revolves around Mitsuha and Taki's actions, which begin to have a dramatic impact on each other's lives, weaving them into a fabric held together by fate and circumstance.

[Written by MAL Rewrite]",8.83,29,11,2834958,1959014,white,movie,finished_airing,"[{'id': 46, 'name': 'Award Winning'}, {'id': 8, 'name': 'Drama'}]",1,original,6391,pg_13,"[{'id': 291, 'name': 'CoMix Wave Films'}]",5,,NIL,2016.0,summer,64225,2455019,7441,4062,304078,2834825.0,0.9959,0.0041
31758,Kizumonogatari III: Reiketsu-hen,2017-01-06,2017-01-06,"After helping revive the legendary vampire Kiss-shot Acerola-orion Heart-under-blade, Koyomi Araragi has become a vampire himself and her servant. Kiss-shot is certain she can turn him back into a human, but only once regaining her full power. 

Araragi has hunted down the three vampire hunters that defeated Kiss-shot and retrieved her limbs to return her to full strength. However, now that Araragi has almost accomplished what he’s been fighting for this whole time, he has to consider if this is what he really wants. Once he revives this powerful immortal vampire, there is no telling what she might do, and there would be no way of stopping her.

But there is more to the story that Araragi doesn’t understand. If a newborn vampire like him could defeat the hunters, how did they overpower Kiss-shot? Can he trust her to turn him back to a human? And how is that even possible in the first place?

Araragi is at his limit but he must come to a decision, and it may not be possible to resolve this situation without doing something he’ll regret…

[Written by MAL Rewrite]",8.78,35,491,479810,279698,white,movie,finished_airing,"[{'id': 1, 'name': 'Action'}, {'id': 7, 'name': 'Mystery'}, {'id': 37, 'name': 'Supernatural'}, {'id': 32, 'name': 'Vampire'}]",1,light_novel,4980,r,"[{'id': 44, 'name': 'Shaft'}]",6,,NIL,2017.0,winter,11963,352000,3083,1648,111087,479781.0,0.9901,0.0099
199,Sen to Chihiro no Kamikakushi,2001-07-20,2001-07-20,"Stubborn, spoiled, and naïve, 10-year-old Chihiro Ogino is less than pleased when she and her parents discover an abandoned amusement park on the way to their new house. Cautiously venturing inside, she realizes that there is more to this place than meets the eye, as strange things begin to happen once dusk falls. Ghostly apparitions and food that turns her parents into pigs are just the start—Chihiro has unwittingly crossed over into the spirit world. Now trapped, she must summon the courage to live and work amongst spirits, with the help of the enigmatic Haku and the cast of unique characters she meets along the way.

Vivid and intriguing, Sen to Chihiro no Kamikakushi tells the story of Chihiro's journey through an unfamiliar world as she strives to save her parents and return home.

[Written by MAL Rewrite]",8.77,41,44,1911875,1336856,white,movie,finished_airing,"[{'id': 2, 'name': 'Adventure'}, {'id': 46, 'name': 'Award Winning'}, {'id': 10, 'name': 'Fantasy'}, {'id': 6, 'name': 'Mythology'}]",1,original,7475,pg,"[{'id': 21, 'name': 'Studio Ghibli'}]",7,,NIL,2001.0,summer,26676,1728916,4897,2271,149047,1911807.0,0.9963,0.0037
52198,Kaguya-sama wa Kokurasetai: First Kiss wa Owaranai,2022-12-17,2022-12-17,"After their first kiss, Kaguya Shinomiya and Miyuki Shirogane are left unsure where their relationship stands. The troubling uncertainty of whether they could be considered an official couple unleashes newfound problems as both Kaguya and Shirogane struggle to sort out their feelings.

While the lovestruck student council officers fret, the Christmas season rolls around, and romance is in the air. In the face of widespread tenderness, Kaguya and Shirogane must endure their affectionate battle of wits once more. Should they reconcile their feelings for one another, they may find themselves within reach of what they have both been longing for so long: true love.

[Written by MAL Rewrite]",8.75,47,847,303896,167645,white,movie,finished_airing,"[{'id': 4, 'name': 'Comedy'}, {'id': 8, 'name': 'Drama'}, {'id': 22, 'name': 'Romance'}, {'id': 23, 'name': 'School'}, {'id': 42, 'name': 'Seinen'}]",1,manga,5760,pg_13,"[{'id': 56, 'name': 'A-1 Pictures'}]",8,,NIL,2022.0,fall,10361,212892,2239,764,77605,303861.0,0.9901,0.0099
45649,The First Slam Dunk,2022-12-03,2022-12-03,"Shohoku's ""speedster"" and point guard, Ryouta Miyagi, always plays with brains and lightning speed, running circles around his opponents while feigning composure. Born and raised in Okinawa, Ryouta had a brother who was three years older. Following in the footsteps of his older brother, who was a famous local player from a young age, Ryouta also became addicted to basketball.

In his second year of high school, Ryouta plays with the Shohoku High School basketball team along with Sakuragi, Rukawa, Akagi, and Mitsui as they take the stage at the Inter-High School National Championship. And now, they are on the brink of challenging the reigning champions, Sannoh Kogyo High School.

(Source: GKIDS, edited)",8.74,48,3066,56492,24502,white,movie,finished_airing,"[{'id': 46, 'name': 'Award Winning'}, {'id': 23, 'name': 'School'}, {'id': 27, 'name': 'Shounen'}, {'id': 30, 'name': 'Sports'}, {'id': 77, 'name': 'Team Sports'}]",1,manga,7440,pg_13,"[{'id': 18, 'name': 'Toei Animation'}, {'id': 1111, 'name': 'DandeLion Animation Studio'}]",9,,NIL,2022.0,fall,2365,29112,542,364,24103,56486.0,0.984,0.016
58125,Look Back,2024-06-28,2024-06-28,"Ayumu Fujino may only be in the fourth grade, but she already basks in high praise for her hand-drawn four-panel comics featured in the school's newspaper. However, when she is asked to share the page with Kyoumoto—a reclusive student she has never met—Fujino feels inadequate for the first time: her free-spirited drawings look embarrassingly amateurish next to Kyoumoto's breathtakingly detailed art.

For a year, Fujino shuts out the world, obsessively studying manga creation and drawing tirelessly to catch up to her faceless competition. But Kyoumoto's talent far exceeds hers, and Fujino quits it all. Another year passes, and on the day of their graduation, Fujino finally meets Kyoumoto. This unkempt, shy, and stuttering girl has actually been Fujino's biggest fan all along. Their encounter reignites Fujino's passion for art and sparks the beginning of a years-long friendship built on rivalry, admiration, and their shared love of manga.

[Written by MAL Rewrite]",8.72,57,2047,110810,52098,white,movie,finished_airing,"[{'id': 8, 'name': 'Drama'}, {'id': 69, 'name': 'Otaku Culture'}, {'id': 27, 'name': 'Shounen'}]",1,manga,3433,pg_13,"[{'id': 2196, 'name': 'Studio DURIAN'}]",10,,NIL,2024.0,spring,4207,59394,727,110,46366,110804.0,0.9924,0.0076
431,Howl no Ugoku Shiro,2004-11-20,2004-11-20,"That jumbled piece of architecture, that cacophony of hissing steam and creaking joints, with smoke billowing from it as it moves on its own... That castle is home to the magnificent wizard Howl, infamous for both his magical prowess and for being a womanizer—or so the rumor goes in Sophie Hatter's small town. Sophie, as the plain daughter of a hatmaker, does not expect much from her future and is content with working hard in the shop. 

However, Sophie's simple life takes a turn for the exciting when she is ensnared in a disturbing situation, and the mysterious wizard appears to rescue her. Unfortunately, this encounter, brief as it may be, spurs the vain and vengeful Witch of the Waste—in a fit of jealousy caused by a past discord with Howl—to put a curse on the maiden, turning her into an old woman.

In an endeavor to return to normal, Sophie must accompany Howl and a myriad of eccentric companions—ranging from a powerful fire demon to a hopping scarecrow—in his living castle, on a dangerous adventure as a raging war tears their kingdom apart.

[Written by MAL Rewrite]",8.67,72,100,1390591,960391,white,movie,finished_airing,"[{'id': 2, 'name': 'Adventure'}, {'id': 46, 'name': 'Award Winning'}, {'id': 8, 'name': 'Drama'}, {'id': 10, 'name': 'Fantasy'}, {'id': 22, 'name': 'Romance'}]",1,novel,7149,g,"[{'id': 21, 'name': 'Studio Ghibli'}]",11,,NIL,2004.0,fall,17504,1248295,3813,1502,119429,1390543.0,0.9962,0.0038
164,Mononoke Hime,1997-07-12,1997-07-12,"When an Emishi village is attacked by a fierce demon boar, the young prince Ashitaka puts his life at stake to defend his tribe. With its dying breath, the beast curses the prince's arm, granting him demonic powers while gradually siphoning his life away. Instructed by the village elders to travel westward for a cure, Ashitaka arrives at Tatara, the Iron Town, where he finds himself embroiled in a fierce conflict: Lady Eboshi of Tatara, promoting constant deforestation, stands against Princess San and the sacred spirits of the forest, who are furious at the destruction brought by the humans. As the opposing forces of nature and mankind begin to clash in a desperate struggle for survival, Ashitaka attempts to seek harmony between the two, all the while battling the latent demon inside of him. Princess Mononoke is a tale depicting the connection of technology and nature, while showing the path to harmony that could be achieved by mutual acceptance.

[Written by MAL Rewrite]",8.66,74,106,1297255,836918,white,movie,finished_airing,"[{'id': 1, 'name': 'Action'}, {'id': 2, 'name': 'Adventure'}, {'id': 46, 'name': 'Award Winning'}, {'id': 10, 'name': 'Fantasy'}]",1,original,8002,pg_13,"[{'id': 21, 'name': 'Studio Ghibli'}]",12,,NIL,1997.0,summer,19956,1090066,5247,2169,179775,1297213.0,0.9943,0.0057
33050,Fate/stay night Movie: Heaven's Feel - III. Spring Song,2020-08-15,2020-08-15,"The Fifth Holy Grail War in Fuyuki City has reached a turning point in which the lives of all participants are threatened as the hidden enemy finally reveals itself. As Shirou Emiya, Rin Toosaka, and Illyasviel von Einzbern discover the true, corruptive nature of the shadow that has been rampaging throughout the city, they realize just how dire the situation is. In order to protect their beloved ones, the group must hold their own against the seemingly insurmountable enemy force—even if some of those foes were once their allies, or perhaps, something more intimate.

As the final act of this chaotic war commences, the ideals Shirou believes will soon be challenged by an excruciating dilemma: is it really possible to save a world where everything seems to have gone wrong?

[Written by MAL Rewrite]",8.65,78,672,368573,198413,white,movie,finished_airing,"[{'id': 1, 'name': 'Action'}, {'id': 10, 'name': 'Fantasy'}, {'id': 82, 'name': 'Urban Fantasy'}]",1,visual_novel,7320,r,"[{'id': 43, 'name': 'ufotable'}]",13,,NIL,2020.0,summer,9600,246679,2430,1164,108667,368540.0,0.9902,0.0098
52742,Haikyuu!! Movie: Gomisuteba no Kessen,2024-02-16,2024-02-16,"Kenma Kozume has never considered volleyball fun or thrilling: it is merely something he is good at. But now Nekoma High School's volleyball team has qualified for the Spring Nationals and prepares to battle their long-standing rivals—Karasuno. Now, Kenma has to analyze the most confounding and resilient team and lead Nekoma to victory against them. Moreover, he will play against his friend Shouyou Hinata, Karasuno's short but incredibly proficient middle blocker.

Karasuno has never been able to beat Nekoma in practice matches. Even so, despite his usual indifference, Kenma feels a tinge of excitement at the prospect of facing Karasuno in a high-stakes official game with no do-overs. To advance to the semifinals and ultimately restore their team's former glory, Karasuno must find a way to overcome Kenma's brilliant strategy and defeat Nekoma in their own territory.

[Written by MAL Rewrite]",8.63,86,1539,160210,56111,white,movie,finished_airing,"[{'id': 23, 'name': 'School'}, {'id': 27, 'name': 'Shounen'}, {'id': 30, 'name': 'Sports'}, {'id': 77, 'name': 'Team Sports'}]",1,manga,5068,pg_13,"[{'id': 10, 'name': 'Production I.G'}]",14,,NIL,2024.0,winter,5432,68800,1156,241,84581,160210.0,0.9913,0.0087
36862,Made in Abyss Movie 3: Fukaki Tamashii no Reimei,2020-01-17,2020-01-17,"After bonding over a tragic loss, the long-suffering Nanachi joins Riko and Reg on their journey into the depths of the Abyss. Awaiting the children is the Sea of Corpses—the Abyss's fifth layer, and the deepest level from which a traveler can return without losing their human form.

The masked sadist Bondrewd stands between the children and the rest of their adventure. Bondrewd's horrific laboratory serves as a final checkpoint for those wishing to traverse deeper into the Abyss, and the sociopathic scientist has no desire to allow Riko's party to pass through at no cost. Deeply scarred by Bondrewd's impact on their childhood, Nanachi is engulfed in turmoil over his resurgence in their life.

Bondrewd's only apparent weakness is Prushka, a brash child who claims to be his daughter. Riko, Reg, and Nanachi befriend Prushka and work with the girl to overcome her father's machinations and breach the Abyss's sixth layer.

[Written by MAL Rewrite]",8.61,93,484,488755,272857,white,movie,finished_airing,"[{'id': 2, 'name': 'Adventure'}, {'id': 8, 'name': 'Drama'}, {'id': 10, 'name': 'Fantasy'}, {'id': 58, 'name': 'Gore'}, {'id': 7, 'name': 'Mystery'}, {'id': 24, 'name': 'Sci-Fi'}]",1,web_manga,6300,r,"[{'id': 290, 'name': 'Kinema Citrus'}]",15,,NIL,2020.0,winter,8998,345093,2175,947,131511,488724.0,0.9936,0.0064
7311,Suzumiya Haruhi no Shoushitsu,2010-02-06,2010-02-06,"On a cold December day, Kyon arrives at school prepared for another outing with his fellow SOS Brigade members. However, much to his surprise, he discovers that almost everything has changed completely: Haruhi Suzumiya and Itsuki Koizumi are nowhere to be found; Mikuru Asahina does not recognize him at all; Yuki Nagato is a regular human; and Ryouko Asakura has mysteriously returned. Although he is no stranger to the supernatural, Kyon is disturbed by this odd turn of events and decides to investigate on his own.

Finding himself to be the only person that is aware of the previous reality, Kyon is now faced with a difficult choice: to finally live the normal life he has always wanted, or uncover a way to turn back the hands of time and restore his chaotic yet familiar world.

[Written by MAL Rewrite]
",8.6,99,365,623064,316843,white,movie,finished_airing,"[{'id': 46, 'name': 'Award Winning'}, {'id': 7, 'name': 'Mystery'}, {'id': 23, 'name': 'School'}, {'id': 24, 'name': 'Sci-Fi'}, {'id': 37, 'name': 'Supernatural'}]",1,light_novel,9707,pg_13,"[{'id': 2, 'name': 'Kyoto Animation'}]",16,,NIL,2010.0,winter,16388,402970,6572,5253,191851,623034.0,0.981,0.019
38329,Seishun Buta Yarou wa Yumemiru Shoujo no Yume wo Minai,2019-06-15,2019-06-15,"Six months ago, Sakuta Azusagawa had a chance encounter with a bunny girl in a library. Ever since then, he's been blissfully happy with his girlfriend: Mai Sakurajima, that same bunny girl. However, the reappearance of his mysterious first crush, the now-adult Shouko Makinohara, adds a new complication to his relationship with Mai. To make matters worse, he then encounters a middle school Shouko in the hospital, suffering from a grave illness. Mysteriously, his old scars begin throbbing whenever he's near her.

With Shouko's bizarre situation somehow revolving around him, Sakuta will need to come to terms with his own conflicting feelings, for better or worse. With a girl's life in his hands, just what can he do?

[Written by MAL Rewrite]",8.59,100,285,742467,468702,white,movie,finished_airing,"[{'id': 8, 'name': 'Drama'}, {'id': 22, 'name': 'Romance'}, {'id': 23, 'name': 'School'}, {'id': 37, 'name': 'Supernatural'}]",1,light_novel,5400,pg_13,"[{'id': 1835, 'name': 'CloverWorks'}]",17,,NIL,2019.0,spring,17284,586080,4272,2239,132538,742413.0,0.9912,0.0088
3786,Shin Evangelion Movie:||,2021-03-08,2021-03-08,"Following NERV's failed attempt to retrieve the Spears of Longinus and carry out the Human Instrumentality Project, the destruction caused by the Fourth Impact has been largely averted. In a state of disarray, Shinji Ikari, Asuka Langley Shikinami, and Rei Ayanami travel to Village 3—a survivor settlement free from Earth's ruination. There, Shinji slowly comes to terms with his past, developing an entirely different life from his days as an Evangelion pilot.

Meanwhile, NERV makes preparations to continue the Instrumentality Project by means of a new Impact. When WILLE's main aerial battleship arrives at the village, Shinji decides to board, believing that he can help by piloting an Evangelion. As new secrets are uncovered and a battle between WILLE and NERV approaches, the future of Earth hangs in the balance. Can Shinji save humanity and the rest of the world one last time?

[Written by MAL Rewrite]",8.59,101,630,391127,170903,white,movie,finished_airing,"[{'id': 1, 'name': 'Action'}, {'id': 46, 'name': 'Award Winning'}, {'id': 8, 'name': 'Drama'}, {'id': 18, 'name': 'Mecha'}, {'id': 40, 'name': 'Psychological'}, {'id': 24, 'name': 'Sci-Fi'}, {'id': 41, 'name': 'Suspense'}]",1,original,9300,pg_13,"[{'id': 47, 'name': 'Khara'}]",18,,NIL,2021.0,winter,6723,214096,1898,886,167512,391115.0,0.9929,0.0071
4565,Tengen Toppa Gurren Lagann Movie 2: Lagann-hen,2009-04-22,2009-04-22,"Humans have enjoyed their lavish, peaceful, and prosperous lives for seven years since the day the almighty Spiral King was defeated—the day they reclaimed their homeland, Earth. However, the boon of this lifestyle leaves them unprepared when an unknown, hostile threat arises due to the ever-growing human population. This calamity is the Anti-Spiral—a fearsome enemy with unparalleled power. 
 
As the Spiral King's prognosis postulating the destruction of ""The Spiral's World"" begins to come true, the pieces are in place, and Team Dai-Gurren is ready. With his late brother's hope to see a better future for mankind, Simon—along with Nia Teppelin and the rest of the team—is determined to overthrow the mighty Anti-Spiral in order to revive humanity's lost hope.

[Written by MAL Rewrite]
",8.59,102,1145,223774,105667,white,movie,finished_airing,"[{'id': 1, 'name': 'Action'}, {'id': 18, 'name': 'Mecha'}, {'id': 24, 'name': 'Sci-Fi'}, {'id': 29, 'name': 'Space'}, {'id': 31, 'name': 'Super Power'}]",1,original,7553,r+,"[{'id': 6, 'name': 'Gainax'}]",19,,NIL,2009.0,spring,5464,150193,1960,1360,64788,223765.0,0.9852,0.0148
